O	Pflegepersonen besteht zu weiten Teilen aus Routinehandlungen:	56.70001220703125	643.9698486328125	12.0	350.17681884765625	242
O	"[…]meine Aufgabe […], die Pflege mit dem also, dass der Bewohner gepflegt wird, das	76.55999755859375	676.4807739257812	10.979995727539062	442.19537353515625	243
O	fängt an mit dem Frühdienst, also Waschen, Frühstück geben, Versorgung, Mobilisierung,	76.55999755859375	689.1407470703125	10.979995727539062	442.1590576171875	243
O	Arztvisiten und, ja, was er eben auch an persönlichen Dingen braucht, Angehörige werden	76.55999755859375	701.8006591796875	10.979995727539062	442.19537353515625	243
O	mit einbezogen, ja, Mittagessen, dann Dienstübergabe, dann müssen wir unsere Doku-	76.55999755859375	714.4606323242188	10.980003356933594	442.0667724609375	243
O	mentationen führen, Evaluierungen machen, alles eintragen, was an Tagesereignissen	76.55999755859375	727.1205444335938	10.980003356933594	442.14044189453125	243
O	war und, ja, dass seine Betreuung, die er eben braucht, dass er die dann eben auch hat.	76.55999755859375	739.780517578125	10.980003356933594	442.16900634765625	243
O	Die vom Arzt festgelegten Verordnungen, dass die durchgeführt werden, wenn zum Bei-	76.55999755859375	752.3745727539062	10.980003356933594	442.0799560546875	243
O	no 05/2009	267.722412109375	57.6497802734375	12.0	60.10321044921875	244
O	- 19 -	510.2916259765625	57.6497802734375	12.0	28.07159423828125	245
O	spiel Hilfsmittel gebraucht werden und so. Spätdienst mache ich auch, also dann ist klar,	76.55999755859375	115.30072021484375	10.98004150390625	442.25677490234375	246
O	dann ich bekomme die Information vom Frühdienst, mache dann meine Spätdienstarbeit,	76.55999755859375	127.96063232421875	10.98004150390625	442.1317138671875	246
O	also Medizin richten und Versorgen, also Getränke anbieten und Inkontinenzversorgung,	76.55999755859375	140.62054443359375	10.98004150390625	442.1854248046875	246
O	Baden, Waschen, Grundversorgung, ja, dann den Bewohner also nach dem Abendessen	76.55999755859375	153.214599609375	10.98004150390625	442.10748291015625	246
O	wieder ins Bett bringen, Lagerung durchführen […]" (Pflegekraft, A05#P12: 20090624,	76.55999755859375	165.87451171875	10.98004150390625	442.23486328125	246
O	06:48)	76.55999755859375	178.534423828125	10.98004150390625	31.188690185546875	246
O	Über die umfassende Grundpflege, folglich die Körperpflege, die Ernährung, das An- und	56.70000076293945	209.329833984375	12.0	481.91999435424805	247
O	Auskleiden, bis hin zur Behandlungspflege, demnach medizinischer Versorgung, reicht	56.70001220703125	230.02984619140625	12.0	481.797607421875	248
O	hier folglich das Spektrum der Tätigkeiten, die sich je nach Arbeitsschicht (Früh-, Spät-	56.70001220703125	250.7298583984375	12.0	481.8359375	249
O	und Nachtdienst) und Kenntnis-/ Ausbildungsstand unterschiedlich gestalten. Diese Pfle-	56.70001220703125	271.42987060546875	12.0	481.79522705078125	250
O	gehandlungen sind hoch komplex, sie werden als zuverlässige Bewältigungsformen (- fle-	56.70001220703125	292.1298828125	12.0	481.88397216796875	251
O	xible Routinen -) von Situationen (individuell) hergestellt, und über wiederholte und lang-	56.70001220703125	312.82989501953125	12.0	481.783203125	252
O	fristige Vollführung erworben. Sie verinnerlichen diese Handlungsweisen/ -formen dauer-	56.70001220703125	333.5299072265625	12.0	481.94403076171875	253
O	haft, bilden die unbewusste, die einverleibte Grundlage für die Praxis (vgl. Working Brief	56.70001220703125	354.22991943359375	12.0	481.82281494140625	254
O	3).	56.700042724609375	374.929931640625	12.0	14.035202026367188	255
O	Freilich sind diese Zusammenhänge keine reinen Automatismen, dementsprechend nicht	56.700042724609375	407.62994384765625	12.0	481.7867736816406	256
O	vollständig rationalisier- und planbar. Sie bedürfen einer fortwährenden, mühsamen Über-	56.700042724609375	428.3299560546875	12.0	481.9007873535156	257
O	windung der Diskrepanz zwischen dem (instrumentellen) Pflegehandeln und den individu-	56.700042724609375	449.02996826171875	12.0	481.7951354980469	258
O	ellen Bedürfnissen und Anforderungen der Bewohner (den pflegebedürftigen Senioren).	56.70001220703125	469.72998046875	12.0	481.8743896484375	259
O	Hier gilt es gleichzeitig der 'Tagesform' der Bewohner und den organisatorischen Belan-	56.70001220703125	490.42999267578125	12.0	481.82635498046875	260
O	gen zu entsprechen.	56.70001220703125	511.07000732421875	12.0	108.72718811035156	261
O	"Also, also ich merke, dass die Bewohner viel Ansprache brauchen und dass sie zum Bei-	76.55999755859375	543.6406860351562	10.97998046875	442.1689453125	262
O	spiel trinken, weil sie es uns zu liebe machen. Also wenn sie jetzt eine fremde Person hin-	76.55999755859375	556.3006591796875	10.97998046875	442.125	262
O	geht oder eine andere Pflegeverrichtung macht, dass da eher eine Ablehnung kommt und	76.55999755859375	568.9605712890625	10.97998046875	442.12066650390625	262
O	wenn der Bewohner ist nun mal so, er hat so seine Eigenheiten und manchmal kriegt man	76.55999755859375	581.6204833984375	10.97998046875	442.144775390625	262
O	den ja auch so ein bisschen in die Richtung, weil man halt seine Eigenheiten ein bisschen	76.55999755859375	594.2804565429688	10.979995727539062	442.15911865234375	262
O	mit, mit ein beziehen kann und dann trinkt der halt eben deswegen eher und ich kann mir	76.55999755859375	606.9404296875	10.979995727539062	442.13153076171875	262
O	ja vorstellen, dass das mehr so eine Standardsachen sind, um den zum Trinken zu moti-	76.55999755859375	619.534423828125	10.979995727539062	442.07891845703125	262
O	vieren." (Pflegekraft, A05#P12: 20090624, 31:32)	76.55999755859375	632.1943969726562	10.979995727539062	239.90530395507812	262
O	Dies beherrschen die erfahreneren Pflegekräfte auffallend, trotz Stress und zahllosen - wie	56.70000076293945	662.9898071289062	12.0	481.82636642456055	263
O	oft auch ungewissen - Anforderungen, kompetent. Überdies glückt so überhaupt erst ein	56.69999694824219	683.6898193359375	12.0	481.96559143066406	264
O	Freiraum für die Beschäftigung mit den Pflegebedürftigen hinaus als Personen. Der Stand	56.69999694824219	704.3898315429688	12.0	481.8947296142578	265
O	der Servicerobotik ermöglicht dagegen noch längst keine technische Umsetzung dieser	56.69999694824219	725.08984375	12.0	481.88160705566406	266
O	vielschichtigen - kreativen, oft improvisierten - Zusammenhänge. BerufsanfängerInnen	56.70001220703125	745.789794921875	12.0	481.8863525390625	267
O	no 05/2009	267.722412109375	57.6497802734375	12.0	60.10321044921875	268
O	- 20 -	510.2916259765625	57.6497802734375	12.0	28.07159423828125	269
O	müssen sich diese Routinen/ Handlungsformen erst beschwerlich entwerfen, und finden	56.70000076293945	115.4298095703125	12.0	481.8671989440918	270
O	so außerhalb der Pflegepraxis kaum Zeit und Handhabe für das "Surplus" zwischen-	56.70001220703125	136.12982177734375	12.0	481.82635498046875	271
O	menschlicher Interaktionen mit den BewohnerInnen.	56.699981689453125	156.829833984375	12.0	276.8448181152344	272
O	"Bei solchen könnt es, könnt es sein, aber wir merken auch, auch bei solchen Leuten, die	76.55999755859375	189.4007568359375	10.98004150390625	442.19305419921875	273
O	muss man auch in ihrer Welt mit ihren Eigenheiten trotzdem schon besser kennen. Wenn	76.55999755859375	202.0606689453125	10.98004150390625	442.04937744140625	273
O	wir jetzt jemanden dahin schicken, der ein Zivi ist, der noch nicht lange dabei ist oder der	76.55999755859375	214.7205810546875	10.98004150390625	442.16998291015625	273
O	auch bloß mal so zur Aushilfe da ist, dann nehmen sie nicht so gut Essen und Trinken ab."	76.55999755859375	227.31463623046875	10.98004150390625	442.14141845703125	273
O	(Pflegekraft, A05#P12: 20090624, 34:30)	76.55999755859375	239.97454833984375	10.98004150390625	199.88760375976562	273
O	Bei besagten Pflegehandlungen kommen bereits diverse technische Hilfsmittel zum Ein-	56.70000076293945	270.76983642578125	12.0	481.82514572143555	274
O	satz. Üblich sind hier, neben den Pflegebetten, die Lifter ("Stahlschwestern"), die Dienstte-	56.69999694824219	291.4698486328125	12.0	481.8839874267578	275
O	lefone und das Haus(not)rufsystem. Diese Technik ist im Falle der Pflegebetten und Lifter	56.70001220703125	312.16986083984375	12.0	481.88153076171875	276
O	trivial mechanisch, und im Falle der Rufsysteme der alltäglichen Fernsprechgerätetechnik	56.70001220703125	332.869873046875	12.0	481.88397216796875	277
O	sehr ähnlich. Ihre Verlässlichkeit ist per se über die effektiven, aber nicht (hoch) komple-	56.70001220703125	353.56988525390625	12.0	481.79522705078125	278
O	xen Handlungsorientierungen bzw. -verstärker ohne weiteres in die Routinen zu integrie-	56.70001220703125	374.2698974609375	12.0	481.7891845703125	279
O	ren. Sie stellen dementsprechend erwartbare (Teile) von Handlungszusammenhängen	56.70001220703125	394.96990966796875	12.0	481.85516357421875	280
O	dar. "Entsprechende Handlungen werden vorhersagbar und damit planbar" (Joerges 1988:	56.70001220703125	415.669921875	12.0	481.92718505859375	281
O	30f). Fallen diese Techniken aus, (zer)stört dies die Handlungsroutinen. Die daraus ent-	56.69999694824219	436.36993408203125	12.0	481.85279846191406	282
O	stehenden Probleme sind groß, aber schließlich überwindbar.	56.70001220703125	457.0699462890625	12.0	326.8799743652344	283
O	Während der Bedarfsanalyse konnte - neben der bereits genannten Skepsis bzgl. der Ser-	56.70001220703125	489.76995849609375	12.0	481.9007568359375	284
O	viceroboter - der Ärger und das Unbehagen gegenüber dem noch vergleichsweise jungen,	56.70001220703125	510.469970703125	12.0	481.77838134765625	285
O	elektronischen Dokumentationssystem deutlich parallelisiert werden:	56.70001220703125	531.1699829101562	12.0	363.56402587890625	286
O	"Wenn Ängste bestehen man könnte sie in Rechten oder, oder in der Personalbesetzung	76.55999755859375	563.7407836914062	10.97998046875	442.11846923828125	287
O	noch mehr beschneiden, dann dauert es etwas länger. Also es war jetzt beim Computer-	76.55999755859375	576.3348388671875	10.97998046875	442.0042724609375	287
O	programm, da waren große Ängste da, völlig unberechtigt, weil viele nicht verstanden ha-	76.55999755859375	588.9947509765625	10.979995727539062	442.13153076171875	287
O	ben, dass es einfach eine umfassendere Dokumentationen ergibt. Das hat lange gedauert	76.55999755859375	601.6547241210938	10.979995727539062	442.08544921875	287
O	bis das dann im Haus komplett umgesetzt war, weil man immer dachte, man wird dann er-	76.55999755859375	614.314697265625	10.979995727539062	442.324951171875	287
O	setzt, aber dem ist ja nicht so." (leitende Pflegekraft, A05#P 03: 20090623, 16:56)	76.55999755859375	626.974609375	10.979995727539062	396.99066162109375	287
O	Zuerst werden wiederholt die Ängste bzgl. des Arbeitsplatzes angegeben.	56.70000076293945	657.7098388671875	12.0	391.6007194519043	288
O	"Ich auch, muss ich gestehen, war schon auch skeptisch, weil ich konnte es mir nicht vor-	76.55999755859375	690.28076171875	10.979995727539062	442.10528564453125	289
O	stellen, wie das jetzt aussehen sollte oder wie das funktioniert, ob es mehr Arbeit darstellt	76.55999755859375	702.9407348632812	10.979995727539062	442.0458984375	289
O	oder nicht. Also es war schon, glaube ich, bei vielen Zweifel da, wie das funktionieren	76.55999755859375	715.6006469726562	10.980003356933594	442.232666015625	289
O	[soll]." (Pflegekraft, A05#P13: 20090624, 07:16)	76.55999755859375	728.2606201171875	10.980003356933594	232.62887573242188	289
O	no 05/2009	267.722412109375	57.6497802734375	12.0	60.10321044921875	290
O	- 21 -	510.2916259765625	57.6497802734375	12.0	28.07159423828125	291
O	"Wir müssen dann auf andere Details achten auf die man vorher nicht achten musste und	76.55999755859375	115.30072021484375	10.98004150390625	442.241455078125	292
O	man muss ja doch denke ich mal, immer ein waches Auge haben, man darf nicht zu viel	76.55999755859375	127.96063232421875	10.98004150390625	442.08758544921875	292
O	100 prozentig Vertrauen, ist eben Technik." (leitende Pflegekraft, A05#P12: 20090624,	76.55999755859375	140.62054443359375	10.98004150390625	442.08770751953125	292
O	39:32)	76.55999755859375	153.214599609375	10.98004150390625	31.188690185546875	292
O	Die folgend genannten Zweifel an Technik erscheinen Paradox: Ist doch Technik per Defi-	56.70000076293945	184.00982666015625	12.0	481.86359786987305	293
O	nition etwas in seinem Wirkzusammenhang erwartbares und zuverlässiges, wird sie - für	56.70001220703125	204.7098388671875	12.0	481.83953857421875	294
O	die Pflegekräfte - in der Form des Computers unkalkulierbar und kontingent. Gründe hier-	56.70001220703125	225.40985107421875	12.0	481.88873291015625	295
O	für sind allerdings nicht nur in der - angenommenen - Unzuverlässigkeit/ Unvorhersehbar-	56.70001220703125	246.10986328125	12.0	481.95123291015625	296
O	keit zu suchen (vgl. Working Brief 15).	56.69999694824219	266.80987548828125	12.0	202.18797302246094	297
O	Fraglich ist, ob sich der Groll gegen die Nutzung der EDV, allgemein (auch) gegen die	56.69999694824219	299.5098876953125	12.0	481.8695831298828	298
O	Standardisierung, und modulare Abrechnung der Pflegeleistungen wendet. Auf die Frage,	56.69999694824219	320.20989990234375	12.0	481.8360137939453	299
O	wie die Einführung dieser speziellen technischen Neuerung verlief, wurde geantwortet:	56.70001220703125	340.909912109375	12.0	458.98565673828125	300
O	"Ja erst mal mit Ablehnung. Also wir gehen davon aus, dass es im Prinzip für uns erstmals	76.55999755859375	373.48077392578125	10.97998046875	442.17559814453125	301
O	eine Erleichterung ist, also ich muss mal sagen, zu 80 Prozent gehen wir Mitarbeiter auch	76.55999755859375	386.1407165527344	10.97998046875	442.2149658203125	301
O	so ran, aber wir haben natürlich immer Angst, weil das, was wir jetzt gerade können oder	76.55999755859375	398.8006591796875	10.97998046875	442.25341796875	301
O	machen, das ist so, wir sind im Prinzip eingespielt und haben uns unseren Tagesrhythmus	76.55999755859375	411.39471435546875	10.97998046875	441.9989013671875	301
O	danach eingeplant, wann wir was machen und wie wir es am Schnellsten und Günstigsten	76.55999755859375	424.0546569824219	10.97998046875	442.149169921875	301
O	gehandelt kriegen und jetzt kommt wieder was Neues und wir müssen unsere gewohnten	76.55999755859375	436.714599609375	10.97998046875	442.052490234375	301
O	Tätigkeiten ein bisschen, ja, verlassen und da haben wir natürlich Angst davor und dann	76.55999755859375	449.3745422363281	10.97998046875	441.974609375	301
O	ist das ja so, ja, es könnte ja am PC was nicht klar sein, es ist auch oft so, es ist im Prinzip	76.55999755859375	462.03448486328125	10.97998046875	442.19970703125	301
O	wie es jeder versteht, wie ihre Frage nochmal hinterfragen musste und dann interpretiert	76.55999755859375	474.6944274902344	10.97998046875	442.18548583984375	301
O	das jeder für sich auch auf seine Weise und dann funktioniert erst mal am Anfang nicht	76.55999755859375	487.2884826660156	10.97998046875	442.2359619140625	301
O	gleich so und ja dann, dann stehen wir natürlich als Mitarbeiter so ein bisschen in der	76.55999755859375	499.94842529296875	10.97998046875	441.99102783203125	301
O	Gruppe da und helfen uns da untereinander und, ja, erst mal und dann merken wir wieder,	76.55999755859375	512.6083984375	10.97998046875	442.0560302734375	301
O	ach ist was neues und weil es ein bisschen Angst macht, kommt natürlich so ein bisschen	76.55999755859375	525.268310546875	10.97998046875	442.15789794921875	301
O	Ablehnung dabei mit rein, weil Handschreiben ist immer noch am besten, aber am Ende	76.55999755859375	537.92822265625	10.97998046875	442.1600341796875	301
O	stellt sich dann heraus, wenn wir es gewohnt sind, wenn wir es eine Weile gemacht haben,	76.55999755859375	550.5223388671875	10.97998046875	442.1590576171875	301
O	dass es sich doch rentiert und dass es besser ist, ja." (Pflegekraft, A05#P12: 20090624,	76.55999755859375	563.1822509765625	10.97998046875	442.1832275390625	301
O	22:51)	76.55999755859375	575.8421630859375	10.97998046875	31.183197021484375	301
O	"Also da, da hätt' ich gern mehr Einführung gehabt, das war so kurzfristig, das war nur ein,	76.55999755859375	594.5081787109375	10.979995727539062	441.9954833984375	302
O	zwei Tage in dieses System, wie was ist, und Veränderungen, da verändert sich ja ständig	76.55999755859375	607.1681518554688	10.979995727539062	442.0810546875	302
O	was am Programm und, ja, mir ist das zu wenig, ich würd' gern, ich bin ein älterer Hase	76.55999755859375	619.8280639648438	10.979995727539062	442.2249755859375	302
O	[…]. Und PC ist ja nicht so mein Freund (lacht). Ich hader' mit dem immer und ich wünsch-	76.55999755859375	632.422119140625	10.979995727539062	442.1129150390625	302
O	te mir mehr, […] mehr learning by doing, ja?" (Pflegekraft, A05#P09: 20090624, 07:31)	76.55999755859375	645.0820922851562	10.979995727539062	421.4706115722656	302
O	In der von uns untersuchten Pflegeeinrichtung wurde erst kürzlich in Gänze auf elektroni-	56.70000076293945	675.8898315429688	12.0	481.8011589050293	303
O	sche Pflegedokumentation umgestellt. Über einen Zeitraum von mehreren Monaten lief die	56.70001220703125	696.58984375	12.0	481.82879638671875	304
O	handschriftliche und computergestützte Pflegedokumentation parallel.	56.70001220703125	717.289794921875	12.0	370.19879150390625	305
O	no 05/2009	267.722412109375	57.6497802734375	12.0	60.10321044921875	306
O	- 22 -	510.2916259765625	57.6497802734375	12.0	28.07159423828125	307
O	"Papier und dann in Computer. Das haben sie ja erlebt, da hab ich schon geflucht." (Pfle-	76.55999755859375	115.30072021484375	10.98004150390625	442.16229248046875	308
O	gekraft, A05#P04: 20090319, 19:15)	76.55999755859375	127.96063232421875	10.98004150390625	177.35997009277344	308
O	Das neue (elektronische) Dokumentationssystem wurde eingeführt, um aktuellen Ansprü-	56.70000076293945	158.74981689453125	12.0	481.9032096862793	309
O	chen/ Qualitätsstandards hinsichtlich der Transparenz der pflegerischen Maßnahmen und	56.70001220703125	179.4498291015625	12.0	481.783203125	309
O	deren Abrechnung zu entsprechen. So schaffen diese immerhin einen erfüllbaren Rah-	56.70001220703125	200.14984130859375	12.0	481.7904052734375	309
O	men, beschränken aber gleichzeitig die Pflegepraxis. Zuvor wurden handschriftlich Proto-	56.70001220703125	220.849853515625	12.0	481.954833984375	309
O	kolle und Berichte verfasst, jetzt müssen alle pflegerischen Handlungen/ Leistungen (stän-	56.70001220703125	241.54986572265625	12.0	481.76275634765625	309
O	dig) über eine - als hinderlich empfundene - Eingabemaske am Computer eingetragen	56.70001220703125	262.18988037109375	12.0	481.852783203125	309
O	werden. Vereinzelt wurde Unmut über die neue Form der Pflegedokumentation geäußert,	56.70001220703125	282.889892578125	12.0	481.8900146484375	309
O	die meisten Problemlagen bestehen indessen bei der Nutzung/ Anwendung der Computer.	56.70001220703125	303.58990478515625	12.0	481.90081787109375	309
O	Die wenigsten (der älteren) PflegerInnen haben EDV-Kenntnisse, und/ oder Übung im	56.70001220703125	324.2899169921875	12.0	481.850341796875	309
O	Umgang mit EDV; zumal die Bindung an die eigentliche Pflegearbeit bloß schwerlich her-	56.70001220703125	344.98992919921875	12.0	481.85394287109375	309
O	gestellt werden kann.	56.70001220703125	365.68994140625	12.0	113.37840270996094	309
O	Grundsätzlich werden die Rechner als unzuverlässig wahrgenommen, und gerade im Hin-	56.70001220703125	398.38995361328125	12.0	481.81683349609375	310
O	blick auf die vollständige Dokumentation müssen nunmehr fehlerhafte Bedienungen und	56.69999694824219	419.0899658203125	12.0	481.8996124267578	310
O	Ausfälle vermieden werden. Damit die Anwendung nicht zum Problem oder gar Ärgernis	56.699981689453125	439.78997802734375	12.0	481.8694763183594	310
O	wird, wurde das Pflegepersonal umfangreich geschult, und die Software immer wieder ü-	56.699981689453125	460.489990234375	12.0	481.9175720214844	310
O	ber Updates angepasst. Ungünstig ist hier, dass die Updates oft fundamentale Umgestal-	56.70001220703125	481.19000244140625	12.0	481.9295654296875	310
O	tungen und Abweichungen von den vorherigen Versionen mit sich bringen, die erst einmal	56.70001220703125	501.8900146484375	12.0	481.87554931640625	310
O	wieder neu erlernt werden müssen. Über die Schulungen hinaus wurden einige der Pfle-	56.70001220703125	522.5900268554688	12.0	481.81671142578125	310
O	gekräfte zu Ansprechpersonen/ Technikbeauftragten weitergebildet. Sie erfüllen - überra-	56.70001220703125	543.2900390625	12.0	481.8599853515625	310
O	schenderweise - die von Blau (1977) ergründete, informelle Gestaltung von Problemlö-	56.70002746582031	563.9900512695312	12.0	481.7880096435547	310
O	sungen: Anstatt die Vorgesetzen zu befragen, werden die Mitarbeiter auf gleicher Ebene	56.700042724609375	584.6900634765625	12.0	481.8552551269531	310
O	zur "kreativen Bewältigung" der Schwierigkeiten herangezogen. Die 24-Stunden-Hotline	56.700042724609375	605.3900756835938	12.0	481.8144226074219	310
O	bleibt hingegen ungenutzt.	56.700042724609375	626.090087890625	12.0	140.81275939941406	310
O	Grundsätzlich sind Pflegekräfte gewiss offen gegenüber sinnvollen und robusten techni-	56.700042724609375	658.7900390625	12.0	481.8647766113281	311
O	schen Neuerungen: "Wenn's die Arbeit erleichtert und wenn's 'nen Sinn macht schon."	56.700042724609375	679.4900512695312	12.0	481.8971862792969	311
O	(Pflegekraft, A05#P09: 20090624, 08:53) Die Verlässlich- und Nützlichkeit der Neuerun-	56.700042724609375	700.1900634765625	12.0	481.7710876464844	311
O	gen muss sich aber sehr schnell zeigen bzw. gut sichtbar sein. Nur über erwartbare Wirk-	56.700042724609375	720.8900146484375	12.0	481.9247741699219	311
O	zusammenhänge lassen sich technische Artefakte in pflegetechnische Handlungsroutinen,	56.700042724609375	741.5900268554688	12.0	481.8492126464844	311
O	no 05/2009	267.722412109375	57.6497802734375	12.0	60.10321044921875	312
O	- 23 -	510.2916259765625	57.6497802734375	12.0	28.07159423828125	313
O	-muster und damit in die Arbeitspraxis einweben. Technik kann so auch komplex ausfallen	56.70000076293945	115.4298095703125	12.0	481.8455924987793	314
O	(Beispiel Hausrufsystem) oder ebenso die Handlungsformen zu großen Teilen vorschrei-	56.699981689453125	136.12982177734375	12.0	481.9200134277344	314
O	ben (Beispiel Lifter) ohne Unbehagen zu bewirken. Deutlich schwieriger ist dies bei Tech-	56.699981689453125	156.829833984375	12.0	481.8119812011719	314
O	nik, die nicht veralltäglicht - scheinbar - nur zusätzliche und pflegeferne Arbeit bereitet	56.70001220703125	177.52984619140625	12.0	481.899658203125	314
O	(Beispiel Dokumentationssoftware). Die Einstellung gegenüber den Servicerobotern ist	56.70001220703125	198.2298583984375	12.0	481.84332275390625	314
O	dazwischen anzusiedeln bzw. zu sehen: Ihre Nützlichkeit im Pflegealltag wird bezweifelt -	56.70001220703125	218.92987060546875	12.0	481.80950927734375	314
O	aber nicht gänzlich ausgeschlossen - ferner wirkt dagegen ihre angenommene Unzuver-	56.70001220703125	239.6298828125	12.0	481.83837890625	314
O	lässigkeit (als hoch komplexe und computergesteuerte Systeme) verstörend auf die Hand-	56.700042724609375	260.32989501953125	12.0	481.9319763183594	314
O	lungsroutinen der Pflegepersonen. Übertragen auf die Erwartungen und Befürchtungen	56.700042724609375	281.0299072265625	12.0	481.9378967285156	314
O	gegenüber den Servicerobotern und ihren Einsatzmöglichkeiten in Pflegeeinrichtungen	56.700042724609375	301.72991943359375	12.0	481.9031677246094	314
O	und in Interaktion mit den eigenen Arbeitsbereichen, scheinen die Pflegepersonen nicht	56.700042724609375	322.429931640625	12.0	481.8263854980469	314
O	gänzlich abgeneigt:	56.70005798339844	343.12994384765625	12.0	103.45918273925781	314
O	"Ich denk' so was sollte man, ähm, miterleben oder sehen, was tut dieser Roboter, ja?	76.55999755859375	375.7007751464844	10.97998046875	442.11187744140625	315
O	Was kann ich mit dem machen?" (Pflegekraft, A05#P09: 20090624, 09:50)	76.55999755859375	388.2948303222656	10.97998046875	363.3743591308594	315
O	Diese Aussage weist endlich darauf hin, dass sich letztlich bloß über die (konkrete) Ar-	56.70000076293945	419.0898132324219	12.0	481.8684196472168	316
O	beitspraxis das Potential der Servicerobotik in diesem Sektor zeigen, und damit das Miss-	56.69999694824219	439.7898254394531	12.0	481.86231994628906	316
O	trauen auflösen und die Ängste minimieren könnte.	56.699981689453125	460.4898376464844	12.0	270.8112487792969	316
O	Synthese des ermittelten Bedarfs	56.699981689453125	514.275146484375	12.0	190.02484130859375	317
O	Ein erstes Ergebnis der durchgeführten Bedarfsanalyse in einer stationären Pflegeeinrich-	56.699981689453125	546.58984375	12.0	481.8623962402344	318
O	tung zum Zweck einer nutzerzentrierten Weiterentwicklung von Servicerobotik (vgl. WiMi-	56.70001220703125	567.2898559570312	12.0	481.84552001953125	318
O	Care und 2. Fußnote) stellt folglich die Entlastung des Pflegepersonals durch die Über-	56.70001220703125	587.9898681640625	12.0	481.88397216796875	318
O	nahme von Routinetätigkeiten dar. Die Gründe für diese Einschätzung lassen sich demzu-	56.70001220703125	608.6898803710938	12.0	481.795166015625	318
O	folge sowohl im Bereich des technisch Machbaren als auch des sozial Erwünschten veror-	56.70001220703125	629.389892578125	12.0	481.89361572265625	318
O	ten. Die Einschätzungen, Wünsche und Bedürfnisse bezüglich eines möglichen Einsatzes	56.70001220703125	650.08984375	12.0	481.823974609375	318
O	von Servicerobotern in einer stationären Pflegeeinrichtung fallen je nach Personengruppe	56.699981689453125	670.7898559570312	12.0	481.9200134277344	318
