Klaus Hurrelmann, Gudrun Quenzel (2012):
Lebensphase Jugend. Eine Einführung in die
sozialwissenschaftliche Jugendforschung
Rezension von Frank Gusinde
Rezensionen
Frank Gusinde
Als im Jahr 1985 das Lehrbuch von Klaus Hurrelmann, Bernd Rosewitz und Hartmut K.
Wolf mit dem Titel „Lebensphase Jugend“ erschien, ist wohl niemand davon ausgegan-
gen, dass das Buch noch heute – 27 Jahre später und mittlerweile in der 11. Auflage – zu
einem so wichtigen (Lehr-)Buch für Studentinnen und Studenten der Erziehungswissen-
schaft und der Bildungssoziologie sowie für Praktiker in sozialen und pädagogischen Be-
rufen werden und auch darüber hinaus eine außerordentlich große interessierte Leser-
schaft ansprechen würde. Das liegt sicherlich nicht zuletzt am Schreibstil der Autoren und
deren präzisem und gekonntem Verbinden verschiedener Argumentationen aus Theorie
und Empirie, sodass auch wenig geübte Leserinnen und Leser das Buch problemlos ‚in
einem Rutsch‘ durcharbeiten können.
Wie sehr sich die Sicht auf die Jugendphase in den letzten Jahrzehnten gewandelt hat,
kann man an den Überlegungen der Verfasser der ersten Auflage gut nachvollziehen. Ur-
sprünglich als Gegenrede an die Autoren gerichtet, die „den Schluß gezogen (haben), der
Anfang vom Ende einer eigenständigen Phase Jugend im menschlichen Lebenslauf sei
gekommen“ (Hurrelmann/Rosewitz/Wolf 1985, S. 10), hat sich dieses Szenario alles ande-
re als bewahrheitet. So verwundert es auch nicht, dass nach der Veröffentlichung der 2.,
vollständig überarbeiteten Auflage im Jahr 1994, diese Überlegungen keinerlei Rolle
mehr spielten.
Von zentraler Bedeutung im aktuellen Lehrbuch von Hurrelmann und Quenzel ist das
Modell der „produktiven Realitätsverarbeitung“ (S. 87ff.). Die Autor/-innen vertreten die
Ansicht, dass in der Jugendphase die Persönlichkeitsentwicklung in einem Wechselspiel
von Anlagen und Umwelt gestaltet wird. Es finde eine ständige Abstimmung zwischen
Umwelt und eigenen Bedürfnissen und Interessen statt. Da weder soziologische noch psy-
chologische Einzeltheorien alleine das Phänomen der menschlichen Persönlichkeitsent-
Klaus Hurrelmann, Gudrun Quenzel (2012): Lebensphase Jugend. Eine Einführung in die
sozialwissenschaftliche Jugendforschung. 11., vollständig überarbeitete Auflage. Wein-
heim: Beltz Juventa, 296 Seiten, ISBN: 978-37799266009.
Diskurs Kindheits- und Jugendforschung Heft 1-2013, S. 133-135
134 F. Gusinde: Rezensionen
wicklung umfassend vereinen können, wird (in Anlehnung an Hurrelmann/Ulich 1986)
Sozialisation als Ausdruck einer metatheoretischen Orientierung verstanden. Für die sozi-
alisationstheoretische Jugendforschung wurden in „Lebensphase Jugend“ (2012) zwei
neue Maximen hinzugefügt, die sich konzeptionell an den zehn erkenntnisleitenden The-
sen des Buches „Sozialisation“ von Hurrelmann (2012) orientieren. Vor diesem Hinter-
grund kann zwischen diesen beiden Werken eine enge Abstimmung der Veröffentlichun-
gen bescheinigt werden.
Im Rahmen der völlig überarbeiteten Auflage aus Jahr 2004 bzw. der 10. Auflage aus
2010 hatten Hurrelmann und Quenzel wesentliche Forschungsergebnisse und Theoriedis-
kurse aktualisiert. Das betrifft vor allem das Kapitel 3, in dem die Themen Schule, Bil-
dung, Qualifikation und Hochschule verdichtet wurden. Themen wie u. a. der „Mangel an
sexueller Aufklärung“ (S. 160), „Sexualberatung durch die Eltern“ (S. 163), „Überforde-
rung durch komplexe Beziehungen“ (S. 178), ebenso wie der Themenbereich „Medien-
nutzung im Jugendalter“ (S. 196-201) sind hinzugekommen. Die Struktur des Buches
wurde ebenfalls modifiziert. Es beinhaltet nun acht statt der ursprünglichen fünf Kapitel.
Kapitel 1 beschäftigt sich mit der Verortung der Jugendphase im Lebensverlauf. Durch
die Verlängerung der Phase an beiden Enden, bedingt u.a. durch demographische und ge-
sellschaftliche Entwicklungen, verändert sich Jugend. Im Kapitel 2 entwickeln Hurrel-
mann und Quenzel das Modell der produktiven Realitätsverarbeitung (S. 87ff.). Ihre Sozi-
alisationstheorie des Jugendalters wird nun in Form von zehn erkenntnisleitenden Maxi-
men behandelt. Dabei haben die Autor/-innen die Argumentation um die seit einigen Jah-
ren zu beobachtenden Diskurse über schichts- und geschlechtsspezifische Ungleichheiten
erweitert. In den Kapiteln 3 bis 6 werden die zentralen Entwicklungsaufgaben (Bildung
und Qualifikation; Familie und Partnerschaft; Freunde, Freizeit und Konsum; Öffentlich-
keit und Politik) diskutiert, woraufhin im 7. Kapitel die gelingende und die nicht-
gelingende Bewältigung von Entwicklungsaufgaben und den damit verbundenen Schwie-
rigkeiten betrachtet werden. Dabei werden vor allem Kriminalität, Drogenkonsum und
gesundheitliche Beeinträchtigungen thematisiert. Abschließend werden im letzten Kapitel
die Grundthemen einer umfassenden Jugendpolitik in Form von Entwicklungsaufgaben
(Qualifizieren, Binden, Konsumieren und Partizipieren) erörtert.
Die Aufgabe eines Lehrbuches für Studentinnen und Studenten ist es, sich dem Ge-
genstand seiner Überlegung zu nähern, ihn aus verschiedenen Perspektiven zu betrachten
und zu systematisieren. Diese Aufgabe ist Hurrelmann und Quenzel außerordentlich gut
gelungen. Nicht umsonst wird dieses Buch auf Platz 10 der meistverkauften Bücher in der
Rubrik „Fachbücher der Sozialwissenschaft > Soziologie > Einführung“ (Stand: Januar
2013) beim Online-Versandhaus Amazon geführt.
Dennoch kann sich der kritische Leser fragen, ob hier nicht ein zu positives Bild der
Jugendphase gezeichnet wird. Gegenwärtig besteht weitgehende Einigkeit darüber, dass
es zu grundlegenden sozioökonomischen, sozialökologischen und -räumlichen Verände-
rungen und somit zu einer Entgrenzung der Jugendphase gekommen ist. Bedeutend ist
hier, dass sich die Jugendphase in den letzten Jahren vom Möglichkeits- und Ausprobier-
raum hin zu einer Konkurrenz- und Verdrängungsszenerie transformiert hat (vgl. Böh-
nisch 2008, S. 204). Unsicherheiten und Misserfolge, die der Einzelne z.B. auf dem Weg
ins Berufs- und Erwerbsleben hinnehmen muss, werden von vielen Jugendlichen nicht
mehr als Lernerfahrungen, sondern als individuelles Versagen hingenommen. Zunehmend
sehen sich Jugendliche – aber auch deren Eltern – einer marktwirtschaftlichen Ordnung
ausgesetzt, die mehr denn je auf ökonomischer Verwertungslogik basiert und frühzeitig
Diskurs Kindheits- und Jugendforschung Heft 1-2013, S. 133-135 135
bildungsbiographische Entscheidungen einfordert: Der Druck in Richtung Transition hat
dabei nicht nur zugenommen, sondern die ‚Jagd‘ nach dem nächsten Bildungstitel (vgl.
Zinnecker u. a. 2003, S. 20) bestimmt mehr denn je die ehemaligen Schonräume von Kin-
dern und Jugendlichen.
Abschließend ist aber zu sagen, dass das Werk eine informative Einführung mit vie-
len Anregungen auch für Erfahrene darstellt. „Lebensphase Jugend“ erfüllt auch in der 11.
Auflage die selbst gesetzten Ziele und kann den Studierenden der Sozialwissenschaften
als Einführung ohne Einschränkungen empfohlen werden.
Literatur
<ref>Böhnisch, L. (2008): Sozialpädagogik der Lebensalter. Eine Einführung. – Weinheim/München.</ref>
<ref>Hurrelmann, K. (2012): Sozialisation. – Weinheim/Basel</ref>
<ref>Zinnecker, J./Behnken, I./Stecher, L./Maschke, S. (2003): Null zoff und voll busy. Die erste Jugendgene-
ration des neuen Jahrhunderts. – Opladen.</ref>
