Regelungen zum Wohle der Kinder für den schnellen Karrieresprung bewusst	127.61849975585938	470.15838623046875	10.5	340.0562438964844	32
übergehen. Auch hier kann eine unabhängige Interessenvertretung positiv ein-	127.61849975585938	482.1588439941406	10.5	340.16314697265625	32
wirken.	127.61849975585938	494.1593017578125	10.5	31.848617553710938	32
Arbeitsmedizinische Aspekte dürfen bei den möglichen Belastungsfaktoren	144.59805297851562	506.1597900390625	10.5	323.1805725097656	32
nicht unberücksichtigt bleiben. Während Vorschulkinder zwischen 18 Monaten	127.61849975585938	518.1602172851562	10.5	340.11810302734375	32
und 5 Jahren eher aufgrund ihrer aktiven Mobilität und hinsichtlich der Ein-	127.61849975585938	530.16064453125	10.5	340.14642333984375	32
Arbeitsmedizinische schätzung von möglichen Gefahren gefährdet sind, neigen Schulkinder eher zu	51.66037368774414	542.1611328125	10.5	416.07091903686523	32
Aspekte seelischer Überforderung, z.B. bei der Vereinbarkeit von Medienjob, Schule	91.68006896972656	553.297119140625	11.364501953125	376.02403259277344	32
und Freizeit. Außerdem reagieren sie eher auf atmosphärische Störungen, be-	127.61849975585938	566.1620483398438	10.5	340.2083740234375	32
dingt z.B. durch aufkommenden Stress und Hektik im Falle von Störungen in	127.61849975585938	578.1625366210938	10.500015258789062	340.1296081542969	32
den Ablaufplänen des Produktionsteams (Bieber-Delfosse 2002, S. 262f.; zur	127.61849975585938	590.1334838867188	10.52947998046875	340.1065368652344	32
Diskussion der Belastungsannahmen vgl. auch Liebel 2005, S. 133f.).	127.61848449707031	602.1339111328125	10.529541015625	293.50547790527344	32
Das „Baby-Alter“ bedarf einer besonderen Betrachtung, da hier auch biolo-	144.59909057617188	614.1638793945312	10.5	323.0072326660156	32
gische Aspekte eine stärkere Rolle spielen. Nicht selten bedeutet eine Beteili-	127.61953735351562	626.1643676757812	10.5	340.1822204589844	32
gung an Werbeproduktionen eine Unterbrechung des Schlaf-Wach-Rhythmus	127.61953735351562	638.164794921875	10.5	340.1778869628906	32
und der Stillzeiten. Darüber hinaus wird zur Stimulation Kunst- und Blitzlicht	127.61953735351562	650.165283203125	10.5	340.1033935546875	32
eingesetzt, um das Baby wach zu halten oder um seine Aufmerksamkeit in eine	127.61953735351562	662.1657104492188	10.5	340.0783386230469	32
bestimmte Richtung zu lenken.	127.61953735351562	674.1661987304688	10.5	131.00640869140625	32
Kinderarbeit in den Medien 95	424.79998779296875	115.03765869140625	9.0	122.47021484375	33
3	127.62000274658203	145.5712890625	12.0	6.672004699707031	34
Daten zur Erwerbsarbeit von Kindern	144.60000610351562	145.5712890625	12.0	208.753173828125	35
Auf Bundesebene existieren keine verlässlichen Daten über die Erwerbsarbeit	127.62000274658203	177.17291259765625	10.5	340.1097640991211	36
von Kindern. Die Bundesregierung ließ im Jahr 2000 verlauten: „Über den Um-	127.62000274658203	189.17333984375	10.5	340.1390609741211	36
fang der Beschäftigung von Kindern in Deutschland gibt es keine repräsentati-	127.62000274658203	201.17376708984375	10.5	340.17894744873047	36
ven Erhebungen. Aussagekräftige Erkenntnisse über die Kinderarbeit liegen den Keine verlässlichen	127.62000274658203	213.1741943359375	10.5	411.9315719604492	36
Aufsichtsbehörden mit Ausnahme der zu genehmigenden Tätigkeiten im Kultur- Daten über	127.62000274658203	224.3177490234375	11.35687255859375	386.6677780151367	36
uKninddMeraerdbieenitbienreDicehutrsecghellamndä,ßi2g00n0ic)hBtivsozru.“ d(iBeseermichZtedietpruBnkutn,dleasgreengineruurndgieüEber-r EKriwndeerbrnsarbeit von	127.62000274658203	234.33746337890625	25.3380126953125	409.60070037841797	36
gebnisse von Erhebungen in einigen Bundesländern und Gewerbeaufsichtsbe-	127.62000274658203	261.1759033203125	10.5	340.17171478271484	36
zirken vor, aus denen immerhin hervorgeht, dass 42 bis 51,8 Prozent der schul-	127.62000274658203	273.17633056640625	10.5	340.0856246948242	36
pflichtigen Kinder während des laufenden Schuljahrs neben der Schule zeitwei-	127.62000274658203	285.1767578125	10.5	340.0970687866211	36
se einer Erwerbstätigkeit nachgegangen sind (vgl. Liebel 2001, S. 142). Seitdem	127.62000274658203	297.147705078125	10.52947998046875	340.2210006713867	36
wurden m.W. keine repräsentativen statistischen Erhebungen vorgenommen.	127.62002563476562	309.1776123046875	10.5	323.5648193359375	36
Allerdings gibt es lt. dem Bericht der Bundesregierung Daten zu bewilligten	144.59957885742188	321.17803955078125	10.5	323.1532287597656	36
Anträgen der staatlichen Ämter für Arbeitsschutz. Demnach sind für die Be-	127.62002563476562	333.1784973144531	10.5	340.1044616699219	36
schäftigung von Kindern im Kultur- und Medienbereich im Zeitraum 1997 bis	127.62004089355469	345.178955078125	10.5	340.15904235839844	36
1999 rund 8.180 Anträge auf Ausnahmegenehmigungen bei den zuständigen	127.62004089355469	357.1794128417969	10.5	340.0971221923828	36
Genehmigungsbehörden eingegangen und zu rund 95 Prozent bewilligt worden.	127.62004089355469	369.17987060546875	10.5	340.14747619628906	36
Von der Summe der Anträge kann allerdings nicht die Summe der beteiligten	127.62004089355469	381.1803283691406	10.5	340.06040954589844	36
Kinder abgeleitet werden, z.B. wurden in Nordrhein-Westfalen 956 Ausnahmen	127.62004089355469	393.1807861328125	10.5	340.07093811035156	36
zugelassen, die die Beschäftigung von insgesamt 8.091 Kindern bewilligten.	127.62004089355469	405.1812438964844	10.5	322.3572540283203	36
Zu Verstößen gegen die Kinderarbeitsschutzverordnung allgemein – bezo- Verstöße gegen die	144.59959411621094	417.18170166015625	10.5	397.6022491455078	36
gen auf die Kinderarbeit in Deutschland (Verordnung über den Kinderarbeits- Kinderarbeitsschutz-	127.62004089355469	427.47662353515625	12.205535888671875	417.67884826660156	36
schutz (KindArbSchV) v. 23. Juni 1998) – merkt der Bericht an, dass zu den verordnung	127.62004089355469	437.4963073730469	14.186309814453125	388.0259552001953	36
häufigsten Missachtungen der rechtlichen Bestimmungen folgende gehören:	127.62004089355469	453.1830749511719	10.5	340.1117401123047	36
„die Nichteinhaltung der Altersgrenze, die Beschäftigung mit nicht zulässigen	127.62004089355469	465.18353271484375	10.5	340.1306915283203	36
Tätigkeiten, das Arbeiten zu Zeiten, zu denen Kinder nicht erwerbstätig sein	127.62004089355469	477.1839904785156	10.5	340.11280822753906	36
dürfen, insbesondere Arbeiten an Samstagen und Sonntagen oder in den späten	127.62004089355469	489.1844482421875	10.5	340.10133361816406	36
Abendstunden und die Missachtung der zulässigen Beschäftigungszeit, wobei	127.62004089355469	501.1849060058594	10.5	340.1317596435547	36
entweder die höchstzulässige tägliche Arbeitszeit oder die Dauer der insgesamt	127.62004089355469	513.1853637695312	10.5	340.06248474121094	36
im Kalenderjahr zulässigen Beschäftigung überschritten wurde.“	127.62004089355469	525.185791015625	10.5	272.6420440673828	36
Die bekannten Verstöße sind für die 16 Bundesländer dokumentiert. Im	144.59959411621094	537.186279296875	10.5	323.20252990722656	36
Zeitraum 1997 bis 1998 gab es in Hamburg z.B. 16 Verstöße gegen das Verbot	127.62004089355469	549.186767578125	10.5	340.0907745361328	36
der Kinderarbeit. 1997 wurden hier die meisten Missachtungen bei Film- und	127.62004089355469	561.1871948242188	10.5	340.07081604003906	36
Fotoaufnahmen festgestellt. In Nordrhein-Westfalen gab es im Zeitraum 1997	127.62004089355469	573.1876220703125	10.5	340.1454620361328	36
bis 1999 291 Verstöße gegen das Verbot der Kinderarbeit, u.a. auch aufgrund	127.62004089355469	585.1881103515625	10.500015258789062	340.07923889160156	36
einer fehlenden „Antragstellung auf Kinderbeschäftigung im Kultur- und Me-	127.62004089355469	597.1885986328125	10.5	340.17054748535156	36
dienbereich“.	127.62004089355469	609.1890258789062	10.5	56.47215270996094	36
4	127.62000274658203	644.59130859375	12.0	6.672004699707031	37
Rechtliche Regelungen	144.60000610351562	644.59130859375	12.0	127.97158813476562	38
Die Kinderarbeitsschutzverordnung (KindArbSchV v. 23. Juni 1998) sieht ein	127.62000274658203	676.19287109375	10.5	340.06981658935547	39
grundsätzliches Beschäftigungsverbot vor „soweit nicht das Jugendarbeits-	127.62000274658203	688.193359375	10.5	340.12020111083984	39
96	56.70000076293945	115.57769775390625	9.0	10.000797271728516	40
Melanie Garbas	76.77359771728516	115.57769775390625	9.0	59.934608459472656	41
KindArbSchV schutzgesetz und § 2 dieser Verordnung Ausnahmen vorsehen.“ In § 2 Kind	74.33999633789062	146.15289306640625	10.5	393.4517822265625	42
verweist auf ArbSchV werden zwar „Zulässige Beschäftigungen“ definiert, allerdings bezie-	77.99962615966797	156.87774658203125	11.77557373046875	389.79727935791016	42
VAeruosrndanhumnegnvoimn hen sich diese in keinem Punkt direkt auf die Mitwirkung von Kindern und Ju-	63.71941375732422	166.8974609375	17.99969482421875	404.03968048095703	42
Jugendarbeits- gendlichen an Medienproduktionen. Das KindArbSchV verweist auf die „Ver-	69.53923034667969	182.1541748046875	12.7626953125	398.1694793701172	42
schutzgesetz. ordnung von Ausnahmen“ im Jugendarbeitsschutzgesetz.	73.49890899658203	194.15460205078125	10.781982421875	295.3606491088867	42
Kinderarbeit ist in Deutschland nach §5 des Jugendarbeitsschutzgesetzes	144.59954833984375	206.155029296875	10.5	323.1353759765625	42
von 1997 verboten (s. JArbSchG, v. 12. April 1976; Stand: 31.10.2006). Das	127.6199951171875	218.15545654296875	10.5	340.12225341796875	42
JArbSchG definiert zunächst in §2 wer „Kind“ und wer „Jugendlicher“ ist:	127.6199951171875	230.1558837890625	10.5	315.07769775390625	42
§2 Abs. 1: „Kind im Sinne dieses Gesetzes ist, wer noch nicht 15 Jahre alt ist.“	144.60000610351562	247.7423095703125	9.0	286.5302429199219	43
§2 Abs. 2: „Jugendlicher im Sinne dieses Gesetzes ist, wer 15, aber noch nicht 18 Jahre	144.60000610351562	257.76202392578125	9.0	323.0693664550781	43
alt ist.“	144.60089111328125	267.78173828125	9.0	26.14410400390625	43
§2 Abs. 3: „Auf Jugendliche, die der Vollzeitschulpflicht unterliegen, finden die für	144.60089111328125	277.80145263671875	9.0	323.11798095703125	43
Kinder geltenden Vorschriften Anwendung.“	144.60089111328125	287.8211669921875	9.0	162.78121948242188	43
Werden Kinder und Jugendliche als Arbeitnehmer oder im Rahmen einer ar-	127.62000274658203	304.25286865234375	10.5	340.0047836303711	44
beitnehmerähnlichen Dienstleistung in Medienproduktionen beteiligt, d.h. wenn	127.62000274658203	316.2532958984375	10.5	340.1433334350586	44
ein arbeitsvertragliches Verhältnis und die Zahlung einer Vergütung erfolgt, so	127.62000274658203	328.2537841796875	10.499969482421875	340.1002426147461	44
gelten für sie die Bestimmungen des JArbSchG. Es verbietet grundsätzlich die	127.62000274658203	340.25421142578125	10.5	340.08666229248047	44
Beschäftigung von Kindern und vollzeitschulpflichtigen Kindern und Jugendli-	127.62000274658203	352.2546691894531	10.5	340.2063217163086	44
chen, gewährt allerdings in §6 JArbSchG eine Ausnahme im Falle einer Mitwir-	127.62000274658203	364.255126953125	10.5	340.1632614135742	44
Arbeitszeiten- kung bei Theatervorstellungen, Musikaufführungen, Werbeveranstaltungen so-	72.17901611328125	376.2555847167969	10.5	395.59600830078125	44
regelung wie Fernseh- und Filmaufnahmen. Es gelten dann folgende Arbeitszeitenrege-	88.97930908203125	388.2364196777344	10.519622802734375	378.8396911621094	44
lungen:	127.62000274658203	400.2565002441406	10.5	31.67009735107422	44
1. Mitwirkung bei Theaterproduktionen, Kinder über 6 Jahre, bis zu 4 Stunden	127.62000274658203	418.25665283203125	10.5	340.0530014038086	45
täglich in der Zeit von 10 bis 23 Uhr.	144.59954833984375	430.2571105957031	10.5	156.66522216796875	45
2. Mitwirkung bei anderen Medien- und Kulturproduktionen (Musik- und an-	127.6199951171875	442.257568359375	10.5	340.12750244140625	45
dere Aufführungen, Werbeveranstaltungen, Aufnahmen im Rundfunk (Hör-	144.59954833984375	454.2580261230469	10.5	323.1606140136719	45
funk und Fernsehen), auf Ton- und Bildträger sowie Foto- und Filmaufnah-	144.59954833984375	466.25848388671875	10.5	323.2099914550781	45
men)	144.59954833984375	478.2589416503906	10.5	21.500869750976562	45
a) Kinder über 3 bis 6 Jahre, bis zu 2 Stunden täglich in der Zeit von 8 bis	144.59954833984375	490.2593994140625	10.5	323.07232666015625	45
17 Uhr,	144.59954833984375	502.2598876953125	10.5	32.13421630859375	45
b) Kinder über 6 bis 15 Jahre, gilt auch für Jugendliche, die der Vollzeit-	144.59954833984375	514.2603149414062	10.5	323.0692443847656	45
schulpflicht unterliegen, bis zu 3 Stunden täglich in der Zeit von 8 bis 22	144.59954833984375	526.2607421875	10.5	323.12701416015625	45
Uhr.	144.59954833984375	538.26123046875	10.5	18.94305419921875	45
Der §6 JArbSchG ist allerdings nicht anzuwenden im Falle von geringfügiger,	127.6199951171875	556.2613525390625	10.5	340.0907287597656	46
gelegentlicher oder sonstiger Tätigkeit im Sinne des § Abs. 2 JArbSchG. Dar-	127.6199951171875	568.2618408203125	10.5	340.0950012207031	46
unter fallen z.B. Tätigkeiten in Einrichtungen der Jugendhilfe, Schule oder Kir-	127.6199951171875	580.2623291015625	10.500015258789062	340.10223388671875	46
che sowie allgemeine Produktionen, wo Kinder nur in unbedeutender und gele-	127.6199951171875	592.2627563476562	10.5	340.0634460449219	46
gentlicher Art und Weise an kommerziellen Produktionen mitwirken sollen.	127.6199951171875	604.2632446289062	10.5	320.14605712890625	46
Außerhalb des JArbSchG gibt es nur vereinzelte und selten angewendete	144.59954833984375	616.263671875	10.5	323.0408630371094	46
rechtliche Regelungen, die Einfluss auf die Mitwirkung von Kindern und Ju-	127.6199951171875	628.26416015625	10.5	340.0561828613281	46
gendlichen an Medienproduktionen nehmen können, d.h. für den Fall, dass	127.6199951171875	640.2645874023438	10.5	340.1181335449219	46
mangels einer arbeitnehmerähnlichen Beschäftigung das Jugendarbeitsschutzge-	127.6199951171875	652.2650756835938	10.5	340.1527404785156	46
setz und folglich die Genehmigungspflicht nach §6 JArbSchG nicht greift.	127.6199951171875	664.2655029296875	10.5	313.72003173828125	46
In § 7 „Jugendgefährdende Veranstaltungen und Betriebe“ des Jugend-	144.59954833984375	676.2659912109375	10.5	323.19000244140625	46
schutzgesetzes (JuSchG v. 23. Juli 2002) wird den Polizei- und Ordnungsbehör-	127.6199951171875	688.2664184570312	10.5	340.1128234863281	46
Kinderarbeit in den Medien 97	424.79998779296875	115.03765869140625	9.0	122.47021484375	47
den erlaubt, jugendgefährdende Veranstaltungen zu verbieten oder den Zugang	127.62000274658203	146.15289306640625	10.5	340.1139144897461	48
zu beschränken. Dies muss zunächst zur Anzeige gebracht werden.	127.62000274658203	158.1533203125	10.5	282.4478988647461	48
Laut § 14 „Erzieherischer Kinder- und Jugendschutz“, Sozialgesetzbuch VI-	144.59954833984375	170.15374755859375	10.5	323.14483642578125	48
II (SGB Achtes Buch (VIII) Kinder- und Jugendhilfe) hat die Jugendhilfe	127.6199951171875	182.1541748046875	10.5	340.0570983886719	48
grundsätzlich den gesetzlichen Auftrag zur Beratung und zum Schutz vor Ge- Beratungs- und	127.6199951171875	194.15460205078125	10.5	400.85784912109375	48
fahren und damit auch die Aufgabe, bei Bedarf und mit Hilfe von pädagogi- Schutzfunktion der	127.6199951171875	205.957763671875	10.697265625	413.2459716796875	48
schen Maßnahmen (Information, Beratung) eine kind- und jugendgerechte Jugendhilfe	127.6199951171875	215.97747802734375	12.677978515625	387.63018798828125	48
Durchführung von Medienproduktionen zu gewährleisten (vgl. § 14 Erzieheri-	127.6199951171875	230.1558837890625	10.5	340.1558837890625	48
scher Kinder- und Jugendschutz, Kinder- und Jugendfördergesetz NRW (3. AG-	127.6199951171875	242.15631103515625	10.5	340.0624084472656	48
KJHG – KJFöG) v. 12. Oktober 2004). Da jedoch keine Informationspflicht be-	127.6199951171875	254.15673828125	10.5	340.0476989746094	48
steht haben die Jugendämter oftmals keine Kenntnis von der Beteiligung von	127.6199951171875	266.15716552734375	10.5	340.0718688964844	48
Kindern und Jugendlichen an Medienproduktionen und können deshalb nicht	127.6199951171875	278.1575927734375	10.5	340.1453857421875	48
tätig werden.	127.6199951171875	290.15802001953125	10.5	55.019989013671875	48
5 Ausnahmeregelung im Bundesland Nordrhein-Westfalen	127.62000274658203	325.57135009765625	12.0	334.3620834350586	49
In NRW sind die inhaltlichen Anforderungen und Voraussetzungen einer Ge-	127.62000274658203	357.1728820800781	10.5	340.1591110229492	50
nehmigung gemäß des §6 JArbSchG durch die „Richtlinie für die Bewilligung	127.62000274658203	369.17333984375	10.5	340.1274948120117	50
der Mitwirkung von Kindern nach §6 JArbSchG im Medien- und Kulturbe-	127.62000274658203	381.1737976074219	10.5	340.0761947631836	50
reich“ vom 20.04.2000 konkretisiert worden (lt. RdErl. des Ministeriums für	127.62000274658203	393.17425537109375	10.5	340.23152923583984	50
Arbeit, Soziales und Stadtentwicklung, Kultur und Sport v. 20.4.2000). Der	127.62000274658203	405.1747131347656	10.5	340.12120819091797	50
wichtigste Punkt der Richtlinie ist die Festlegung der Begleitung von Kindern Richtlinie legt den	127.62000274658203	417.1751708984375	10.602691650390625	409.3612594604492	50
durch eine „weisungsunabhängige (d.h. sie ist dem Wohl des Kindes gegenüber Einsatz von	127.62000274658203	429.1756286621094	10.5	386.69652557373047	50
verpflichtet, nicht der Produktionsleitung) medienpädagogisch qualifizierte, so- Fachkraft für die	127.62000274658203	439.83721923828125	11.8388671875	404.3179244995117	50
zialpädagogische oder psychologische Fachkraft“ durch die zuständige Geneh- BKeingdleeirtufensgt der	127.62000274658203	449.8569030761719	17.99969482421875	398.2404098510742	50
migungsbehörde (Amt für Arbeitsschutz), wenn das Kind an mehr als 30 Tagen	127.62000274658203	465.177001953125	10.5	340.0037155151367	50
im Kalenderjahr an einer Produktion mitwirkt. Diese Fachkraft entwickelt u.a.	127.62000274658203	477.1774597167969	10.5	340.00679779052734	50
einen sogenannten Mitwirkungsplan für die Teilnahme der Kinder und Jugend-	127.62000274658203	489.17791748046875	10.5	340.0970687866211	50
lichen an Medienproduktionen, der zum Bestandteil der Bewilligung gemacht	127.62000274658203	501.1783752441406	10.5	340.0866012573242	50
werden muss.	127.62000274658203	513.1788330078125	10.5	57.699623107910156	50
Die Mitwirkung von Kindern und Jugendlichen an den genannten Medien-	144.59954833984375	525.1793212890625	10.5	323.2004699707031	50
produktionen wird einem Genehmigungsvorbehalt unterstellt. Der §6 JArbSchG	127.6199951171875	537.1797485351562	10.5	340.149658203125	50
sieht die Anhörung des örtlich zuständigen Jugendamtes durch die Staatlichen	127.6199951171875	549.18017578125	10.5	340.12957763671875	50
Ämter für Arbeitsschutz (StAfA) als zuständige Genehmigungsbehörde in NRW	127.6199951171875	561.1806640625	10.5	339.9858093261719	50
vor, d.h. dass dem Jugendamt unter Zuleitung der relevanten Informationen die	127.6199951171875	573.18115234375	10.5	340.0550537109375	50
Gelegenheit zur Stellungnahme gegeben wird. Die Erteilung einer Genehmi-	127.6199951171875	585.1815795898438	10.500015258789062	340.1180419921875	50
gung ist rechtswidrig, falls dem Jugendamt keine Gelegenheit für eine Stellung-	127.6199951171875	597.1820678710938	10.5	340.1517333984375	50
nahme gegeben wurde und kann folglich angefochten werden. Allerdings kann	127.6199951171875	609.1824951171875	10.5	340.1170959472656	50
eine Genehmigung nicht angefochten werden, wenn das Jugendamt nachweis-	127.6199951171875	621.1829833984375	10.5	340.1264953613281	50
lich die Gelegenheit zur Stellungnahme erhalten, sich jedoch nicht dazu geäu-	127.6199951171875	633.1834106445312	10.5	340.1632385253906	50
ßert hat. Die Genehmigungsbehörde kann nach freiem Ermessen entscheiden.	127.6199951171875	645.1838989257812	10.5	340.1747741699219	50
Dem Jugendamt steht nur ein Mitbestimmungsrecht zu.	127.6199951171875	657.184326171875	10.5	233.36459350585938	50
Die Richtlinie wird bisher ausschließlich in Nordrhein-Westfalen angewen-	144.59954833984375	669.184814453125	10.5	323.1753234863281	50
det. Die Medienwirtschaft hatte sich zwar für die bundesweite Anwendung aus-	127.61894226074219	681.1852416992188	10.5	340.0918426513672	50
gesprochen, jedoch ist der Vorstoß des Landes NRW bisher erfolglos verlaufen.	127.61894226074219	693.1857299804688	10.5	340.0467071533203	50
98 Melanie Garbas	56.70000076293945	115.57769775390625	9.0	80.00820541381836	51
Richtlinie wurde von Man muss in diesem Zusammenhang erläutern, dass die Entwicklung der Richt-	49.91999816894531	146.15289306640625	10.5	417.8002166748047	52
Produktionsfirmen linie von den NRW-Produktionsfirmen angestoßen wurde (vgl. Hansbauer/	56.639957427978516	158.12384033203125	10.52947998046875	411.0120506286621	52
angestoßen Güthoff 2001). Sie beklagten, dass „aufwendige Film- und Fernsehproduktionen	79.26006317138672	168.2774658203125	12.37628173828125	388.4391860961914	52
mit Kindern am Standort NRW aufgrund der restriktiven Bedingungen des Kin-	127.62000274658203	182.1541748046875	10.5	340.12853240966797	52
derarbeitsschutzes kaum möglich sind.“ Die Produzenten drohten sogar in eini-	127.62000274658203	194.15460205078125	10.5	340.0824203491211	52
gen Fällen mit einer Verlagerung der Firmensitze in das benachbarte Ausland,	127.62000274658203	206.155029296875	10.5	340.09297943115234	52
„wo die Arbeitsbedingungen für Kinder weniger restriktiv gehandhabt werden“.	127.62000274658203	218.15545654296875	10.5	337.17806243896484	52
Aber auch Produktionsfirmen, die sich sehr für gute Arbeitsbedingungen	144.59954833984375	230.1558837890625	10.5	323.06719970703125	52
engagierten und entsprechende Mehrinvestitionen und Wettbewerbsnachteile	127.6199951171875	242.15631103515625	10.5	340.10443115234375	52
gegenüber anderen Firmen in Kauf nahmen, wünschten sich einheitliche und	127.61997985839844	254.15673828125	10.5	340.09608459472656	52
verbesserte Bedingungen mit flexibleren und längeren Drehzeiten für die Arbeit	127.61997985839844	266.15716552734375	10.5	340.15480041503906	52
mit Kindern für alle Produktionsfirmen, die den Medienstandort NRW reprä-	127.61997985839844	278.1575927734375	10.5	340.11180114746094	52
sentieren.	127.61997985839844	290.15802001953125	10.5	40.69065856933594	52
Es werden derzeit drei Bewilligungsverfahren angewandt (Bundesvereini-	144.5995330810547	302.158447265625	10.5	323.12806701660156	52
gung für medienpädagogische Fachkräfte (BV MPF) e.V.):	127.61997985839844	314.15887451171875	10.5	248.97389221191406	52
–	127.61997985839844	332.1590270996094	10.5	5.25	53
–	127.61997985839844	356.1599426269531	10.5	5.25	54
–	127.61997985839844	380.1608581542969	10.5	5.25	55
Das „vereinfachte Verfahren“ für die Mitwirkung von Kindern an bis zu	144.5995330810547	332.1590270996094	10.5	323.0745086669922	56
drei Tagen im Kalenderjahr.	144.5995330810547	344.15948486328125	10.5	119.18757629394531	56
Die „Regelbewilligung“ für die Mitwirkung von Kindern an bis zu 30 Ta-	144.5995330810547	356.1599426269531	10.5	323.14161682128906	56
gen im Kalenderjahr.	144.5995330810547	368.160400390625	10.5	89.10404968261719	56
Das „besondere Verfahren“ für die Mitwirkung von Kindern an mehr als 30	144.5995330810547	380.1608581542969	10.5	323.0808868408203	56
Tagen im Kalenderjahr oder z.B. bei psychisch belastenden Inhalten. Hier	144.5995330810547	392.16131591796875	10.5	323.15321350097656	56
muss u.a. seitens der medienpädagogischen Fachkraft ein individueller	144.5995330810547	404.1617736816406	10.5	323.16062927246094	56
Mitwirkungsplan für jedes Kind erstellt werden, ggf. auch ein psychologi-	144.5995330810547	416.1622314453125	10.5	323.15443420410156	56
sches Gutachten von entsprechenden Experten herangezogen werden.	144.5995330810547	428.1626892089844	10.5	293.59571838378906	56
6 Die medienpädagogische Fachkraft	127.62000274658203	463.57135009765625	12.0	214.3127670288086	57
Die Konzeptidee zum Einsatz einer begleitenden Fachkraft entstand auf Anre-	127.62000274658203	493.19287109375	10.5	340.1411666870117	58
gung einer Jugendamtsleitertagung im Jahr 2000. Hier rief die Verwaltung des	127.62000274658203	505.193359375	10.5	340.08654022216797	58
Landesjugendamtes den Arbeitskreis „Beteiligung von Kindern in Medienpro-	127.62000274658203	517.1937866210938	10.5	340.13802337646484	58
duktionen“ ins Leben, um den Schutz von Kindern und Jugendlichen bei der	127.62000274658203	529.1942138671875	10.5	340.18321990966797	58
Mitwirkung in modernen Medien und in der Werbung zu thematisieren. In die-	127.62000274658203	541.1947021484375	10.5	340.12960052490234	58
sem Gremium beteiligten sich VertreterInnen des Ministeriums für Generatio-	127.62000274658203	553.1951904296875	10.5	340.0540084838867	58
nen, Familie, Frauen und Integration des Landes NRW (MGFFI NRW), das Mi-	127.6199951171875	565.1956176757812	10.5	340.1253967285156	58
nisterium für Arbeit, Gesundheit und Soziales des Landes NRW (MAGS NRW),	127.6199951171875	577.1961059570312	10.500015258789062	340.021484375	58
die Arbeitsgemeinschaft Kinder- und Jugendschutz NRW, der Deutsche Kinder-	127.6199951171875	589.196533203125	10.5	340.080322265625	58
schutzbund NRW, die Landesanstalt für Medien, das Medienzentrum Rheinland	127.6199951171875	601.197021484375	10.5	340.0540771484375	58
und Jugendschutzfachkräfte einzelner rheinischer Jugendämter.	127.6199951171875	613.1974487304688	10.5	267.6565856933594	58
Die Tätigkeit der weisungsunabhängigen medienpädagogisch qualifizierten,	144.59954833984375	625.1979370117188	10.5	323.1123352050781	58
sozialpädagogischen oder psychologischen Fachkraft baut auf eine qualifizierte	127.6199951171875	637.1983642578125	10.5	340.119140625	58
