Im Vordergrund steht zunächst eine	396.9099426269531	459.3626708984375	10.0	164.27200317382812	260
sehr große Vielfalt der wahrgenom-	396.7899475097656	471.3626708984375	10.0	164.27896118164062	260
menen Auswirkungen der regionalen	396.7899475097656	483.3626708984375	10.0	164.28799438476562	260
Krise. Dabei werden die wirtschaftli-	396.7899475097656	495.3626708984375	10.0	164.27200317382812	260
chen und die wirtschaftlich-sozialen	396.7899475097656	507.3626708984375	10.0	164.28005981445312	260
Auswirkungen am stärksten von den	396.7899475097656	519.3626708984375	10.0	164.28201293945312	260
Befragten reflektiert. Die reinen so-	396.7899475097656	531.3626708984375	10.0	164.27999877929688	260
zialen Effekte, wie Kriminalität oder	396.7899475097656	543.3626708984375	10.0	164.25997924804688	260
Auswanderung sind stadtspezifische	396.7899475097656	555.3626708984375	10.0	164.27401733398438	260
Elemente, die von den lokalen Akteu-	396.7899475097656	567.3626708984375	10.0	164.28506469726562	260
ren kaum thematisiert worden sind.	396.7899475097656	579.3626708984375	10.000015258789062	156.73001098632812	260
Die Entwicklungsmöglichkeiten der	408.18994140625	591.46435546875	10.0	152.99200439453125	260
Region werden von den regionalen	396.7899475097656	603.46435546875	10.018310546875	164.39199829101562	260
Experten mit der Rolle des Staates in	396.7899169921875	615.482666015625	10.0	164.28997802734375	260
Verbindung gebracht. In diesem Zu-	396.7899169921875	627.482666015625	10.0	164.27508544921875	260
sammenhang wird gefordert, dass der	396.7899169921875	639.482666015625	10.0	164.26806640625	260
Staat in Zukunft seine Kontrolle auf	396.7899169921875	651.482666015625	10.0	164.29498291015625	260
die Gesellschaft ausdehnen sollte. Die	396.7899169921875	663.482666015625	10.0	164.29296875	260
regionalen Experten sehen darin die	396.7899169921875	675.482666015625	10.0	164.281982421875	260
einzige Möglichkeit, bestimmte Ent-	396.7899169921875	687.482666015625	10.0	164.28302001953125	260
wicklungen in der Region zu realisie-	396.7899169921875	699.482666015625	10.0	164.28802490234375	260
ren. Konkret geht es um die Schaffung	396.7899169921875	711.482666015625	10.0	164.26806640625	260
und Anwendung von Entwicklungs-	396.7899169921875	723.482666015625	10.0	164.28900146484375	260
programmen, die Unterstützung des	396.7899169921875	735.482666015625	10.0	164.2869873046875	260
privaten Eigentums kleiner und mitt-	396.7899169921875	747.482666015625	10.0	164.28204345703125	260
lerer Unternehmen sowie der effekti-	396.7899169921875	759.482666015625	10.0	164.28204345703125	260
ven landwirtschaftlichen Betriebe. Die	396.7899169921875	771.482666015625	9.999996185302734	164.27001953125	260
EUROPA REGIONAL 8(2000)2	467.7099914550781	799.382080078125	7.0	93.24209594726562	261
letztgenannten Maßnahmen sollten kerung) bildet den Schwachpunkt des	33.93000030517578	51.12255859375	10.0	341.3939743041992	262
z. B. durch Kreditvergünstigungen Planes.	33.93000030517578	63.12255859375	10.0	208.67998504638672	262
wirksam werden. Hinzu kommen die Die Maßnahmen für die Industrie	33.93000030517578	75.12255859375	10.1199951171875	341.51195526123047	262
vom Staat subventionierten Preise für sind detaillierter, konzentrieren sich	33.93000030517578	87.12255859375	10.1199951171875	341.4149703979492	262
Agrarprodukte, bessere Vermarktung jedoch auf mittlere und große Unter-	33.93000030517578	99.12255859375	10.1199951171875	341.39196014404297	262
der Produkte, Vergünstigungen für nehmen in den Städten. Im ländlichen	33.93000030517578	111.12255859375	10.1199951171875	341.39501190185547	262
Investoren, Verbesserung der Legisla- Raum sollen die mittleren und kleinen	33.93000030517578	123.12255859375	10.1199951171875	341.4139938354492	262
tive (Landrestitutionsgesetz, Gesetz Unternehmen unterstützt werden. Aus	33.93000030517578	135.12255859375	10.1199951171875	341.4139938354492	262
der öffentlichen Verwaltung usw.). der Gesamtzahl von 36 Projekten in	33.93000030517578	147.12255859375	10.1199951171875	341.3960189819336	262
Zusammenfassend weisen die re- der Region sind 21 in Bistriţa und nur	45.209999084472656	159.2425537109375	10.0	330.1320114135742	262
gionalen Experten dem Staat eine 15 im ländlichen Raum lokalisiert. Die	33.93000030517578	171.2425537109375	10.0	341.40196990966797	262
wichtige Rolle in der regionalen Ent- dominierende Position des regionalen	33.93000030517578	183.2425537109375	10.0	341.3860397338867	262
wicklung zu, ohne jedoch Finanzie- Zentrums ist auch hier festzustellen,	33.93000030517578	195.2425537109375	10.0	341.40795135498047	262
rungsquellen aufzuzeigen. Erwähnt während der ländliche Raum weniger	33.93000030517578	207.2425537109375	10.0	341.39000701904297	262
werden muss in diesem Zusammen- dynamisch ist.	33.93000030517578	219.2425537109375	10.0	239.51998138427734	262
hang allerdings, dass eine große An- Im Programm erscheinen auch wei-	33.93000030517578	231.2425537109375	10.0	341.5149154663086	262
zahl der Befragten Staatsangestellte tere Zielstellungen wie die Reduzie-	33.93000030517578	243.2425537109375	10.0	341.44295501708984	262
sind. Demgegenüber hatten die Be- rung der Arbeitslosigkeit, die Verbes-	33.93000030517578	255.2425537109375	10.0	341.41295623779297	262
fragten aus der privaten Sphäre kein serung der Lebensqualität, die Ent-	33.93000030517578	267.2425537109375	10.0	341.40401458740234	262
differenziertes Bild zu diesem Thema. wicklung der Infrastruktur und die	33.93000030517578	279.2425537109375	10.0	341.3879928588867	262
Sekundär werden auch weitere Ent- Nutzung des touristischen Potenzials,	45.209999084472656	291.2425537109375	10.0	330.1319808959961	262
wicklungsmöglichkeiten erwähnt: aus- ohne dass konkrete Instrumente und	33.93000030517578	303.2425537109375	10.0	341.4080123901367	262
ländische Investitionen (wobei an die Modalitäten für die Durchführung die-	33.93000030517578	315.2425537109375	10.0	341.38997650146484	262
ausgewanderten Deutschen große Er- ser Ziele erwähnt werden.	33.93000030517578	327.2425537109375	10.0	292.4439926147461	262
wartungen geknüpft werden) bzw. die Auf dem Niveau der lokalen Exper-	33.93000030517578	339.2425537109375	10.1199951171875	341.5179672241211	262
bessere Nutzung der menschlichen ten behält der Staat die gleiche wichti-	33.93000030517578	351.2425537109375	10.1199951171875	341.40795135498047	262
Ressourcen ohne konkretere Anga- ge Rolle in der Regionalentwicklung,	33.93000030517578	363.2425537109375	10.1199951171875	341.39998626708984	262
ben. bedingt durch die Subvention der	33.93000030517578	375.2425537109375	10.1199951171875	341.3870162963867	262
Die einzige konkrete regionale Landwirtschaft. Die auf lokaler Ebe-	45.209999084472656	387.362548828125	10.0	330.1349411010742	262
Strategie, die auch die Mittel der Ver- ne Befragten sehen auch andere Wege	33.93000030517578	399.362548828125	10.0	341.40596771240234	262
waltung der regionalen Krise vorstellt, zur besseren Nutzung lokaler Ressour-	33.93000030517578	411.362548828125	10.0	341.39998626708984	262
wurde unter der Koordinierung des cen (ohne dass sie jedoch genauere	33.93000030517578	423.362548828125	10.0	341.40999603271484	262
Handels- und Industriekammer Angaben dazu gemacht hätten), wie	33.93000030517578	435.362548828125	10.0	341.40404510498047	262
Bistriţa-Năsăud 1998 ausgearbeitet. z. B. durch Teilnahme an internatio-	33.93000030517578	447.362548828125	10.0	341.50496673583984	262
Diese prognostiziert nur sektorale nalen Programmen oder Gründung	33.93000030517578	459.362548828125	10.0	341.4030075073242	262
(wirtschaftliche und beschäftigungs- landwirtschaftlicher Gesellschaften.	33.93000030517578	471.362548828125	10.0	341.38500213623047	262
orientierte) Maßnahmen und kann das Die letztgenannte Strategie überrascht	33.93000030517578	483.362548828125	10.0	341.3979721069336	262
Fehlen von integrierten und komple- angesichts des niedrigen Assoziie-	33.93000030517578	495.362548828125	10.0	341.3899459838867	262
xen Entwicklungsplänen nicht erset- rungsgrads in der Region. Es bedeu-	33.92999267578125	507.362548828125	10.0	341.3999938964844	262
zen. Der realisierte wirtschaftliche Ent- tet, dass die lokalen Experten die	33.92999267578125	519.362548828125	10.0	341.39300537109375	262
wicklungsplan sieht stadtbezogene sek- Möglichkeit der Assoziierung zwar als	33.92999267578125	531.362548828125	10.0	341.39599609375	262
torale Maßnahmen und Strategien vor. effizientes Instrument der Entwick-	33.92999267578125	543.362548828125	10.0	341.3979797363281	262
Der Maßnahmenkatalog für den länd- lung und der rationalen Organisierung	33.92999267578125	555.362548828125	10.0	341.3900146484375	262
lichen Raum ist weniger umfangreich betrachten, jedoch noch keine kon-	33.92999267578125	567.362548828125	10.0	341.3889465332031	262
und weniger detailliert ausgearbeitet. kreten Handlungsmodelle für deren	33.92999267578125	579.362548828125	10.000015258789062	341.41400146484375	262
Gemäß diesem Katalog soll die Revi- Umsetzung in die Praxis gefunden	33.92999267578125	591.362548828125	10.0	341.4010009765625	262
talisierung der Landwirtschaft Priori- haben; somit können sie die Handlung	33.92999267578125	603.362548828125	10.0	341.3999938964844	262
tät haben. Dafür wären die Gründung der Landwirte nicht in diese Richtung	33.92999267578125	615.362548828125	10.0	341.40203857421875	262
und Unterstützung formeller privater beeinflussen.	33.92999267578125	627.362548828125	10.0	234.35800170898438	262
landwirtschaftlicher Betriebe erforder- Die Rolle der Experten wurde eben-	33.92999267578125	639.362548828125	10.1199951171875	341.39996337890625	262
lich, weitere konkrete Maßnahmen falls in zwei unterschiedlichen Maß-	33.92999267578125	651.362548828125	10.1199951171875	341.3899841308594	262
werden jedoch nicht erwähnt. Es ist zu stabsebenen beurteilt. Viele regionale	33.92999267578125	663.362548828125	10.1199951171875	341.408935546875	262
vermuten, dass dies nur weiche Maß- Experten sind der Meinung, dass ihre	33.92999267578125	675.362548828125	10.1199951171875	341.3899841308594	262
nahmen in Form von finanziellen Sti- Entscheidungsmacht nach 1989 zu-	33.92999267578125	687.362548828125	10.1199951171875	341.4139709472656	262
muli sein können, weil die starken Ein- rückgegangen sei. Inzwischen sind	33.92999267578125	699.362548828125	10.1199951171875	341.39599609375	262
griffe des sozialistischen Staates neue konkurrierende Institutionen	33.92999267578125	711.362548828125	10.1199951171875	341.4019775390625	262
schlechte Erfahrungen hinterlassen entstanden, mit denen die Macht ge-	33.92999267578125	723.362548828125	10.1199951171875	341.3879699707031	262
haben. Und genau dieses Fehlen einer teilt werden muss. Die Mehrheit der	33.92999267578125	735.362548828125	10.1199951171875	341.39599609375	262
kohärenten sektoralen Unterstüt- regionalen Experten sieht ihre Rolle	33.92999267578125	747.362548828125	10.1199951171875	341.4029846191406	262
zungsstrategie der Landwirtschaft (die begrenzt auf Consulting, auf die Dar-	33.92999267578125	759.362548828125	10.1199951171875	341.4229431152344	262
Hauptaktivität der ländlichen Bevöl- stellung der Region für potenzielle	33.92999267578125	771.362548828125	10.119991302490234	341.3919982910156	262
Investoren, auf die Koordinierung re-	388.28997802734375	51.12249755859375	10.0	164.2720947265625	263
gionaler Akteure und auf die Ausar-	388.28997802734375	63.12249755859375	10.0	164.26806640625	263
beitung von Vorschlägen für die regio-	388.28997802734375	75.12249755859375	10.0	164.2740478515625	263
nale Entwicklung. In keinem Fall reicht	388.28997802734375	87.12249755859375	10.0	164.2669677734375	263
diese Befugnis in Form konkreter Ent-	388.28997802734375	99.12249755859375	10.0	164.27606201171875	263
scheidungen und Kooperationen mit	388.28997802734375	111.12249755859375	10.0	164.27203369140625	263
regionalen Akteuren in den prakti-	388.28997802734375	123.12249755859375	10.0	164.28302001953125	263
schen Bereich hinein. Konkrete Ak-	388.28997802734375	135.12249755859375	10.0	164.26708984375	263
tionen sind nur im Zusammenhang	388.28997802734375	147.12249755859375	10.0	164.2900390625	263
mit der Kontrolle der Ausdehnung von	388.28997802734375	159.12249755859375	10.0	164.26995849609375	263
bebauten Flächen und anderen Bau-	388.28997802734375	171.12249755859375	10.0	164.2840576171875	263
maßnahmen vorgesehen. Auf allen	388.28997802734375	183.12249755859375	10.0	164.27001953125	263
anderen Gebieten fallen die Entschei-	388.28997802734375	195.12249755859375	10.0	164.2860107421875	263
dungen nach Meinung der befragten	388.28997802734375	207.12249755859375	10.0	164.2879638671875	263
Experten im Kreisrat. Er verfügt über	388.28997802734375	219.12249755859375	10.0	164.26800537109375	263
den Etat, verteilt die finanziellen Res-	388.28997802734375	231.12249755859375	10.0	164.27001953125	263
sourcen und hat dadurch die Kontrolle	388.28997802734375	243.12249755859375	10.0	164.27001953125	263
über die Entwicklung bestimmter Räu-	388.28997802734375	255.12249755859375	10.0	164.2950439453125	263
me. Der Kreisrat und der Haushalt	388.28997802734375	267.12249755859375	10.0	164.26806640625	263
sind also als wichtige Kontrollinstru-	388.28997802734375	279.12249755859375	10.0	164.22998046875	263
mente der Entwicklung anzusehen.	388.28997802734375	291.12249755859375	10.0	164.27593994140625	263
Hierzu kommen Bemühungen nach	388.28997802734375	303.12249755859375	10.0	164.29400634765625	263
ausländischen Partnerschaften in Form	388.28997802734375	315.12249755859375	10.0	164.2650146484375	263
von Bewerbungen für internationale	388.28997802734375	327.12249755859375	10.0	164.26800537109375	263
Entwicklungsfonds.	388.28997802734375	339.12249755859375	10.0	86.1669921875	263
Auf lokalem Niveau ist das Hand-	399.6899719238281	351.22418212890625	10.018310546875	152.87600708007812	263
lungsfeld kleiner, und es werden weni-	388.28997802734375	363.24249267578125	10.0	164.27001953125	263
ger vom Kreis und Staat unabhängige	388.28997802734375	375.24249267578125	10.0	164.28399658203125	263
Handlungsmöglichkeiten erkannt. So	388.28997802734375	387.24249267578125	10.0	164.2730712890625	263
meinen die Bürgermeister, dass nur	388.28997802734375	399.24249267578125	10.0	164.23504638671875	263
sie die Umsetzungsmacht für Entschei-	388.28997802734375	411.24249267578125	10.0	164.2860107421875	263
dungen haben, die vom lokalen Rat	388.28997802734375	423.24249267578125	10.0	164.26800537109375	263
getroffen worden sind. Die Ratsmit-	388.28997802734375	435.24249267578125	10.0	164.281982421875	263
glieder berufen sich sehr oft auf das	388.28997802734375	447.24249267578125	10.0	164.28997802734375	263
Argument der zu geringen finanziel-	388.28997802734375	459.24249267578125	10.0	164.28399658203125	263
len Mittel. Diese sollen von der obe-	388.28997802734375	471.24249267578125	10.0	164.28204345703125	263
ren Verwaltungsebene kommen. Na-	388.28997802734375	483.24249267578125	10.0	164.291015625	263
türlich fehlen lokale informelle Stra-	388.28997802734375	495.24249267578125	10.0	164.28997802734375	263
tegien für das Einwerben finanzieller	388.28997802734375	507.24249267578125	10.0	164.26605224609375	263
Mittel nicht gänzlich, wobei dafür das	388.28997802734375	519.2424926757812	10.0	164.29803466796875	263
soziale Kapital lokaler Experten ent-	388.28997802734375	531.2424926757812	10.0	164.27398681640625	263
scheidend ist. Weitere Handlungsmög-	388.28997802734375	543.2424926757812	10.0	164.27001953125	263
lichkeiten werden in der Organisation	388.28997802734375	555.2424926757812	10.0	164.2659912109375	263
lokaler Aktivitäten wie der Nutzung	388.28997802734375	567.2424926757812	10.0	164.2860107421875	263
der Weiden, der Erteilung technischer	388.28997802734375	579.2424926757812	10.000015258789062	164.2900390625	263
Ratschläge für Landwirte (obwohl in	388.28997802734375	591.2424926757812	10.0	164.30804443359375	263
der Befragung der niedrige Grad der	388.28997802734375	603.2424926757812	10.0	164.32806396484375	263
Inanspruchnahme solcher Dienstleis-	388.28997802734375	615.2424926757812	10.0	164.2760009765625	263
tungen nachgewiesen wurde) gesehen.	388.28997802734375	627.2424926757812	10.0	164.28094482421875	263
Hinzu kommt die Restitution des Lan-	388.28997802734375	639.2424926757812	10.0	164.27001953125	263
des an die ehemaligen Eigentümer,	388.28997802734375	651.2424926757812	10.0	164.25799560546875	263
ein bedeutender, gegenwärtig noch	388.28997802734375	663.2424926757812	10.0	164.27197265625	263
andauernder Prozess. Neue lokale	388.28997802734375	675.2424926757812	10.0	164.281005859375	263
Konflikte entstehen bei der Vertei-	388.28997802734375	687.2424926757812	10.0	164.27996826171875	263
lung finanzieller Ressourcen innerhalb	388.28997802734375	699.2424926757812	10.0	164.29095458984375	263
der einzelnen Siedlungen einer Ge-	388.28997802734375	711.2424926757812	10.0	164.26702880859375	263
meinde. Sie treten in der Regel in den	388.28997802734375	723.2424926757812	10.0	164.22802734375	263
Gemeinden auf, die vor 1989 privile-	388.28997802734375	735.2424926757812	10.0	164.2750244140625	263
gierte Gemeindezentren waren (durch	388.28997802734375	747.2424926757812	10.0	164.2919921875	263
Lenkung von Investitionen in diese	388.28997802734375	759.2424926757812	10.0	164.27996826171875	263
Zentren) und die gegenwärtig in Kon-	388.28997802734375	771.2424926757812	9.999996185302734	164.27001953125	263
51	531.3300170898438	799.6130981445312	11.999998092651367	14.27996826171875	264
kurrenz zu den Siedlungen treten, de-	42.43000030517578	51.12255859375	10.0	164.2800064086914	265
ren funktionale Bedeutung inzwischen	42.43000030517578	63.12255859375	10.0	164.29003143310547	265
gleichwertig oder sogar größer ist (und	42.43000030517578	75.12255859375	10.0	164.27605438232422	265
die dementsprechend über mehr Rats-	42.43000030517578	87.12255859375	10.0	164.27201080322266	265
mitglieder verfügen). Letztere verlan-	42.43000030517578	99.12255859375	10.0	164.28495025634766	265
gen aufgrund einer Einwohnerschwel-	42.43000030517578	111.12255859375	10.0	164.2859878540039	265
lenzahl einen objektiv verteilten Haus-	42.43000030517578	123.12255859375	10.0	164.28202056884766	265
halt. Flexiblere Handlungswege wer-	42.43000030517578	135.12255859375	10.0	164.2890396118164	265
den in lokalen Vergünstigungen für	42.43000030517578	147.12255859375	10.0	164.31403350830078	265
Investoren, in der Förderung der Ko-	42.43000030517578	159.12255859375	10.0	164.3300552368164	265
operation mit den benachbarten Ge-	42.43000030517578	171.12255859375	10.0	164.28400421142578	265
meinden zur Durchführung gemeinsa-	42.43000030517578	183.12255859375	10.0	164.27802276611328	265
mer Investitionsprojekte und in der	42.43000030517578	195.12255859375	10.0	164.25000762939453	265
Lösung gemeinsamer Landnutzungs-	42.43000030517578	207.12255859375	10.0	164.2900161743164	265
probleme gesehen.	42.43000030517578	219.12255859375	10.0	82.92198944091797	265
Als Akteure der regionalen Entwick-	53.709999084472656	231.2242431640625	10.0	153.01599884033203	265
lung betrachtet die Mehrheit der re-	42.43000030517578	243.2242431640625	10.018310546875	164.26898956298828	265
gionalen Experten:	42.43000030517578	255.2425537109375	10.0	84.1159896850586	265
 die im Kreis vertretenen staatlichen	42.310001373291016	267.2425537109375	10.0	164.41398239135742	265
Institutionen, den Staat allgemein	50.83000183105469	279.2425537109375	10.0	155.88296508789062	265
(durch Subventionen und fiskalische	50.83000183105469	291.2425537109375	10.0	155.87599182128906	265
Vergünstigungen),	50.83000183105469	303.2425537109375	10.0	81.83601379394531	265
 Banken, ebenfalls mit Blick auf	42.310001373291016	315.2425537109375	10.0	164.4099998474121	265
Vergünstigungen (in Form von	50.83000183105469	327.2425537109375	10.0	155.88494873046875	265
niedrigeren Zinsen),	50.83000183105469	339.2425537109375	10.0	90.83900451660156	265
 Entwicklungsbüros, die jedoch noch	42.310001373291016	351.2425537109375	10.0	164.4150505065918	265
nicht existieren,	50.83000183105469	363.2425537109375	10.0	71.04399871826172	265
 die Präfektur und den Kreisrat in	42.310001373291016	375.2425537109375	10.0	164.39403915405273	265
Zusammenarbeit,	50.83000183105469	387.2425537109375	10.0	78.0	265
 regionale Entwicklungseinrichtun-	42.310001373291016	399.2425537109375	10.0	164.39599227905273	265
gen,	50.83000183105469	411.2425537109375	10.0	18.360000610351562	265
 Massenmedien durch Förderung des	42.310001373291016	423.2425537109375	10.0	164.39097213745117	265
regionalen Images,	50.83000183105469	435.2425537109375	10.0	84.24000549316406	265
 lokale Räte und öffentliche Verwal-	42.310001373291016	447.2425537109375	10.0	164.38798141479492	265
tungen,	50.83000183105469	459.2425537109375	10.0	32.88200378417969	265
 Zivilorganisationen,	42.310001373291016	471.2425537109375	10.0	97.55099105834961	265
 Kirche.	42.310001373291016	483.2425537109375	10.0	41.15999984741211	265
Auf lokalem Niveau sind folgende	42.43000030517578	495.2137756347656	10.028778076171875	164.28400421142578	265
Akteure erwähnt worden:	42.43000030517578	507.2425537109375	10.0	113.87200164794922	265
 Kreisrat, der alle Aktionen “vor-	42.310001373291016	519.362548828125	10.0	164.3960075378418	265
denken” soll, aufgrund der konkre-	50.83000183105469	531.362548828125	10.0	155.8849639892578	265
ten Situation vor Ort,	50.83000183105469	543.362548828125	10.0	96.71298217773438	265
 lokale Privatunternehmer,	42.310001373291016	555.362548828125	10.0	125.51198959350586	265
 die Präfektur und ihre untergeord-	42.310001373291016	567.362548828125	10.0	164.4030418395996	265
neten Institutionen,	50.83000183105469	579.362548828125	10.000015258789062	87.35600280761719	265
 politische Parteien.	42.310001373291016	591.362548828125	10.0	94.29500961303711	265
Aus dem Vergleich der Varianten der	42.43000030517578	603.362548828125	10.0	164.23600006103516	265
beiden Ebenen kann die große Breite	42.43000030517578	615.362548828125	10.0	164.29195404052734	265
von Möglichkeiten auf regionalem	42.43000030517578	627.362548828125	10.0	164.29499053955078	265
Niveau festgestellt werden. Dies er-	42.43000030517578	639.362548828125	10.0	164.28998565673828	265
scheint auch logisch, weil die regiona-	42.43000030517578	651.362548828125	10.0	164.28400421142578	265
len Experten besser informiert sind	42.43000030517578	663.362548828125	10.0	164.2719955444336	265
und einen größeren Überblick über	42.43000030517578	675.362548828125	10.0	164.26996612548828	265
die Region haben als die lokalen Ex-	42.43000030517578	687.362548828125	10.0	164.28504180908203	265
perten. Die Dependenzbeziehungen	42.43000030517578	699.362548828125	10.0	164.27397918701172	265
zwischen dem unteren und oberen	42.43000030517578	711.362548828125	10.0	164.27001190185547	265
Entscheidungsniveau, die Orientie-	42.43000030517578	723.362548828125	10.0	164.29398345947266	265
rung der Interaktionen und Beziehun-	42.43000030517578	735.362548828125	10.0	164.26697540283203	265
gen vom lokalen zum regionalen Zen-	42.43000030517578	747.362548828125	10.0	164.29401397705078	265
trum sind Ausdruck eines Machtun-	42.43000030517578	759.362548828125	10.0	164.28400421142578	265
terschiedes zwischen den beiden Ebe-	42.43000030517578	771.362548828125	9.999996185302734	164.2699966430664	265
52	49.27000045776367	799.6130981445312	11.999998092651367	14.279998779296875	266
nen bzw. Ausdruck der Positionsdiffe-	219.54998779296875	51.12255859375	10.0	164.29000854492188	267
renz im Rahmen der Siedlungshierar-	219.54998779296875	63.12255859375	10.0	164.24002075195312	267
chie und der regionalen Sozialhierar-	219.54998779296875	75.12255859375	10.0	164.28201293945312	267
chie.	219.54998779296875	87.12255859375	10.0	20.8800048828125	267
Insgesamt wird die Krise in der	230.94998168945312	99.2425537109375	10.0	152.98995971679688	267
Region von den lokalen und regiona-	219.54998779296875	111.2425537109375	10.0	164.27597045898438	267
len Akteuren unterschiedlich beurteilt.	219.54998779296875	123.2425537109375	10.0	164.26800537109375	267
Die lokalen Hintergründe prägen die	219.54998779296875	135.2425537109375	10.0	164.280029296875	267
differenzierte Wahrnehmung dieses	219.54998779296875	147.2425537109375	10.0	164.2860107421875	267
Phänomens. Obwohl für einen außen-	219.54998779296875	159.2425537109375	10.0	164.2869873046875	267
stehenden Beobachter oder sogar vom	219.54998779296875	171.2425537109375	10.0	164.27798461914062	267
regionalen Zentrum aus die Krise als	219.54998779296875	183.2425537109375	10.0	164.2750244140625	267
eine für die ganze Region typische	219.54998779296875	195.2425537109375	10.0	164.27398681640625	267
Erscheinung einzuschätzen ist, wer-	219.54998779296875	207.2425537109375	10.0	164.27197265625	267
den auf der lokalen Ebene die Bilder	219.54998779296875	219.2425537109375	10.0	164.27499389648438	267
durch das lokal Spezifische reflektiert.	219.54998779296875	231.2425537109375	10.0	164.27597045898438	267
Eine zweite wichtige Nuancierung wird	219.54998779296875	243.2425537109375	10.0	164.26800537109375	267
durch zwei weitere Ebenen einge-	219.54998779296875	255.2425537109375	10.0	164.27700805664062	267
bracht: die regional-städtische und die	219.54998779296875	267.2425537109375	10.0	164.2860107421875	267
lokal-ländliche. Letztere bezeichnet	219.54998779296875	279.2425537109375	10.0	164.2900390625	267
den Rückzug des Staates aus bestimm-	219.54998779296875	291.2425537109375	10.0	164.27499389648438	267
ten Bereichen der Gesellschaft, vor	219.54998779296875	303.2425537109375	10.0	164.27197265625	267
allem aus der Landwirtschaft, als	219.54998779296875	315.2425537109375	10.0	164.2960205078125	267
Hauptgrund der Krise. Dementspre-	219.54998779296875	327.2425537109375	10.0	164.28793334960938	267
chend hinge also die Lösung der Krise	219.54998779296875	339.2425537109375	10.0	164.27001953125	267
vom Staat ab. Die Erwartungen ge-	219.54998779296875	351.2425537109375	10.0	164.27200317382812	267
