C	78.76429748535156	320.80230712890625	6.9306640625	4.994728088378906	89
9 /)*	78.76429748535156	331.3965759277344	6.930694580078125	25.576332092285156	89
>'	158.90719604492188	171.59332275390625	6.9306640625	7.7587890625	90
)">	156.889892578125	298.1943359375	6.9306640625	11.638198852539062	91
)(	150.33395385742188	321.41363525390625	6.9306640625	6.8097381591796875	92
2	146.0596923828125	332.0079040527344	6.930694580078125	5.784454345703125	92
D	156.8734130859375	353.0814208984375	4.504913330078125	2.0712890625	93
(	174.98367309570312	353.0814208984375	4.504913330078125	2.1973724365234375	94
Abb. 2: Nutzungsstruktur der	33.93000030517578	379.25238037109375	9.0	117.47069549560547	95
landwirtschaftlichen Flächen in den	33.93000030517578	390.0523681640625	9.0	141.83367156982422	95
privaten Betrieben von	33.93000030517578	400.85235595703125	9.0	90.95850372314453	95
a) Jeica	33.93000030517578	411.6702575683594	7.0	24.840198516845703	95
b) Lechinţa	33.93000030517578	420.07025146484375	7.0	35.51799774169922	95
Quelle: eigener Entwurf	33.93000030517578	428.4702453613281	7.0	74.76280212402344	95
den Gesellschaften nur auf der Prä-	33.93000030517578	447.1225280761719	10.0	164.29199981689453	96
senz lokaler Akteure beruht. Diese	33.93000030517578	459.1225280761719	10.0	164.2789535522461	96
können durch ihren höheren Status	33.93000030517578	471.1225280761719	10.0	164.28397369384766	96
und ein entsprechend großes Ansehen	33.93000030517578	483.1225280761719	10.0	164.24996185302734	96
die Entscheidungen der ganzen Ge-	33.93000030517578	495.1225280761719	10.0	164.28199005126953	96
meinschaft beeinflussen. Sie haben das	33.93000030517578	507.12255859375	10.0	164.28397369384766	96
nötige kulturelle, soziale und wirt-	33.93000030517578	519.12255859375	10.0	164.28498077392578	96
schaftliche Kapital, um eine Schlüssel-	33.93000030517578	531.12255859375	10.0	164.28797149658203	96
rolle in der Lokalentwicklung zu spie-	33.93000030517578	543.12255859375	10.0	164.29401397705078	96
len. Parallele Untersuchungen in an-	33.93000030517578	555.12255859375	10.0	164.27002716064453	96
deren ländlichen Räumen verstärken	33.93000030517578	567.12255859375	10.0	164.29402923583984	96
diese Hypothese (siehe auch KNAPPE	33.93000030517578	579.12255859375	10.000015258789062	164.27860260009766	96
und BENEDEK 1995, mit ähnlichen Be-	33.93000030517578	591.12255859375	10.0	164.2750015258789	96
obachtungen in Turea und Mihai Vi-	33.93000030517578	603.12255859375	10.0	164.26801300048828	96
teazu).	33.93000030517578	615.12255859375	10.0	30.24200439453125	96
Die Frage nach dem extrem gerin-	45.209999084472656	627.2425537109375	10.0	153.00598907470703	96
gen Assoziierungsgrad der Landwirte	33.93000030517578	639.2425537109375	10.0	164.27404022216797	96
im Gebiet um Bistriţa ist regionalspe-	33.93000030517578	651.2425537109375	10.0	164.27899932861328	96
zifisch, wie übrigens im ganzen Kreis	33.93000030517578	663.2425537109375	10.0	164.26898956298828	96
Jahr	40.04999923706055	692.5172119140625	8.547607421875	17.033653259277344	97
Landwirtschaftliche	70.03582763671875	692.5172119140625	8.547607421875	75.5975341796875	98
Rinder	161.57293701171875	692.5172119140625	8.547607421875	24.847885131835938	99
1989	40.04999542236328	718.8207397460938	8.547599792480469	18.55255889892578	100
1997	40.04999542236328	732.0208129882812	8.547599792480469	18.552566528320312	100
Fläche in ha	84.68983459472656	705.8369750976562	8.547599792480469	46.244232177734375	101
22.412	93.92977905273438	718.8207397460938	8.547599792480469	25.505203247070312	101
7.580	98.48993682861328	732.0208129882812	8.547599792480469	20.951873779296875	101
20.127	160.04034423828125	718.8207397460938	8.547599792480469	25.601791381835938	102
2.061	164.7269744873047	732.0208129882812	8.547599792480469	20.952728271484375	102
Tab. 4: Landwirtschaftliche Fläche und Tierbestand	33.810001373291016	751.8524169921875	9.0	206.16741561889648	103
(staatliche Betriebe)	33.810001373291016	762.6524047851562	9.0	80.3961067199707	103
Quelle: Anuarul Statistic al Romaniei 1997	33.810001373291016	773.36474609375	6.999996185302734	133.93027877807617	103
Bistriţa-Năsăud, die auch als Hypo-	211.04998779296875	51.12255859375	10.0	164.27999877929688	104
these formuliert wurde. Praktisch kon-	211.04998779296875	63.12255859375	10.0	164.26898193359375	104
zentrieren sich alle privaten Gesell-	211.04998779296875	75.12255859375	10.0	164.27798461914062	104
schaften des Kreises in der untersuch-	211.04998779296875	87.12255859375	10.0	164.26596069335938	104
ten Kernregion um die Stadt Bistriţa.	211.04998779296875	99.12255859375	10.0	164.28399658203125	104
Ist das Zufall oder das Ergebnis von	211.04998779296875	111.12255859375	10.0	164.28701782226562	104
Wissensdiffusion aus der Stadt ins nä-	211.04998779296875	123.12255859375	10.0	164.27096557617188	104
here Umland? In diesem Zusammen-	211.04998779296875	135.12255859375	10.0	164.27297973632812	104
hang muss man einen Unterschied	211.04998779296875	147.12255859375	10.0	164.29000854492188	104
zwischen der institutionalisierten As-	211.04998779296875	159.12255859375	10.0	164.28195190429688	104
soziierungsform der Landwirte und	211.04998779296875	171.12255859375	10.0	164.280029296875	104
deren Kooperationsbereitschaft ma-	211.04998779296875	183.12255859375	10.0	164.26296997070312	104
chen. Die Ergebnisse der Befragung	211.04998779296875	195.12255859375	10.0	164.27203369140625	104
beweisen, dass nur 40 % der Haushal-	211.04998779296875	207.12255859375	10.0	164.29501342773438	104
te aus der Region um Bistriţa in unter-	211.04998779296875	219.12255859375	10.0	164.282958984375	104
schiedlichen Formen im Produktions-	211.04998779296875	231.12255859375	10.0	164.27099609375	104
prozess zusammenarbeiten, was einem	211.04998779296875	243.12255859375	10.0	164.27203369140625	104
recht geringen Anteil entspricht. Die	211.04998779296875	255.12255859375	10.0	164.27197265625	104
Gründe dafür sind nicht nur subjektiv,	211.04998779296875	267.12255859375	10.0	164.29400634765625	104
wie bisher geglaubt wurde, sondern es	211.04998779296875	279.12255859375	10.0	164.26901245117188	104
existiert tatsächlich eine starke ratio-	211.04998779296875	291.12255859375	10.0	164.281005859375	104
nal-wirtschaftliche Komponente: Die	211.04998779296875	303.12255859375	10.0	164.26998901367188	104
wirtschaftliche Zusammenarbeit in der	211.04998779296875	315.12255859375	10.0	164.28399658203125	104
Landwirtschaft ist kostenaufwendig.	211.04998779296875	327.12255859375	10.0	164.281982421875	104
Die Haushalte verfügen nicht über die	211.04998779296875	339.12255859375	10.0	164.281005859375	104
finanziellen Mittel zur Mechanisie-	211.04998779296875	351.12255859375	10.0	164.27200317382812	104
rung, die Landwirte können die mo-	211.04998779296875	363.12255859375	10.0	164.2869873046875	104
derne Technologie nicht anwenden.	211.04998779296875	375.12255859375	10.0	157.47698974609375	104
Die Ablehnung von Gemeinschafts-	222.44998168945312	387.2425537109375	10.0	153.0009765625	104
arbeit resultiert darüber hinaus sub-	211.04998779296875	399.2425537109375	10.0	164.26797485351562	104
jektiv aus den negativen Erfahrungen	211.04998779296875	411.2425537109375	10.0	164.27001953125	104
der (Zwangs-)Kollektivierung im So-	211.04998779296875	423.2425537109375	10.0	164.27395629882812	104
zialismus und aus dem niedrigen kul-	211.04998779296875	435.2425537109375	10.0	164.28500366210938	104
turellen Kapital im ländlichen Raum.	211.04998779296875	447.2425537109375	10.0	164.28997802734375	104
Darüber hinaus gab es wenig Impulse	211.04998779296875	459.2425537109375	10.0	164.27401733398438	104
und Unterstützung durch die Politik,	211.04998779296875	471.2425537109375	10.0	164.24700927734375	104
die Landwirtschaft wurde und wird in	211.04998779296875	483.2425537109375	10.0	164.27001953125	104
der Wirtschaftspolitik der letzten zehn	211.04998779296875	495.2425537109375	10.0	164.27996826171875	104
Jahre eher als ein Randsektor behan-	211.04998779296875	507.2425537109375	10.0	164.27499389648438	104
delt.	211.04998779296875	519.2425537109375	10.0	19.6820068359375	104
Nach der schnell ablaufenden Auf-	222.44998168945312	531.2425537109375	10.0	153.0079345703125	104
lösung der LPG erfolgte eine stufen-	211.04998779296875	543.2425537109375	10.0	164.29495239257812	104
weise Reduzierung der von staatlichen	211.04998779296875	555.2425537109375	10.0	164.31997680664062	104
Betrieben bewirtschafteten Nutzflä-	211.04998779296875	567.2425537109375	10.0	164.27203369140625	104
chen, was auf deren baldige Auflösung	211.04998779296875	579.2425537109375	10.000015258789062	164.27001953125	104
schließen lässt; einige von ihnen sind	211.04998779296875	591.2425537109375	10.0	164.2740478515625	104
bereits bankrott. Zur Veranschauli-	211.04998779296875	603.2425537109375	10.0	164.29196166992188	104
chung dieses rückläufigen Prozesses	211.04998779296875	615.2425537109375	10.0	164.28604125976562	104
stehen die statistischen Daten aus den	211.04998779296875	627.2425537109375	10.0	164.22900390625	104
Jahren 1989 und 1998 zur Verfügung	211.04998779296875	639.2425537109375	10.0	164.2669677734375	104
(Tab. 4). Dementsprechend ist die	211.04998779296875	651.2242431640625	10.018310546875	164.40997314453125	104
landwirtschaftliche Gesamtfläche von	211.04998779296875	663.2425537109375	10.0	164.2669677734375	104
Schafe	210.89259338378906	692.5172119140625	8.547607421875	26.30096435546875	105
18.376	210.0489501953125	718.8207397460938	8.547599792480469	25.601791381835938	106
267	221.72662353515625	732.0208129882812	8.547599792480469	13.992416381835938	106
Betriebe	259.37286376953125	692.5172119140625	8.547607421875	32.57745361328125	107
insgesamt	256.26153564453125	705.8369750976562	8.547599792480469	39.75494384765625	108
67	271.6976623535156	718.8207397460938	8.547599792480469	9.3126220703125	108
28	271.7659606933594	732.0208129882812	8.547599792480469	9.3126220703125	108
Pflanzen-	324.81243896484375	692.5172119140625	8.547607421875	34.72723388671875	109
produktion	321.781494140625	705.8369750976562	8.547599792480469	40.94134521484375	110
9	339.3775634765625	718.8207397460938	8.547599792480469	4.752471923828125	110
3	339.44586181640625	732.0208129882812	8.547599792480469	4.752471923828125	110
staatlichen Betrieben in dieser Zeit-	388.28997802734375	51.12255859375	10.0	164.3099365234375	111
spanne als Folge des Restitutionspro-	388.28997802734375	63.12255859375	10.0	164.27801513671875	111
zesses um 56 % zurückgegangen.	388.28997802734375	75.12255859375	10.0	148.20794677734375	111
In welche Richtung werden sich die	399.6899719238281	87.2425537109375	10.0	152.99398803710938	111
landwirtschaftlichen Strukturen ent-	388.28997802734375	99.2425537109375	10.0	164.280029296875	111
wickeln? Diese Frage steht im Mittel-	388.28997802734375	111.2425537109375	10.0	164.27099609375	111
punkt der weiteren Forschungstätig-	388.28997802734375	123.2425537109375	10.0	164.26507568359375	111
keit. Sicher ist, dass die staatlichen	388.28997802734375	135.2425537109375	10.0	164.28497314453125	111
Betriebe nicht rentabel sind und ihr	388.28997802734375	147.2425537109375	10.0	164.2900390625	111
Anteil an der Gesamtproduktion und	388.28997802734375	159.2425537109375	10.0	164.2860107421875	111
an der Flächenstruktur weiter zurück-	388.28997802734375	171.2425537109375	10.0	164.2900390625	111
geht. In Zukunft wird mit ihrer voll-	388.28997802734375	183.2425537109375	10.0	164.2340087890625	111
ständigen Auflösung gerechnet, und	388.28997802734375	195.2425537109375	10.0	164.32403564453125	111
an ihre Stelle sollten private landwirt-	388.28997802734375	207.2425537109375	10.0	164.29498291015625	111
schaftliche Betriebe treten. Aus den	388.28997802734375	219.2425537109375	10.0	164.324951171875	111
bisherigen Ausführungen ist jedoch	388.28997802734375	231.2425537109375	10.0	164.29400634765625	111
ersichtlich, dass diese Betriebe aus	388.28997802734375	243.2425537109375	10.0	164.26507568359375	111
subjektiven und regionalspezifischen	388.28997802734375	255.2425537109375	10.0	164.27001953125	111
rationalen Motivationen eine geringe	388.28997802734375	267.2425537109375	10.0	164.2490234375	111
Rolle spielen. Als Folge davon wer-	388.28997802734375	279.2425537109375	10.0	164.258056640625	111
den in der Region um Bistriţa die in-	388.28997802734375	291.2425537109375	10.0	164.2320556640625	111
formellen Strukturen sowohl kurz- als	388.28997802734375	303.2425537109375	10.0	164.26605224609375	111
auch mittelfristig dominieren. Sie sind	388.28997802734375	315.2425537109375	10.0	164.2879638671875	111
die einzigen Strukturen, die ein siche-	388.28997802734375	327.2425537109375	10.0	164.29400634765625	111
res Überleben unter krisenartigen	388.28997802734375	339.2425537109375	10.0	164.28802490234375	111
Bedingungen und während eines dra-	388.28997802734375	351.2425537109375	10.0	164.28302001953125	111
matischen sozialen Wandels gewähr-	388.28997802734375	363.2425537109375	10.0	164.28997802734375	111
leisten. Der Einfluss dieser Entwick-	388.28997802734375	375.2425537109375	10.0	164.27398681640625	111
lung auf die Gesamtentwicklung der	388.28997802734375	387.2425537109375	10.0	164.27001953125	111
Region kann bereits jetzt als nachtei-	388.28997802734375	399.2425537109375	10.0	164.29498291015625	111
lig angesehen werden.	388.28997802734375	411.2425537109375	10.0	97.55999755859375	111
Informelle Organisationsstrukturen	388.28997802734375	432.34423828125	10.0	153.8280029296875	112
Die informellen Organisationsstruk-	388.28997802734375	447.2425537109375	10.0	164.28204345703125	112
turen sind durch die privaten landwirt-	388.28997802734375	459.2425537109375	10.0	164.27606201171875	112
schaftlichen Haushalte vertreten, die	388.28997802734375	471.2425537109375	10.0	164.28997802734375	112
unter der Hypothese der Subsistenz-	388.28997802734375	483.2425537109375	10.0	164.28607177734375	112
orientierung schon in der Problem-	388.28997802734375	495.2425537109375	10.0	164.28302001953125	112
stellung auftauchen.	388.28997802734375	507.2425537109375	10.0	88.80401611328125	112
In der Tat kommt die Subsistenzori-	399.6899719238281	519.362548828125	10.0	152.98898315429688	112
entierung deutlich in den Befragungs-	388.28997802734375	531.362548828125	10.0	164.27001953125	112
daten zum Ausdruck: nur ein Viertel	388.28997802734375	543.362548828125	10.0	164.28204345703125	112
(26 %) der Haushalte produziert für	388.28997802734375	555.362548828125	10.0	164.28399658203125	112
den Markt. Dieses niedrige Niveau ist	388.28997802734375	567.362548828125	10.0	164.26904296875	112
durch mehrere Faktoren zu erklären,	388.28997802734375	579.362548828125	10.000015258789062	164.27001953125	112
darunter vor allem durch den ungenü-	388.28997802734375	591.362548828125	10.0	164.280029296875	112
genden technischen Ausrüstungsgrad	388.28997802734375	603.362548828125	10.0	164.29302978515625	112
der Haushalte, die geringe Größe der	388.28997802734375	615.362548828125	10.0	164.24505615234375	112
bewirtschafteten Flächen, die Ver-	388.28997802734375	627.362548828125	10.0	164.2750244140625	112
nachlässigung der Tierzucht bei der	388.28997802734375	639.362548828125	10.0	164.28997802734375	112
Gesamtproduktion usw. Positive Kor-	388.28997802734375	651.362548828125	10.0	164.281005859375	112
relationen konnten auch bei der An-	388.28997802734375	663.362548828125	10.0	164.2940673828125	112
Gemüse-	387.9347839355469	692.5172119140625	8.547607421875	33.8843994140625	113
Tierzucht	437.2544250488281	692.5172119140625	8.547607421875	35.10589599609375	114
Gemischt	497.28509521484375	692.5172119140625	8.547607421875	36.63494873046875	115
bau	397.981689453125	705.8369750976562	8.547599792480469	14.052215576171875	116
24	400.2176818847656	718.8207397460938	8.547599792480469	9.3126220703125	116
16	400.2859802246094	732.0208129882812	8.547599792480469	9.3126220703125	116
26	450.2579040527344	718.8207397460938	8.547599792480469	9.3126220703125	117
2	454.8863525390625	732.0208129882812	8.547599792480469	4.752471923828125	117
8	513.3613891601562	718.8207397460938	8.547599792480469	4.75244140625	118
7	513.445068359375	732.0208129882812	8.547599792480469	4.75244140625	118
45	531.3300170898438	799.6130981445312	11.999998092651367	14.27996826171875	119
wendung von Düngemitteln (r = 0,90),	42.43000030517578	51.12255859375	10.0	164.29503631591797	120
beim Mechanisierungsgrad (r = 0,87)	42.43000030517578	63.12255859375	10.0	164.27698516845703	120
und bei der Kooperation zwischen	42.42999267578125	75.12255859375	10.0	164.27200317382812	120
Landwirten (r = 0,76) berechnet wer-	42.42999267578125	87.12255859375	10.0	164.27000427246094	120
den. Klar ersichtlich wird die Markt-	42.42999267578125	99.12255859375	10.0	164.2899627685547	120
orientierung derjenigen Haushalte, die	42.42999267578125	111.12255859375	10.0	164.2679901123047	120
moderne Produktionsmittel anwen-	42.42999267578125	123.12255859375	10.0	164.28501892089844	120
den. Diese Haushalte kooperieren	42.42999267578125	135.12255859375	10.0	164.27297973632812	120
auch eher, was vor allem wegen ihrer	42.42999267578125	147.12255859375	10.0	164.2950439453125	120
schwachen Kapitaldecke notwendig ist.	42.42999267578125	159.12255859375	10.0	164.26698303222656	120
Die einzige Chance zur Verbesserung	42.42999267578125	171.12255859375	10.0	164.28004455566406	120
der Lage der Haushalte ist die Koope-	42.42999267578125	183.12255859375	10.0	164.2720184326172	120
ration, welche auf eine gegenseitige	42.42999267578125	195.12255859375	10.0	164.25804138183594	120
Ergänzung im landwirtschaftlichen	42.42999267578125	207.12255859375	10.0	164.29000854492188	120
Produktionsprozess ausgerichtet ist.	42.42999267578125	219.12255859375	10.0	158.17498779296875	120
Auch für die Größe der landwirt-	53.709991455078125	231.2242431640625	10.018310546875	152.9980010986328	120
schaftlichen Flächen wurde die Korre-	42.42998504638672	243.2242431640625	10.018310546875	164.26500701904297	120
lation berechnet. Natürlich kann die	42.42998504638672	255.2425537109375	10.0	164.29300689697266	120
Marktorientierung nicht allein auf die-	42.42998504638672	267.2425537109375	10.0	164.27397918701172	120
sen Faktor reduziert werden, aber sie	42.42998504638672	279.2425537109375	10.0	164.28601837158203	120
spielt in diesem Zusammenhang eine	42.42998504638672	291.2425537109375	10.0	164.2869644165039	120
wichtige Rolle. Hinzu kommt die Tat-	42.42998504638672	303.2425537109375	10.0	164.27999114990234	120
sache, dass die Größe des Eigentums	42.42998504638672	315.2425537109375	10.0	164.26903533935547	120
im ländlichen Raum Rumäniens wei-	42.42998504638672	327.2425537109375	10.0	164.27001190185547	120
terhin eine wichtige Grundlage der	42.42998504638672	339.2425537109375	10.0	164.27400970458984	120
sozialen Differenzierung bleibt. Der	42.42998504638672	351.2425537109375	10.0	164.26696014404297	120
Koeffizient zwischen diesen beiden	42.42998504638672	363.2425537109375	10.0	164.28705596923828	120
Faktoren ist positiv und liegt bei 0,89.	42.42998504638672	375.2425537109375	10.0	164.28699493408203	120
Damit wird die oben formulierte Idee	42.42998504638672	387.2425537109375	10.0	164.2699966430664	120
bezüglich die Marktorientierung un-	42.42998504638672	399.2425537109375	10.0	164.2920150756836	120
terstützt.	42.42998504638672	411.2425537109375	10.0	39.23900604248047	120
Interessanterweise wurde auch eine	53.709983825683594	423.2425537109375	10.0	152.99100494384766	120
starke Korrelation der Marktorientie-	42.42998504638672	435.2425537109375	10.0	164.28096771240234	120
rung/Produktivität mit dem Eigentum	42.42998504638672	447.2425537109375	10.0	164.31096649169922	120
an Fernsehgeräten (0,9) und Telefo-	42.42998504638672	459.2425537109375	10.0	164.2760238647461	120
nen (0,88) gefunden. Dies weist darauf	42.42998504638672	471.2425537109375	10.0	164.27205657958984	120
hin, dass eine direkte Beziehung zwi-	42.42998504638672	483.2425537109375	10.0	164.2760238647461	120
schen dem Informationsniveau der	42.42998504638672	495.2425537109375	10.0	164.28099822998047	120
Haushalte (kulturelles Kapital) und	42.42998504638672	507.2425537109375	10.0	164.27603912353516	120
ihren landwirtschaftlichen Erfolgen	42.42998504638672	519.2425537109375	10.0	164.29203033447266	120
besteht. Die Bedeutung des kulturel-	42.42998504638672	531.2425537109375	10.0	164.2820053100586	120
len Kapitals wird im folgenden Kapi-	42.42998504638672	543.2425537109375	10.0	164.29497528076172	120
tel in Verbindung mit der Frage nach	42.42998504638672	555.2425537109375	10.0	164.27204132080078	120
den marktorientierten Haushaltstypen	42.42998504638672	567.2425537109375	10.0	164.27002716064453	120
noch eingehender behandelt.	42.42998504638672	579.2425537109375	10.000015258789062	127.67798614501953	120
Die Subsistenzorientierung lässt sich	53.709983825683594	591.362548828125	10.0	152.9920425415039	120
auch an einer separaten Analyse der	42.42998504638672	603.362548828125	10.0	164.27404022216797	120
Tierhaltung nachprüfen. Als Indika-	42.42998504638672	615.362548828125	10.0	164.27397918701172	120
toren werden unterschiedliche Kom-	42.42998504638672	627.362548828125	10.0	164.30001068115234	120
binationen bei der Tierhaltung und die	42.42998504638672	639.362548828125	10.0	164.27701568603516	120
Anzahl der gezüchteten Tiere verwen-	42.42998504638672	651.362548828125	10.0	164.29296112060547	120
det. So halten rund 44 % der Haushal-	42.42998504638672	663.362548828125	10.0	164.33296966552734	120
te nur Schweine. Diese sind in etwa	42.42998504638672	675.362548828125	10.0	164.27802276611328	120
gleichzusetzen mit den hauptsächlich	42.42998504638672	687.362548828125	10.0	164.2900161743164	120
subsistenzorientierten Haushalten.	42.42998504638672	699.362548828125	10.0	164.27704620361328	120
Dem stehen 23 % Haushalte mit viel-	42.42998504638672	711.362548828125	10.0	164.27898406982422	120
fältiger Tierhaltung (Schweine, Rin-	42.42998504638672	723.362548828125	10.0	164.2839584350586	120
der und Schafe) gegenüber. Der Rest	42.42998504638672	735.362548828125	10.0	164.28404998779297	120
der Haushalte (29 %) nimmt eine Zwi-	42.42998504638672	747.362548828125	10.0	164.25899505615234	120
schenposition ein, einige davon (3,6 %)	42.42998504638672	759.362548828125	10.0	164.26204681396484	120
sind auf Rinderzucht spezialisiert und	42.42998504638672	771.362548828125	9.999996185302734	164.2819595336914	120
46	49.27000045776367	799.6130981445312	11.999998092651367	14.279998779296875	121
weniger subsistenzorientiert als die er-	219.54998779296875	51.12255859375	10.0	164.25393676757812	122
ste Gruppe. Sie belegen gelegentlich	219.54998779296875	63.12255859375	10.0	164.29296875	122
die periodisch entstehenden Marktni-	219.54998779296875	75.12255859375	10.0	164.30697631835938	122
schen.	219.54998779296875	87.12255859375	10.0	27.360000610351562	122
Unter den befragten Siedlungen be-	230.94998168945312	99.2425537109375	10.0	152.99899291992188	122
fanden sich in Florești die höchste An-	219.54998779296875	111.2425537109375	10.0	164.27597045898438	122
zahl marktorientierter Haushalte	219.54998779296875	123.2425537109375	10.0	164.29397583007812	122
(75 %). Dieser große Anteil ist das	219.54998779296875	135.2425537109375	10.0	164.29400634765625	122
Ergebnis der regionalen Spezialisie-	219.54998779296875	147.2425537109375	10.0	164.28399658203125	122
rung, wobei in diesem Areal der Ge-	219.54998779296875	159.2425537109375	10.0	164.2879638671875	122
müseanbau große Traditionen und gute	219.54998779296875	171.2425537109375	10.0	164.28997802734375	122
natürliche Bedingungen hat. Sehr in-	219.54998779296875	183.2425537109375	10.0	164.27200317382812	122
teressant ist, dass diesem Anteil keine	219.54998779296875	195.2425537109375	10.0	164.2979736328125	122
größere Kapitalakkumulation (weder	219.54998779296875	207.2425537109375	10.0	164.2860107421875	122
im Einkommen noch in der Ausstat-	219.54998779296875	219.2425537109375	10.0	164.24398803710938	122
tung der Haushalte) entspricht bzw.	219.54998779296875	231.2425537109375	10.0	164.26800537109375	122
auch kein besserer Mechanisierungs-	219.54998779296875	243.2425537109375	10.0	164.27902221679688	122
grad vorliegt. Bis auf die starke Markt-	219.54998779296875	255.2425537109375	10.0	164.2669677734375	122
orientierung unterscheidet sich das	219.54998779296875	267.2425537109375	10.0	164.26803588867188	122
Dorf nicht von anderen untersuchten	219.54998779296875	279.2425537109375	10.0	164.28402709960938	122
Dörfern.	219.54998779296875	291.2425537109375	10.0	38.522003173828125	122
In Ardan ist ein wesentlich geringe-	230.94998168945312	303.2425537109375	10.0	152.99996948242188	122
rer Anteil (26 %) marktorientierter	219.54998779296875	315.2425537109375	10.0	164.40402221679688	122
Haushalte zu finden, dem entspricht	219.54998779296875	327.2425537109375	10.0	164.27197265625	122
die geringe räumliche Mobilität der	219.54998779296875	339.2425537109375	10.0	164.28997802734375	122
Händler. Die Produkte werden am	219.54998779296875	351.2425537109375	10.0	164.27999877929688	122
lokalen Markt verkauft bzw. durch die	219.54998779296875	363.2425537109375	10.0	164.2860107421875	122
Milchsammelstelle in Monor, die zur	219.54998779296875	375.2425537109375	10.0	164.29400634765625	122
größten Molkerei des Kreises gehört	219.54998779296875	387.2425537109375	10.0	164.28396606445312	122
und eine der größten in Siebenbürgen	219.54998779296875	399.2425537109375	10.0	164.26995849609375	122
ist, abgeholt. Die Anteile marktorien-	219.54998779296875	411.2425537109375	10.0	164.281982421875	122
tierter Haushalte in den restlichen	219.54998779296875	423.2425537109375	10.0	164.2760009765625	122
Dörfern liegen zwischen 18 und 19 %	219.54998779296875	435.2425537109375	10.0	164.31597900390625	122
leicht unter Ardan, mit Ausnahme von	219.54998779296875	447.2425537109375	10.0	164.26998901367188	122
Neţeni mit nur 11 %. Die aus dieser	219.54998779296875	459.2425537109375	10.0	164.40603637695312	122
Orientierung resultierenden räumli-	219.54998779296875	471.2425537109375	10.0	164.27798461914062	122
