O	3 Der Präsident der Demokratischen Republik Kongo und der	308.2677001953125	730.9378662109375	8.0	224.911865234375	39
O	König von Swasiland haben – nach Regierungsangaben –	316.7716064453125	740.5379028320312	8.0	216.4239501953125	39
O	ebenfalls Kommissionen eingerichtet. Welchen Anteil ihre völ-	316.7716064453125	750.1378784179688	8.0	216.1417236328125	39
O	lig intransparente Arbeit an den tatsächlichen Verfassungsän-	316.7716064453125	759.7379150390625	8.0	216.1417236328125	39
O	derungen der jüngsten Zeit haet, ist allerdings unklar. Beide	316.7716064453125	769.337890625	8.0	211.4959716796875	39
O	Kommissionen werden daher nicht einbezogen.	316.7716064453125	778.9379272460938	8.0	167.35205078125	39
O	- 3 -	513.357177734375	814.9594116210938	11.0	19.55804443359375	40
O	perten und Vertreter zivilgesellschaftlicher Organi-	62.36220169067383	76.6768798828125	10.0	224.64558029174805	41
O	sationen angehören. Von der Vielfalt eingebundener	62.36220169067383	90.31158447265625	10.0	225.15998458862305	41
O	Positionen wird ein breiter gesellschaftlicher Kon-	62.36220169067383	103.9461669921875	10.0	224.64558029174805	41
O	sens und eine besonders hohe Legitimität erwartet.	62.36220169067383	117.58087158203125	10.0	225.23005294799805	41
O	Eine trennscharfe Zuordnung zu den drei Grund-	62.36220169067383	131.2154541015625	10.0	224.64558029174805	41
O	typen ist nicht immer möglich. Es gibt jedoch eine	62.36220169067383	144.85003662109375	10.0	225.4200553894043	41
O	starke Tendenz, Expertenkommissionen einzurich-	62.36220169067383	158.4847412109375	10.0	224.64558029174805	41
O	ten, wenn umfänglichere Reformen angestrebt wer-	62.36220169067383	172.119384765625	10.0	224.64558029174805	41
O	den. In sieben Staaten haben seit 2005 technokra-	62.36220169067383	185.7540283203125	10.0	224.64558029174805	41
O	tische Kommissionen gearbeitet (Benin, Ghana, Ke-	62.36220169067383	199.388671875	10.0	224.64558029174805	41
O	nia, Madagaskar, Mali, Niger und die Seychellen),	62.36220169067383	213.02337646484375	10.0	225.24998092651367	41
O	in fünf politische (Angola, Kap Verde, Nigeria, Sim-	62.36220169067383	226.6580810546875	10.0	225.32001876831055	41
O	babwe und Sudan) und nur in Sambia wurde auf	62.36220169067383	240.29266357421875	10.0	225.4499626159668	41
O	breite gesellschaftliche Beteiligung gesettz.	62.36220169067383	253.9273681640625	10.0	176.67998886108398	41
O	Die Herrscher in allen autoritär regierten Län-	76.535400390625	267.56195068359375	10.0	210.47238159179688	41
O	dern haben zu politischen Kommissionen gegriefn.	62.36220169067383	281.196533203125	10.0	219.37998580932617	41
O	Unter Autokraten ist oefnbar nicht genug Vertrau -	62.36220169067383	294.83123779296875	10.0	224.64558029174805	41
O	en vorhanden, den Reformprozess unkontrolliert in	62.36220169067383	308.46588134765625	10.0	225.90000534057617	41
O	die Hände von Experten zu legen. Inhaltlich stand	62.36220169067383	322.1005859375	9.999969482421875	226.3599967956543	41
O	bei den meisten autoritären Verfassungsreformen die	62.36220169067383	335.73516845703125	10.0	225.91001510620117	41
O	Machtabsicherung im Vordergrund: In sechs von elf	62.36220169067383	349.3698425292969	10.0	226.1400260925293	41
O	autoritär geführten Ländern wollten die Herrschen-	62.36220169067383	363.0045471191406	10.0	224.64558029174805	41
O	den mit Verfassungsänderungen eine Amtszeiten-	62.36220169067383	376.63916015625	10.0	224.64558029174805	41
O	beschränkung für den Staatspräsidenten beseitigen	62.36220169067383	390.27374267578125	10.0	225.6200065612793	41
O	oder verhindern. In Angola, Dschibuti, Kamerun und	62.36220169067383	403.908447265625	10.0	226.16001510620117	41
O	Tschad wurden seit 2005 Regelungen abgeschatf, wo -	62.36220169067383	417.5430603027344	10.0	224.64558029174805	41
O	nach der Präsident nach zwei Amtszeiten nicht mehr	62.36220169067383	431.1777648925781	10.0	226.3900260925293	41
O	zur Wahl antreten darf; in Gabun und Simbabwe ver-	62.36220169067383	444.8123474121094	10.0	224.64558029174805	41
O	hinderten die Präsidenten gezielt die Einführung ei-	62.36220169067383	458.4470520019531	10.0	224.64558029174805	41
O	ner solchen Hürde. Im Folgenden sollen Verfassungs-	62.36220169067383	472.0816650390625	10.0	224.64558029174805	41
O	reformprozesse in vier „teilweise freien“ und „freien“	62.36220169067383	485.71636962890625	10.0	226.15998458862305	41
O	Herrschaftssystemen Afrikas vorgestellt werden.	62.36220169067383	499.3509521484375	10.0	204.94001388549805	41
O	Gefeierte Reformen in Kenia	62.36220169067383	540.2954711914062	10.0	134.92002487182617	42
O	Im Dezember 1991 hob Kenias Präsident Daniel	62.36220169067383	567.524169921875	10.0	224.65006637573242	43
O	arap Moi das Verfassungsverbot, das für alle Par-	62.36220169067383	581.1588745117188	10.0	224.64558029174805	43
O	teien außer der regierenden Einheitspartei KANU	62.36220169067383	594.79345703125	10.0	224.63999557495117	43
O	galt, auf. Die Machtfülle des Präsidenten blieb je-	62.36220169067383	608.4281005859375	10.0	224.64558029174805	43
O	doch auch im Mehrparteiensystem bestehen. Die	62.36220169067383	622.062744140625	10.0	224.65000534057617	43
O	Reform der Verfassung wurde so zur zentralen	62.36220169067383	635.6973876953125	10.0	224.63999557495117	43
O	Forderung der Opposition in der Auseinanderset-	62.36220169067383	649.3320922851562	10.0	224.64558029174805	43
O	zung mit Moi, der erst in den Wahlen 2002 gegen	62.36220169067383	662.966796875	10.0	224.66001510620117	43
O	die „Regenbogenkoalition“ unterlag. Doch auch	62.36220169067383	676.6013793945312	10.0	224.6400260925293	43
O	der mit einem großen Vertrauensvorschuss gestar-	62.36220169067383	690.236083984375	10.0	224.64558029174805	43
O	tete Nachfolger Mwai Kibaki löste sein Verspre-	62.36220169067383	703.8706665039062	10.0	224.64558029174805	43
O	chen einer schnellen Verfassungsreform mit breiter	62.36220169067383	717.50537109375	10.0	224.63004684448242	43
O	Beteiligung nicht ein. Im Jahr 2005, drei Jahre nach	62.36220169067383	731.1399536132812	10.0	224.64997482299805	43
O	seiner Wahl, scheiterte ein Verfassungsentwurf,	62.36220169067383	744.7745971679688	10.0	224.63999557495117	43
O	den Kibaki und seine Unterstützer eigenmächtig	62.36220169067383	758.4093017578125	10.0	217.00999069213867	43
O	verändert haten, in einem Referendum.	62.36220169067383	772.0438842773438	10.000003814697266	170.57001876831055	43
O	GIGA Focus Afrika 4/2011	62.36220169067383	814.9594116210938	11.0	133.0693016052246	44
O	Die Krise nach den Wahlen im Dezember 2007,	322.4408874511719	76.6768798828125	10.0	211.51998901367188	45
O	die mehr als 1000 Todesopfer forderte, erhöhte den	308.2677001953125	90.31158447265625	10.0	225.73004150390625	45
O	Druck. Die Lager von Kibaki und Oppositionsführer	308.2677001953125	103.9461669921875	10.0	225.52001953125	45
O	Raila Odinga bildeten im März 2008 eine Große Koa-	308.2677001953125	117.58087158203125	10.0	224.6456298828125	45
O	lition und schufen temporär für Odinga das Amt des	308.2677001953125	131.2154541015625	10.0	225.8499755859375	45
O	Premierministers. Eine Verfassungskommission be-	308.2677001953125	144.85003662109375	10.0	224.6456298828125	45
O	stehend aus neun Experten, davon drei Nicht-Keni-	308.2677001953125	158.4847412109375	10.0	224.6456298828125	45
O	aner, erarbeitete einen neuen Entwurf. Dieser bekam	308.2677001953125	172.119384765625	10.0	225.54998779296875	45
O	in einem landesweiten Referendum am 4. August	308.2677001953125	185.7540283203125	10.0	225.56005859375	45
O	2010 schließlich eine eindeutige Zweidrietlmehrheit.	308.2677001953125	199.388671875	10.0	219.010009765625	45
O	Viele Kenianer und internationale Beobachter seetzn	308.2677001953125	213.02337646484375	10.0	217.77008056640625	45
O	große Honfungen in das neue Dokument.	308.2677001953125	226.6580810546875	10.0	176.29000854492188	45
O	Die neue Verfassung enthält einen erweiterten	322.4408874511719	240.29266357421875	10.0	210.46005249023438	45
O	Grundrechtekatalog, der sowohl die Rechte einzel-	308.2677001953125	253.9273681640625	10.0	224.6456298828125	45
O	ner Bürger, als auch verschiedener Bevölkerungs-	308.2677001953125	267.56195068359375	10.0	224.6456298828125	45
O	gruppen und Minderheiten schützen soll. Sie be -	308.2677001953125	281.196533203125	10.0	224.6456298828125	45
O	schränkt die Machtfülle des Präsidenten („Imperi-	308.2677001953125	294.82220458984375	10.009033203125	224.6456298828125	45
O	al Presidency“). So muss ein gestärktes Parlament	308.2677001953125	308.45684814453125	10.009033203125	224.6383056640625	45
O	nun die Besetzung von Posten durch den Staats -	308.2677001953125	322.1005859375	9.999969482421875	224.6456298828125	45
O	präsidenten bestätigen. Ein Supreme Court kann	308.2677001953125	335.73516845703125	10.0	224.63995361328125	45
O	zudem überprüfen, ob Gesetze der Verfassung ent -	308.2677001953125	349.3698425292969	10.0	224.6456298828125	45
O	sprechen. Dezentrale Regierungsstrukturen wur-	308.2677001953125	363.0045471191406	10.0	224.6456298828125	45
O	den gestärkt, eine im ethnisch fragmentierten Ke-	308.2677001953125	376.63916015625	10.0	224.6456298828125	45
O	nia äußerst heikle Frage. Stat der bisher neun Pro -	308.2677001953125	390.27374267578125	10.0	224.6456298828125	45
O	vinzen mit geringer Autonomie gibt es 47 gewählte	308.2677001953125	403.908447265625	10.0	224.63995361328125	45
O	Bezirksräte (County Councils), die selbständig Re-	308.2677001953125	417.5430603027344	10.0	224.6456298828125	45
O	gelungen verabschieden können und über eigene	308.2677001953125	431.1777648925781	10.0	224.639892578125	45
O	Haushaltsmitel verfügen (Harneit-Sievers 2010).	308.2677001953125	444.8123474121094	10.0	218.41998291015625	45
O	Gewählte Senatoren der Bezirke bilden das neu ge-	308.2677001953125	458.4470520019531	10.0	224.6456298828125	45
O	schafene Oberhaus, den Senat.	308.2677001953125	472.0816650390625	10.0	131.45999145507812	45
O	In Kenia und international wurde die neue Ver-	322.4408874511719	485.71636962890625	10.0	210.47244262695312	45
O	fassung euphorisch gefeiert (BBC 2010). Der Ju-	308.2677001953125	499.3509521484375	10.0	224.6456298828125	45
O	bel erscheint jedoch verfrüht. Zahlreiche Detailfra-	308.2677001953125	512.985595703125	10.0	224.6456298828125	45
O	gen bleiben ungeklärt und müssen noch in lang-	308.2677001953125	526.6202392578125	10.0	224.6456298828125	45
O	wierigen Verhandlungen ausgeräumt werden. Die	308.2677001953125	540.2548828125	10.0	224.65008544921875	45
O	Umsetzung des neuen Textes hinkt hinter dem vor -	308.2677001953125	553.8895263671875	10.0	224.6456298828125	45
O	gesehenen Zeitplan zurück. Buchstäblich in letz -	308.2677001953125	567.524169921875	10.0	224.6456298828125	45
O	ter Sekunde, kurz vor Ablauf der einjährigen Frist	308.2677001953125	581.1588745117188	10.0	224.6400146484375	45
O	am 26. August 2011, verabschiedete das Parlament	308.2677001953125	594.79345703125	10.0	224.6500244140625	45
O	15 Umsetzungsgesetze, insgesamt sind 49 erforder -	308.2677001953125	608.4281005859375	10.0	224.6456298828125	45
O	lich. Zahlreiche Politiker wollen ihre Chancen auf	308.2677001953125	622.062744140625	10.0	224.65008544921875	45
O	die Nachfolge des scheidenden Präsidenten Kibaki	308.2677001953125	635.6973876953125	10.0	224.6400146484375	45
O	bei den Wahlen 2012 verbessern und scheinen nur	308.2677001953125	649.3320922851562	10.0	224.6300048828125	45
O	geringes Interesse an der Verwirklichung der neu-	308.2677001953125	662.966796875	10.0	224.6456298828125	45
O	en Verfassungsordnung zu haben. Im Augenblick	308.2677001953125	676.6013793945312	10.0	224.6300048828125	45
O	ist völlig unklar, ob ausstehende Fragen – wie die	308.2677001953125	690.236083984375	10.0	224.65997314453125	45
O	Überprüfung aller Richter, die Einrichtung einer	308.2677001953125	703.8706665039062	10.0	224.6400146484375	45
O	Kommission zur Festsetzung der Bezirksgrenzen,	308.2677001953125	717.50537109375	10.0	217.02001953125	45
O	die Registrierung aller Wähler oder die Verpflich -	308.2677001953125	731.1399536132812	10.0	224.6456298828125	45
O	tung, dass mindestens ein Dritel aller Abgeordne -	308.2677001953125	744.7745971679688	10.0	224.6456298828125	45
O	ten Frauen sein müssen – rechtzeitig vor den für	308.2677001953125	758.4093017578125	10.0	217.010009765625	45
O	2012 geplanten Wahlen geklärt sein werden.	308.2677001953125	772.0438842773438	10.000003814697266	195.01995849609375	45
O	- 4 -	513.357177734375	814.9594116210938	11.0	19.55804443359375	46
O	Bewegte Reformen in Niger	62.36220169067383	76.71746826171875	10.0	129.59000778198242	47
O	Mit den großen Transformationsprozessen rund	62.36220169067383	103.9461669921875	10.0	224.64997482299805	48
O	um das Jahr 1990 hat das Verfassungsrecht in Niger	62.36220169067383	117.58087158203125	10.0	224.65000534057617	48
O	massiv an Bedeutung gewonnen. Während sich	62.36220169067383	131.2154541015625	10.0	224.63999557495117	48
O	vor 1988 kaum jemand in dem von Armut und Bil-	62.36220169067383	144.85003662109375	10.0	224.64558029174805	48
O	dungsmisere gezeichneten Sahel-Staat um Verfas-	62.36220169067383	158.4847412109375	10.0	224.64558029174805	48
O	sungsregeln scherte, ist die bewegte politische Ge-	62.36220169067383	172.119384765625	10.0	224.64558029174805	48
O	schichte der letzten zwanzig Jahre eng mit konsti -	62.36220169067383	185.7540283203125	10.0	224.64558029174805	48
O	tutionellen Fragen verknüpft. Schon 1996 putsch-	62.36220169067383	199.388671875	10.0	224.64558029174805	48
O	te das Militär aufgrund der gegenseitigen Blocka-	62.36220169067383	213.02337646484375	10.0	224.64558029174805	48
O	de von Staatsoberhaupt und Regierungschef. Die-	62.36220169067383	226.6580810546875	10.0	224.64558029174805	48
O	se Blockade wäre ohne das ursprünglich zur Be-	62.36220169067383	240.29266357421875	10.0	224.64558029174805	48
O	grenzung der Macht des Präsidenten gedachte, se-	62.36220169067383	253.9273681640625	10.0	224.64558029174805	48
O	mi-präsidentielle Regierungssystem nicht möglich	62.36220169067383	267.56195068359375	10.0	224.65000534057617	48
O	gewesen. Putsch-Präsident Ibrahim Baré Maïnas-	62.36220169067383	281.196533203125	10.0	224.64558029174805	48
O	sara gelang es jedoch nicht, Niger zurück zu ver-	62.36220169067383	294.83123779296875	10.0	224.64558029174805	48
O	fassungsbasierter Demokratisierung und ökono-	62.36220169067383	308.46588134765625	10.0	224.64558029174805	48
O	mischem Aufschwung zu führen. Deshalb ent-	62.36220169067383	322.1005859375	9.999969482421875	224.64558029174805	48
O	schlossen sich Teile des Militärs im Jahr 1999,	62.36220169067383	335.73516845703125	10.0	224.65000534057617	48
O	Maïnassara durch einen erneuten Putsch zu be-	62.36220169067383	349.3698425292969	10.0	224.64558029174805	48
O	seitigen (Idrissa 2008: 181-194). Diesmal führte die	62.36220169067383	363.0045471191406	10.0	224.65000534057617	48
O	Militärjunta das Land binnen eines Jahres zu ei-	62.36220169067383	376.63916015625	10.0	224.64558029174805	48
O	ner verfassungsmäßigen Ordnung zurück. Der Se-	62.36220169067383	390.27374267578125	10.0	224.64558029174805	48
O	mi-Präsidentialismus wurde entschärft, das Verfas-	62.36220169067383	403.908447265625	10.0	224.64558029174805	48
O	sungsgericht gestärkt.	62.36220169067383	417.5430603027344	10.0	97.2400016784668	48
O	Dennoch behielt die Verfassungspolitik einen	76.535400390625	431.1777648925781	10.0	210.47000122070312	48
O	starken Einfluss auf die politische Gesamtentwick -	62.36220169067383	444.8123474121094	10.0	224.64558029174805	48
O	lung: Das Land hat jüngst in nur zwei Jahren zwei	62.36220169067383	458.4470520019531	10.0	224.6200065612793	48
O	Verfassungsreformprozesse erlebt, deren Auswir-	62.36220169067383	472.0816650390625	10.0	224.64558029174805	48
O	kungen kaum größer sein könnten. Der erste wur-	62.36220169067383	485.71636962890625	10.0	224.64558029174805	48
O	de vom damaligen Präsidenten Mamadou Tand-	62.36220169067383	499.3509521484375	10.0	224.64558029174805	48
O	ja dazu missbraucht, seinen Machterhalt gefähr-	62.36220169067383	512.985595703125	10.0	224.64558029174805	48
O	dende Regelungen der seit 1999 geltenden Verfas-	62.36220169067383	526.6202392578125	10.0	224.64558029174805	48
O	sung der Fünften Republik zu beseitigen. Darun-	62.36220169067383	540.2548828125	10.0	224.64558029174805	48
O	ter war die Amtszeitenbegrenzung, die ihn 2009 ge-	62.36220169067383	553.8895263671875	10.0	224.64558029174805	48
O	zwungen häte, die Präsidentschaft abzugeben. Be -	62.36220169067383	567.524169921875	10.0	224.64558029174805	48
O	obachter nannten das Verfahren zur Änderung der	62.36220169067383	581.1588745117188	10.0	224.63999557495117	48
O	Verfassung, das am 4. August 2009 mit einem zwei-	62.36220169067383	594.79345703125	10.0	224.64558029174805	48
O	felhaften Referendum besiegelt wurde, einen „kon-	62.36220169067383	608.4281005859375	10.0	224.64558029174805	48
O	stitutionellen Putsch“. Versuche des Verfassungs-	62.36220169067383	622.062744140625	10.0	224.64558029174805	48
O	gerichts, die Reformen für nichtig zu erklären, be-	62.36220169067383	635.6973876953125	10.0	224.64558029174805	48
O	antwortete Tandja mit dessen Auflösung. Mit sei -	62.36220169067383	649.3320922851562	10.0	224.64558029174805	48
O	nem Verhalten provozierte er den Militärputsch	62.36220169067383	662.966796875	10.0	224.6300163269043	48
O	vom 18. Januar 2010. Der „Hohe Rat zur Wieder-	62.36220169067383	676.6013793945312	10.0	224.64558029174805	48
O	herstellung der Demokratie“, also die Militärjunta,	62.36220169067383	690.236083984375	10.0	224.6400260925293	48
O	brachte das Land paradoxerweise auf den Demo-	62.36220169067383	703.8706665039062	10.0	224.64558029174805	48
O	kratisierungspfad zurück.	62.36220169067383	717.50537109375	10.0	114.67998886108398	48
O	Um alte Fehler zu vermeiden, beauftragte die	76.535400390625	731.1399536132812	10.0	210.48004150390625	48
O	Junta im Jahr 2010 eine 16-köpfige Expertenkom -	62.36220169067383	744.7745971679688	10.0	224.64558029174805	48
O	mission unter Leitung des renommierten Rechts-	62.36220169067383	758.4093017578125	10.0	224.63996505737305	48
O	und Politikwissenschaftlers Mamoudou Gazibo.	62.36220169067383	772.0438842773438	10.000003814697266	224.63999557495117	48
O	GIGA Focus Afrika 4/2011	62.36220169067383	814.9594116210938	11.0	133.0693016052246	49
O	Die von den Technokraten erarbeitete Reform ist	308.2677001953125	76.6768798828125	10.0	224.9300537109375	50
O	dennoch ein „Reförmchen“ geblieben. In erster Li-	308.2677001953125	90.31158447265625	10.0	224.6456298828125	50
O	nie wurde die Verfassung der Fünften Republik,	308.2677001953125	103.9461669921875	10.0	224.9500732421875	50
O	die Tandja beseitigt haet, mit geringfügigen Än -	308.2677001953125	117.58087158203125	10.0	224.6456298828125	50
O	derungen wiederhergestellt. Die Kommission prä-	308.2677001953125	131.2154541015625	10.0	224.6456298828125	50
O	zisierte das Verhältnis von Präsident und Premier,	308.2677001953125	144.85003662109375	10.0	224.6500244140625	50
O	zog eine zusältziche Altersobergrenze von 70 Jah-	308.2677001953125	158.4847412109375	10.0	224.6456298828125	50
O	ren für Präsidentschaftskandidaten ein und schuf	308.2677001953125	172.119384765625	10.0	224.8900146484375	50
O	eine neue Bildungshürde für Wahlämter, die die	308.2677001953125	185.7540283203125	10.0	224.9599609375	50
O	Qualität der Entscheidungsträger erhöhen soll.	308.2677001953125	199.388671875	10.0	224.840087890625	50
O	Obwohl diese Hürde de facto weite Teile der ni-	308.2677001953125	213.02337646484375	10.0	224.6456298828125	50
O	grischen Bevölkerung von Wahlämtern ausschließt,	308.2677001953125	226.6580810546875	10.0	224.830078125	50
O	erfuhr die neue Verfassung breite gesellschaftliche	308.2677001953125	240.29266357421875	10.0	224.8699951171875	50
O	Zustimmung.	308.2677001953125	253.9273681640625	10.0	60.17999267578125	50
O	Der Fall Niger zeigt, dass es nicht nur schwe-	322.4408874511719	267.56195068359375	10.0	210.47244262695312	50
O	rer geworden ist, gegen die Verfassung zu regie-	308.2677001953125	281.196533203125	10.0	224.6456298828125	50
O	ren, sondern auch, sich mit illegitimen Reformen	308.2677001953125	294.83123779296875	10.0	224.63995361328125	50
O	an der Macht zuhalten. Der Versuch Tandjas, die	308.2677001953125	308.46588134765625	10.0	224.63006591796875	50
O	Verfassung an seine persönlichen Machtinteressen	308.2677001953125	322.1005859375	9.999969482421875	224.6300048828125	50
O	anzupassen, ist mit Hilfe des Militärs gescheitert.	308.2677001953125	335.73516845703125	10.0	224.64996337890625	50
O	Der anschließende Reformprozess reduzierte sich	308.2677001953125	349.3698425292969	10.0	224.6400146484375	50
O	im Ergebnis jedoch auf geringe Änderungen, die	308.2677001953125	363.0045471191406	10.0	224.64996337890625	50
O	durch einen neuen Bildungszensus aufallen, stat	308.2677001953125	376.63916015625	10.0	211.9200439453125	50
O	im Sinne des neuen Konstitutionalismus direkte	308.2677001953125	390.27374267578125	10.0	224.6400146484375	50
O	Bürgerbeteiligung und soziale Rechte zu stärken.	308.2677001953125	403.908447265625	10.0	217.1600341796875	50
O	Verschleppte Reformen in Sambia	308.2677001953125	444.85296630859375	10.0	159.6900634765625	51
O	Sambias friedliche Transition zum Mehrparteien-	308.2677001953125	472.0816650390625	10.0	224.6456298828125	52
O	system der „Driten Republik“ im Jahr 1991 wur -	308.2677001953125	485.71636962890625	10.0	224.6456298828125	52
O	de von vielen Beobachtern als „Modell für Afrika“	308.2677001953125	499.3509521484375	10.0	224.6300048828125	52
O	bejubelt (Braton 1992). Allerdings wurde hier die	308.2677001953125	512.985595703125	10.0	218.429931640625	52
O	Chance vertan, eine wirklich neue Verfassung zu	308.2677001953125	526.6202392578125	10.0	224.6500244140625	52
O	schafen, die die Rechte der Bürger efektiv schützt.	308.2677001953125	540.2548828125	10.0	203.98992919921875	52
O	Entgegen den Versprechungen behielten der neu-	308.2677001953125	553.8895263671875	10.0	224.6456298828125	52
O	gewählte Präsident Chiluba und seine Regierung	308.2677001953125	567.524169921875	10.0	224.62994384765625	52
O	die umfassenden Machtbefugnisse des Staatspräsi-	308.2677001953125	581.1588745117188	10.0	224.6456298828125	52
O	denten bei.	308.2677001953125	594.79345703125	10.0	48.82000732421875	52
O	Seit der Transition ist die Ausgestaltung der Ver-	322.4408874511719	608.4281005859375	10.0	210.47244262695312	52
O	fassung zur zentralen Frage in der innenpolitischen	308.2677001953125	622.062744140625	10.0	224.6500244140625	52
O	Auseinanderseutzng geworden. Eine vom zuneh -	308.2677001953125	635.6973876953125	10.0	224.6456298828125	52
O	mend unbeliebten Präsidenten Chiluba durchge-	308.2677001953125	649.3320922851562	10.0	224.6400146484375	52
O	drückte Verfassungsänderung aus dem Jahr 1996	308.2677001953125	662.966796875	10.0	224.8800048828125	52
O	schloss den früheren Präsidenten Kaunda von der	308.2677001953125	676.6013793945312	10.0	224.9801025390625	52
O	Wahl aus und entfernte die Vorgabe, dass der Prä-	308.2677001953125	690.236083984375	10.0	224.6456298828125	52
O	sident mit über 50 Prozent der Stimmen gewählt	308.2677001953125	703.8706665039062	10.0	224.9599609375	52
O	werden muss. Anfang 2001 starteten seine Anhän-	308.2677001953125	717.50537109375	10.0	224.6456298828125	52
O	ger eine Kampagne, die ihm eine driet Amtszeit	308.2677001953125	731.1399536132812	10.0	218.79998779296875	52
O	ermöglichen sollte. Diese Verfassungsfrage wurde	308.2677001953125	744.7745971679688	10.0	224.83001708984375	52
O	zum Kristallisationspunkt der Opposition: Das so-	308.2677001953125	758.4093017578125	10.0	224.6456298828125	52
O	genannte Oasis-Forum aus zivilgesellschaftlichen	308.2677001953125	772.0438842773438	10.000003814697266	224.79998779296875	52
O	- 5 -	513.357177734375	814.9594116210938	11.0	19.55804443359375	53
O	Gruppen sowie innerparteiliche Kritiker verhinder-	62.36220169067383	76.6768798828125	10.0	224.64558029174805	54
O	ten die Ausdehnung der möglichen Amtszeit des	62.36220169067383	90.31158447265625	10.0	224.93000411987305	54
O	Staatspräsidenten.	62.36220169067383	103.9461669921875	10.0	80.3599967956543	54
O	Wie alle Präsidenten versprach auch Chilubas	76.535400390625	117.58087158203125	10.0	211.75003051757812	54
O	Nachfolger Mwanawasa eine umfassende Verfas-	62.36220169067383	131.2154541015625	10.0	224.64558029174805	54
O	sungsreform. Doch auch er verzögerte jeden Reform-	62.36220169067383	144.85003662109375	10.0	226.15000534057617	54
O	ansa,tz der die Macht des Präsidenten verringert hät -	62.36220169067383	158.4847412109375	10.0	224.64558029174805	54
O	te. Die Entwürfe zahlreicher Reformkommissionen,	62.36220169067383	172.119384765625	10.0	225.66001510620117	54
O	wie der Mung‘omba-Kommission, settze er nicht an -	62.36220169067383	185.7540283203125	10.0	224.64558029174805	54
O	sawtzeise um. Neben der Beschränkung der Voll -	62.36220169067383	199.388671875	10.0	224.64558029174805	54
O	machten des Präsidenten geht es vor allem um zwei	62.36220169067383	213.02337646484375	10.0	226.63999557495117	54
O	Fragen: ob der Präsident mit absoluter Mehrheit, al-	62.36220169067383	226.6580810546875	10.0	224.64558029174805	54
O	so mit mehr als 50 Prozent der abgegebenen Stim-	62.36220169067383	240.29266357421875	10.0	224.64558029174805	54
O	men, gewählt werden muss – diese Mehrheit wurde	62.36220169067383	253.9273681640625	10.0	226.43000411987305	54
O	von Chilubas Nachfolgern Mwanawasa (2001-2008)	62.36220169067383	267.56195068359375	10.0	225.65000534057617	54
O	und Banda (seit 2008) nicht erreicht – und welches der	62.36220169067383	281.196533203125	10.0	226.87006759643555	54
O	richtige Weg zu einer neuen Verfassung ist. Während	62.36220169067383	294.83123779296875	10.0	226.37998580932617	54
O	zivilgesellschaftliche Gruppen und Oppositionspar-	62.36220169067383	308.46588134765625	10.0	224.64558029174805	54
