O	in Hamburg gibt Focus-Reihen zu Afrika, Asien, Lateinamerika, Nahost und zu globalen Fragen heraus, die jeweils	62.36220169067383	639.0692138671875	8.0118408203125	403.4627799987793	96
O	monatlich erscheinen. Ausgewählte Texte werden in der GIGA Focus International Edition auf Englisch veröffentlicht.	62.36220169067383	649.0692138671875	8.0118408203125	403.45710372924805	96
O	Der GIGA Focus Afrika wird vom GIGA Institut für Afrika-Studien redaktionell gestaltet. Die vertretenen Auffassun-	62.36220169067383	659.0692138671875	8.0118408203125	403.44123458862305	96
O	gen stellen die der Autoren und nicht unbedingt die des Instituts dar. Die Autoren sind für den Inhalt ihrer Beiträge	62.36220169067383	669.0692138671875	8.0	403.45368576049805	96
O	verantwortlich. Irrtümer und Auslassungen bleiben vorbehalten. Das GIGA und die Autoren haften nicht für Richtig-	62.36220169067383	679.0692138671875	8.0	403.4537467956543	96
O	keit und Vollständigkeit oder für Konsequenzen, die sich aus der Nutzung der bereitgestellten Informationen er-	62.36220169067383	689.0692138671875	8.0	403.4456596374512	96
O	geben. Auf die Nennung der weiblichen Form von Personen und Funktionen wird ausschließlich aus Gründen der	62.36220169067383	699.0692138671875	8.0	403.3762016296387	96
O	Lesefreundlichkeit verzichtet.	62.36220169067383	709.0692138671875	8.0	102.87994003295898	96
O	Redaktion: Gero Erdmann; Gesamtverantwortliche der Reihe: André Bank und Hanspeter Mattes	62.36220169067383	720.4865112304688	8.0	343.13618087768555	97
O	Lektorat: Ellen Baumann; Kontakt: <giga-focus@giga-hamburg.de>; GIGA, Neuer Jungfernstieg 21, 20354 Hamburg	62.36220169067383	730.4865112304688	8.0	403.3572196960449	97
O	www.giga-hamburg.de/giga-focus	62.36220169067383	810.4716186523438	11.0	176.22001266479492	98
