nern, Großeltern, Kindern, Freunden), die in Deutschland, Polen und der Ukraine geführt wurden.	168.66180419921875	626.583251953125	8.0	331.6590576171875	81
GENDER 1 | 2011	445.84869384765625	675.3643188476562	7.0228271484375	54.466522216796875	82
16	151.6540069580078	46.2078857421875	8.0	8.89599609375	83
Helma Lutz, Ewa Palenga-Möllenbeck	359.16900634765625	46.2078857421875	8.0	141.14718627929688	84
3.1 Betreuungsmuster: zurückbleibende Väter	151.6540069580078	88.734130859375	10.0	219.9469451904297	85
Unter den zurückbleibenden Vätern lassen sich drei Typen unterscheiden, 1. die Aufga-	151.6540069580078	112.529541015625	10.0	348.7071075439453	86
benverteilung zwischen Vätern und Großmüttern, 2. Rückzug des Vaters aus der Betreu-	151.6540069580078	124.529541015625	10.0	348.69398498535156	86
ung, 3. der Vater als primärer Betreuer.	151.6540069580078	136.529541015625	10.0	155.6097869873047	86
‚Marek‘ repräsentiert den ersten und am weitesten verbreiteten Typus eines Vaters,	168.66180419921875	148.529541015625	10.0	331.6942138671875	86
der sich die Betreuung seines Kindes mit einer anderen Person teilt. Bevor Marek den	151.6540069580078	160.529541015625	10.0	348.69102478027344	86
Weg zur Arbeit antritt, trifft seine Schwiegermutter ein, trinkt mit ihm eine Tasse Kaffee	151.6540069580078	172.529541015625	10.0	348.71705627441406	86
und übernimmt dann die Betreuung ihres 8-jährigen Enkels: Sie bereitet ihm das Früh-	151.6540069580078	184.529541015625	10.0	348.7060089111328	86
stück, zieht ihn an, bringt ihn zur Schule und holt ihn wieder ab; sie kocht das Essen für	151.6540069580078	196.529541015625	10.0	348.6979522705078	86
die gesamte Familie und beschäftigt sich mit dem Enkel, bis sein Vater von der Arbeit	151.6540069580078	208.529541015625	10.0	348.7070770263672	86
zurückkehrt; danach tätigt Marek Einkäufe und wäscht die Wäsche, spielt Computer-	151.6540069580078	220.529541015625	10.0	348.70018005371094	86
spiele mit seinem Sohn und überprüft seine Hausaufgaben.	151.6540069580078	232.529541015625	10.0	235.52000427246094	86
Im Gegensatz zu diesem Fall zieht sich Jakub, der Repräsentant des zweiten Typus,	168.66180419921875	244.529541015625	10.0	331.701171875	86
vollständig aus der Betreuung seines 6-jährigen Sohnes zurück. Er rechtfertigt dies mit	151.6540069580078	256.529541015625	10.0	348.69898986816406	86
dem Hinweis auf die zeitaufwändige Führung eines eigenen Unternehmens. Kontakt zu	151.6540069580078	268.529541015625	10.0	348.6999969482422	86
seinem Sohn hat er nur wöchentlich, und zwar immer dann, wenn er seine eigene Mutter	151.6540069580078	280.529541015625	10.0	348.70008850097656	86
oder die Schwiegermutter besucht, die abwechselnd im sechswöchigen Rhythmus die	151.6540069580078	292.529541015625	10.0	348.69505310058594	86
Betreuung des Enkels übernehmen. Jakub ist ein „abwesender“ Vater, der seinen Sohn	151.6540069580078	304.529541015625	10.0	348.6921844482422	86
zwar ﬁnanziell unterstützt, jedoch nur dann, wenn seine Frau aus Deutschland zurück-	151.6540069580078	314.47802734375	12.051513671875	348.69212341308594	86
kommt, bei seiner Familie lebt. Ein solcher Rückzug von Vätern aus der Betreuung	151.6551513671875	328.529541015625	10.0	348.6978759765625	86
ﬁndet auch dort statt, wo Eltern getrennt leben oder geschieden sind und die Mutter den	151.6551513671875	338.47802734375	12.051513671875	348.709716796875	86
Status einer Alleinerziehenden einnimmt. Laut einer polnischen quantitativen Studie	151.6551513671875	352.529541015625	10.0	348.72393798828125	86
beträgt der Anteil von ‚Familien mit einem Elternteil‘ etwa 10 % aller MigrantInnenfa-	151.6551513671875	364.529541015625	10.0	348.7220764160156	86
milien (siehe Walczak 2008: 6).	151.6551513671875	376.529541015625	10.0	127.04800415039062	86
Paweł ist unser Beispiel für den dritten Typus: Um 4 Uhr morgens bricht er zur Ar-	168.66294860839844	388.529541015625	10.280792236328125	331.68492126464844	86
beit auf, um 7 Uhr weckt er telefonisch vom Arbeitsplatz aus seinen 12-jährigen Sohn.	151.65518188476562	400.529541015625	10.0	348.7028503417969	86
Später ruft er ihn erneut an, um zu prüfen, ob er den Hund ausgeführt hat; am frühen	151.65518188476562	412.529541015625	10.0	348.68194580078125	86
Nachmittag ruft er ein letztes Mal an, um sicherzugehen, dass der Sohn wohlbehalten	151.65518188476562	424.529541015625	10.0	348.7040100097656	86
aus der Schule zurückgekehrt ist. In Notfällen kann sich der Junge, der einen äußerst	151.65518188476562	436.529541015625	10.0	348.696044921875	86
selbstständigen Eindruck macht, an Nachbarn wenden. Nach der Arbeit macht Paweł	151.65518188476562	448.529541015625	10.280792236328125	348.6629943847656	86
Einkäufe und beschäftigt sich mit den Hausaufgaben seines Sohnes. In unserem Sample	151.65432739257812	460.529541015625	10.0	348.6949768066406	86
hatten wir in der ukrainischen und der polnischen Stichprobe jeweils einen solchen Fall,	151.65432739257812	472.529541015625	10.313720703125	348.6680908203125	86
ein Hinweis darauf, dass die Übernahme von weiblich vergeschlechtlichter Care-Arbeit	151.6544189453125	484.529541015625	10.0	348.7029113769531	86
in den Herkunftsländern eher als eine Ausnahme betrachtet werden muss.	151.6544189453125	496.529541015625	10.0	293.8182067871094	86
Bereits beim ersten Blick auf die vorgefundenen Typen der väterlichen Kinderbe-	168.66221618652344	508.529541015625	10.0	331.69297790527344	86
treuung fällt auf, dass in Familien mit zwei Elternteilen, in denen die Mutter migriert,	151.6544189453125	520.529541015625	10.0	348.71600341796875	86
Väter die Betreuung ihrer Kinder in einem hohen Maß weiblichen Verwandten, vor-	151.6544189453125	532.529541015625	10.0	348.6980285644531	86
´	409.3702697753906	537.6107177734375	12.0	2.66400146484375	86
rangig den Großmüttern, ü´berlassen. Diese Strategie der Teilung bzw. der Übertragung	151.6544189453125	544.529541015625	14.7667236328125	348.69342041015625	86
der Care-Arbeit auf weibliche Personen aus dem sozialen Umfeld ﬁnden wir nicht nur	151.6544189453125	554.47802734375	12.051513671875	348.6666564941406	86
in Polen, sondern auch bei deutschen Familien alleinerziehender erwerbstätiger Väter	151.65426635742188	568.529541015625	10.0	348.7102355957031	86
(vgl. Stiehler 2000: 131f.) bzw. berufstätigen Elternpaaren mit atypischen Arbeitsver-	151.65426635742188	580.529541015625	10.0	348.701171875	86
hältnissen (hier mit extensiver räumlicher und zeitlicher Flexibilität) (vgl. Jurczyk et al.	151.65426635742188	592.529541015625	10.0	348.7340393066406	86
2009: 235ff.; Ludwig et al. 2002). Angesichts fehlender Infrastrukturangebote greifen	151.65426635742188	604.529541015625	10.0	348.6926574707031	86
diese in der Regel sowohl auf die informelle Unterstützung von Familienmitgliedern	151.65426635742188	616.529541015625	10.0	348.6999816894531	86
GENDER 1 | 2011	151.6540069580078	675.3643188476562	7.0228271484375	54.46693420410156	87
Das Care-Chain-Konzept auf dem Prüfstand	151.6540069580078	46.2078857421875	8.0	163.14561462402344	88
17	491.41900634765625	46.2078857421875	8.0	8.89599609375	89
und Bekannten zurück sowie auf Migrantinnen (siehe die entsprechenden Beispiele in	151.6540069580078	87.68353271484375	10.0	348.70005798339844	90
Lutz 2007).	151.6540069580078	99.68353271484375	10.0	46.660003662109375	90
Studien über alleinerziehende Eltern in Deutschland und in Polen verweisen auf	171.27279663085938	111.68353271484375	10.0	329.0898132324219	90
Übereinstimmungen beim geschlechtsspeziﬁschen Umgang mit der Vereinbarkeits-	151.6540069580078	121.63201904296875	12.051513671875	348.6790008544922	90
frage. So sind deutsche alleinerziehende Väter – im Gegensatz zu alleinerziehenden	151.65403747558594	135.68353271484375	10.0	348.7099151611328	90
Müttern – primäre „Erwerbspersonen“; 90 % sind berufstätig, die meisten in Vollzeit	151.65403747558594	147.68353271484375	10.0	348.7049102783203	90
(im Gegensatz hierzu sind 70 % der Frauen berufstätig, dazu oft in Teilzeit). Für Po-	151.65403747558594	159.68353271484375	10.0	348.7028045654297	90
len gilt, dass im Gegensatz zu den Ehefrauen männlicher Migranten zurückbleibende	151.65403747558594	171.68353271484375	10.0	348.70985412597656	90
Väter ihre Erwerbsarbeit in der Regel nicht aufgeben, wenn die Frauen migrieren	151.65403747558594	183.68353271484375	10.0	348.70191955566406	90
(Wóycicka/Rurarz 2007: 294), sondern sich, wie oben beschrieben, die Care-Arbeit	151.65403747558594	195.68353271484375	10.0	348.6910858154297	90
teilen.	151.65403747558594	207.68353271484375	10.0	25.44000244140625	90
In beiden Ländern scheint dieses Verhalten nicht nur eine Frage des ökonomischen	168.6622314453125	219.68353271484375	10.0	331.69219970703125	90
Kalküls zu sein, sondern ebenso ein Ausdruck der kulturellen vergeschlechtlichten Ko-	151.65403747558594	231.68353271484375	10.0	348.68809509277344	90
dierung der Arbeitsteilung: Care-Arbeit bleibt ‚weiblich‘, selbst wenn Frauen ‚männli-	151.65403747558594	243.68353271484375	10.0	348.70506286621094	90
che‘ Erwerbsarbeit übernehmen (Matzner 2007: 229; Grunow 2007).	151.65403747558594	255.68353271484375	10.0	276.0399932861328	90
Bei der praktizierten Vaterschaft zeigte sich in unserer Studie typenübergreifend,	168.6622314453125	267.68353271484375	10.0	331.7021484375	90
dass betreuende Väter oft Schwierigkeiten haben, die durch einen Mangel an (emotio-	151.65403747558594	279.68353271484375	10.0	348.7010040283203	90
naler) Betreuungskompetenz verursacht werden: Ein Vater etwa bezeichnet seinen Sohn	151.65403747558594	291.68353271484375	10.0	348.7100372314453	90
als eine „Heulsuse“. Auf die Frage, wie er gewöhnlich reagiere, antwortet er:	151.65403747558594	303.68353271484375	10.0	307.68785095214844	90
„Ich habe einfach die Tür zugemacht oder bin ’rausgegangen, um eine Zigarette zu rauchen oder so-	151.65403747558594	326.8648986816406	8.0	348.6599578857422	91
was. Aber als er immer noch nicht aufhören wollte, habe ich ihm auch eine geklatscht … und fertig.“	151.65403747558594	336.46490478515625	8.0	346.1377410888672	91
Diese Reaktion ist aus der Debatte über traditionelle männliche Erziehungsstile wohl-	151.65403747558594	358.8831481933594	10.0	348.7100067138672	92
bekannt; sie zeigt nicht nur, dass Väter, die gelernt haben, Tränen als Zeichen von Hilf-	151.65403747558594	370.8831481933594	10.0	348.7020721435547	92
losigkeit zu unterdrücken, dieses Muster oft auf die nächste Generation übertragen, in-	151.65403747558594	382.8831481933594	10.0	348.6969451904297	92
dem sie emotionale Äußerungen ihrer Söhne negativ sanktionieren. Die gegenwärtige	151.65403747558594	394.8831481933594	10.0	348.70399475097656	92
Vaterschaftsforschung belegt zwar, dass es die ‚eine männliche Erziehung‘ nicht gibt,	151.65403747558594	406.8831481933594	10.0	348.7022247314453	92
sondern dass Vaterschaft jeweils in einem sozialen und zeitlichen Kontext sowie entlang	151.65403747558594	418.8831481933594	10.0	348.7072296142578	92
der individuellen Differenzen, wie Alter, Einkommen, Klasse, Ethnizität, biograﬁsche	151.65403747558594	428.8316345214844	12.051513671875	348.66383361816406	92
Erfahrungen, zu erforschen ist (Edwards et al. 2009). Dennoch zeigen einschlägige Stu-	151.65386962890625	442.8831481933594	10.0	348.69903564453125	92
dien, dass die ‚männliche‘ Erziehung mit ihrem charakteristischen Habitus der physi-	151.65386962890625	454.8831481933594	10.0	348.70001220703125	92
schen und emotionalen Unabhängigkeit, Risikobereitschaft und dem bevorzugten Um-	151.65386962890625	466.8831787109375	10.000015258789062	348.70001220703125	92
gang mit Kindern in Form von Spielen und Sport zwar in allen möglichen Variationen,	151.65386962890625	478.8831787109375	10.0	348.69818115234375	92
jedoch über alle Differenzlinien – Klasse, Ethnizität, Alter – hinweg stets eine Rolle	151.65386962890625	490.8831787109375	10.0	348.7071533203125	92
spielt (Duncan/Edwards 1999; Doucet 2010; Doucet 2006).	151.65386962890625	502.8831787109375	10.0	238.02001953125	92
Dabei sind sich auch einige Väter in unserem Sample durchaus bewusst, dass von	168.6620635986328	514.8831787109375	10.0	331.67723083496094	92
ihnen erwartet wird, die abwesende Mutter zu „ersetzen“. So äußert sich ein Vater fol-	151.65386962890625	526.8831787109375	10.0	348.6930847167969	92
gendermaßen:	151.65386962890625	538.8831787109375	10.0	56.649993896484375	92
„Es ist so, als wenn man das Kind zum ersten Mal zum Kindergarten schickt. Am ersten Tag gefällt es	151.65386962890625	562.06494140625	8.0	348.6656188964844	93
ihm, am zweiten wird er neugierig, am dritten wird alles verdächtig und am vierten weint er … Also,	151.65386962890625	571.6649169921875	8.0	348.6697998046875	93
als er das begriffen hat, dass Mama nicht da ist, da gab es eine kleine Krise. Und das passiert immer	151.65386962890625	581.264892578125	8.0	348.6519470214844	93
noch ab und zu. Nicht – regelmäßig, aber – wenn er traurig wird. Und ein Mal meinte er sogar, dass	151.65386962890625	590.8649291992188	8.0	348.6606750488281	93
das alles wegen dieser – blöden – Arbeit, dass Mama dahin fahren muss und dass keiner ihn liebt. Das	151.65386962890625	600.4649047851562	8.0	348.6575012207031	93
sind Probleme eines Kindes.“	151.65386962890625	610.06494140625	8.0	98.99212646484375	93
GENDER 1 | 2011	445.84869384765625	675.3643188476562	7.0228271484375	54.466522216796875	94
18	151.6540069580078	46.2078857421875	8.0	8.89599609375	95
Helma Lutz, Ewa Palenga-Möllenbeck	359.16900634765625	46.2078857421875	8.0	141.14718627929688	96
Viele Väter fühlen sich überfordert und verfügen nicht über die notwendigen Bewälti-	151.6540069580078	87.68353271484375	10.0	348.6991729736328	97
gungsstrategien oder ﬁnden die entsprechende Beratung auch nicht in ihrem Umfeld.	151.6540069580078	97.63201904296875	12.051513671875	339.6537322998047	97
Aus diesen Analysen leiten wir die These ab, dass Geschlechternormen, in diesem	168.66175842285156	111.68353271484375	10.0	331.6881561279297	97
Fall traditionelle Wahrnehmungen geschlechtsspeziﬁscher Bewältigungsstrategien, Be-	151.65396118164062	121.63201904296875	12.051513671875	348.6771240234375	97
treuungskompetenzen und Verantwortlichkeiten, tief verankert sind und nicht automatisch	151.6542205810547	135.68353271484375	10.0	348.71290588378906	97
von der Kraft des Faktischen verändert werden: Ein Rollenwechsel, bei dem der Vater die	151.6542205810547	147.68353271484375	10.0	348.7081756591797	97
Mutterrolle übernimmt, gehört keineswegs zu den Automatismen einer Situation, in der	151.6542205810547	159.68353271484375	10.0	348.70811462402344	97
Mütter zu Ernährerinnen ihrer Familien werden.10 Rollenwechsel wurden bislang selten in	151.6542205810547	171.311279296875	10.37225341796875	348.67906188964844	97
Bezug auf männliche Migration diskutiert, die Abwesenheit von Vätern scheint insgesamt	151.65428161621094	183.68316650390625	10.0	348.70704650878906	97
als „natürlich“ oder akzeptabel wahrgenommen zu werden; erst mit der Migration der	151.65428161621094	195.68316650390625	10.0	348.71388244628906	97
Mütter wurde die ‚Fragmentierung von Familien‘ problematisiert. Während aus zahlrei-	151.65428161621094	207.68316650390625	10.0	348.7079620361328	97
chen Fallstudien der Migrationsforschung bekannt ist, dass Mütter in Familien mit abwe-	151.65428161621094	219.68316650390625	10.0	348.6997528076172	97
senden Vätern solche Situationen schon vor Jahrzehnten bewältigen mussten (Abadan-	151.65428161621094	231.68316650390625	10.0	348.6898651123047	97
Unat 1985), wird die Situation in Bezug auf abwesende Mütter neu und anders beurteilt.	151.65428161621094	243.68316650390625	10.0	344.49977111816406	97
Als Folge solcher Fragmentierungsprozesse beschreiben Rhacel Parreñas (2005)	168.6624755859375	255.68316650390625	10.0	331.677001953125	97
für die Philippinen und Michele Gamburd (2000) für Sri Lanka, dass bei einigen zu-	151.65428161621094	267.68316650390625	10.0	348.68797302246094	97
rückbleibenden Ehemännern und Vätern sozial abweichendes Verhalten festzustellen	151.65428161621094	279.68316650390625	10.0	348.7070770263672	97
sei, eine Beobachtung, die auch durch unsere Studie bestätigt wird: In mehreren Fami-	151.65428161621094	291.68316650390625	10.0	348.7019500732422	97
lien in Polen und in der Ukraine wurde Alkoholmissbrauch und Vernachlässigung der	151.65428161621094	303.68316650390625	10.0	348.68296813964844	97
Versorgungspﬂichten konstatiert. In einigen Fällen führte dies dazu, dass nicht die Vä-	151.65428161621094	313.63165283203125	12.051513671875	348.6980743408203	97
ter ihre Kinder betreuten, sondern halberwachsene Töchter die Versorgung ihrer Väter	151.6543426513672	327.68316650390625	10.0	348.69139099121094	97
übernommen haben.	151.6543426513672	339.68316650390625	10.0	81.65000915527344	97
Schließlich ist hier festzuhalten, dass in unserer Studie Hinweise auf eine „Krise	168.66253662109375	351.68316650390625	10.0	331.6919250488281	97
des männlichen Selbstverständnisses“ zu konstatieren sind (siehe dazu auch Lutz 2007:	151.6543426513672	363.68316650390625	10.0	348.69993591308594	97
167). Ehemänner und Väter verlieren nicht nur ihre traditionelle Ernährerfunktion, son-	151.6543426513672	375.68316650390625	10.0	348.7087860107422	97
dern sie gewinnen selbst dann kein soziales Prestige, wenn sie die Rolle der betreuenden	151.6543426513672	387.68316650390625	10.0	348.70594787597656	97
Mutter übernehmen, da ein solcher Wechsel der Genderkodierung tendenziell mit einem	151.6543426513672	399.68316650390625	10.0	348.71812438964844	97
Statusverlust verbunden ist. Trotz vieler Unterschiede gilt – wie bereits gesagt – diese	151.6543426513672	411.68316650390625	10.0	348.70887756347656	97
Beobachtung nicht nur für die Entsende-, sondern auch für die Aufnahmegesellschaften.	151.6543426513672	423.68316650390625	10.0	348.6979217529297	97
Selbst Studien über die „neue Vaterschaft“ (z. B. Mühling/Rost 2007; Bereswill et al.	151.6543426513672	435.68316650390625	10.0	348.6982879638672	97
2006; Edwards/Doucat/Furstenberg 2009) zeigen, dass das Engagement der Väter bei der	151.6543426513672	447.68316650390625	10.0	348.69752502441406	97
Betreuung von Kindern zwar konstant wächst, die Rhetorik der aktiven Vaterschaft und	151.6543426513672	459.68316650390625	10.0	348.69398498535156	97
die Alltagspraxis jedoch immer noch weit auseinanderklaffen. Wie eingangs erwähnt, tun	151.6543426513672	471.68316650390625	10.0	348.70655822753906	97
sich die Väter schwer, ihre Rolle als Erwerbsperson zu minimieren. Auch die sogenannten	151.6543426513672	483.68316650390625	10.0	348.7011260986328	97
„neuen Väter“, die sich inzwischen nicht nur als breadwinner, sondern auch als carer se-	151.6543426513672	495.68316650390625	10.313720703125	348.6373748779297	97
hen, sind weiterhin zwischen traditionellen und modernen Identitäten, Normen und Insti-	151.65472412109375	507.68316650390625	10.0	348.7098388671875	97
tutionen hin- und hergerissen. Für die hier relevanten Entsendeländer Polen und Ukraine	151.65472412109375	519.6831665039062	10.0	348.6958923339844	97
muss festgehalten werden, dass die partnerschaftlichen Elternschaftsmodelle zwar verbal	151.65472412109375	531.6831665039062	10.0	348.71185302734375	97
gewünscht, aber nicht im Alltag gelebt werden – was sich nicht nur in unseren Interviews,	151.65472412109375	543.6831665039062	10.0	348.69586181640625	97
sondern auch in einschlägigen Umfragen widerspiegelt (für Polen vgl. Metz-Göckel et al.	151.65472412109375	555.6831665039062	10.0	348.703857421875	97
2010: 298ff.). Als hinderlich für diesen Wandel können familialistische Sozialpolitiken	151.65472412109375	567.6831665039062	10.0	348.7125244140625	97
gesehen werden, die in Verbindung mit der familienunfreundlichen Arbeitsmarktpolitik	151.65472412109375	579.6831665039062	10.0	348.7066650390625	97
10 Diese Erkenntnis ﬁnden wir auch bei alleinerziehenden deutschen Vätern nach der Trennung von	151.6540069580078	607.38330078125	8.0	348.6621856689453	98
bzw. dem Tod der Mutter. Sowohl die Väter selber wie auch ihr soziales Umfeld nehmen diese	168.66180419921875	616.9832763671875	8.0	331.65985107421875	98
Familienform als deﬁzitär, „abartig“ und „exotisch“ wahr (Matzner 2007: 236f.).	168.66180419921875	626.583251953125	8.0	275.75958251953125	98
GENDER 1 | 2011	151.6540069580078	675.3643188476562	7.0228271484375	54.46693420410156	99
Das Care-Chain-Konzept auf dem Prüfstand	151.6540069580078	46.2078857421875	8.0	163.14561462402344	100
19	491.41900634765625	46.2078857421875	8.0	8.89599609375	101
(u. a. Frauendiskriminierung) die Familienarbeit zu einer ‚Frauensache‘ machen (Plo-	151.6540069580078	87.68353271484375	10.0	348.70790100097656	102
mien 2009; Szelewa/Polakowski 2008). Hinzu kommt – nicht nur in´ Polen – die Kultur	151.6540069580078	95.39990234375	14.28363037109375	348.69581604003906	102
der ‚starken Mutterschaft‘ (vgl. für westliche Gesellschaften Hays 1996; Badinter 2010),	151.6540069580078	111.68353271484375	10.0	348.6898651123047	102
die sich im Topos der „Mutter Polin“, die ihre eigenen Bedürfnisse grundsätzlich für die	151.6540069580078	123.68353271484375	10.0	348.7031707763672	102
Familie opfert, spiegelt (Marody/Giza-Poleszczuk 2000). Diese auch in sozialistischen	151.6540069580078	135.68353271484375	10.0	348.7058563232422	102
Zeiten trotz hoher Berufstätigkeit der Frauen gelebte Norm der Mutterschaft wird durch	151.6540069580078	147.68353271484375	10.0	348.70384216308594	102
die Re-Familialisierung der Sozialpolitiken nach 1989 weiter gefördert, was die Hand-	151.6540069580078	159.68353271484375	10.0	348.70985412597656	102
lungsspielräume der neuen Väter Osteuropas deutlich einschränkt.	151.6540069580078	171.68353271484375	10.0	260.62876892089844	102
3.2 Betreuungsmuster: zurückbleibende Großmütter	151.6540069580078	195.88812255859375	10.0	249.9369659423828	103
Wie bereits erwähnt, wird in den meisten von uns untersuchten Familien die Care-Ar-	151.6540069580078	219.68353271484375	10.0	348.69813537597656	104
beit auf andere weibliche Personen („Ersatzmütter“), insbesondere Großmütter, umver-	151.6540069580078	231.68353271484375	10.0	348.7102813720703	104
teilt: „Ohne all diese Großmütter würde das Leben in solchen Familien überhaupt nicht	151.6540069580078	243.68353271484375	10.0	348.71998596191406	104
funktionieren“, sagte ein Informant. Großmütter fungieren nicht nur als Betreuerinnen	151.6540069580078	255.68353271484375	10.0	348.70896911621094	104
für die Kinder, sondern auch als Supervisorinnen für junge Väter, um die „man sich	151.6540069580078	267.68353271484375	10.0	348.68592834472656	104
kümmern muss“.	151.6540069580078	279.68353271484375	10.0	68.33000183105469	104
Die meisten Großmütter werden von den Migrantinnen als hingebungsvolle Be-	168.66180419921875	291.68353271484375	10.0	331.677001953125	104
treuerinnen beschrieben, auf die sie sich verlassen können. Allerdings scheint die Um-	151.6540069580078	303.68353271484375	10.0	348.69728088378906	104
verteilung der Mutterschaftsaufgaben nicht ohne Reibungsverluste zu verlaufen, denn	151.6540069580078	315.68353271484375	10.0	348.6999969482422	104
in den Interviews wird von den betroffenen Großmüttern berichtet, dass sie sich phy-	151.6540069580078	327.68353271484375	10.0	348.69288635253906	104
sisch und psychisch oft nicht in der Lage sehen, ihrer Verantwortung gerecht zu werden	151.6540069580078	339.68353271484375	10.0	348.70408630371094	104
(Krankheiten, fehlende Kondition usw.); als Generationsprobleme werden Kommuni-	151.6540069580078	351.68353271484375	10.0	348.6887969970703	104
kationsprobleme mit ihren Enkelkindern beschrieben, die etwa in der Pubertät der Kin-	151.6540069580078	363.68353271484375	10.0	348.69898986816406	104
der auftreten oder durch die ‚digitale Lücke‘ im Alltagswissen verursacht werden: Sie	151.6540069580078	375.68353271484375	10.0	348.6979217529297	104
können die elektronischen Freizeitaktivitäten der Kinder nicht supervisieren. Aus Sicht	151.6540069580078	387.68353271484375	10.0	348.70921325683594	104
der Mütter werden die Kinder zu sehr verwöhnt und Großmütter können die schulischen	151.6540069580078	399.68353271484375	10.0	348.70005798339844	104
Probleme der Kinder nicht adäquat lösen.	151.6540069580078	411.68353271484375	10.0	166.0800018310547	104
3.3 Betreuungsmuster: Freundinnen, weibliche Verwandte und	151.6540069580078	435.88812255859375	10.0	298.45909118652344	105
Geschwisterversorgung	174.3310089111328	447.88812255859375	10.0	108.33998107910156	105
In einigen wenigen Familien fanden wir die Übernahme der Care-Arbeit durch Freun-	151.6540069580078	471.68353271484375	10.0	348.68898010253906	106
dinnen der Mutter oder weibliche Verwandte. Diese Beziehungen werden jedoch oftmals	151.6540069580078	483.68353271484375	10.0	348.7010040283203	106
als instabil erfahren, da die Betreuung durch eigene familiäre Verpﬂichtungen erschwert	151.6540069580078	493.63201904296875	12.051513671875	348.67100524902344	106
wird (insbesondere, wenn sie selbst kleine Kinder haben). Die von uns interviewten	151.65383911132812	507.68353271484375	10.0	348.68499755859375	106
Ersatzbetreuerinnen berichteten von Erschöpfung und Stress, der aus der Übernahme	151.65383911132812	519.6835327148438	10.0	348.68505859375	106
von zu viel Verantwortung resultiere; damit sind etwa Autoritätsprobleme, besonders	151.65383911132812	531.6835327148438	10.0	348.69696044921875	106
mit Kindern im Teenager-Alter, gemeint (Schulverweigerung, Diskothekbesuche etc.),	151.65383911132812	543.6835327148438	10.0	348.7030334472656	106
wobei sich Kinder den Anordnungen der Ersatzmütter mit dem Hinweis auf ein nicht	151.65383911132812	555.6835327148438	10.0	348.69586181640625	106
