www.ssoar.info	401.6929931640625	114.9293212890625	18.0	131.21990966796875	0
Das Care-Chain-Konzept auf dem Prüfstand: eine	73.69999694824219	203.67633056640625	18.0	420.71400451660156	1
Fallstudie der transnationalen Care-Arrangements	73.69999694824219	225.2763671875	18.0	428.7420196533203	2
polnischer und ukrainischer Migrantinnen	73.69999694824219	246.8763427734375	18.0	358.65000915527344	3
Lutz, Helma; Palenga-Möllenbeck, Ewa	73.69999694824219	268.3463134765625	13.0	226.74595642089844	4
Veröffentlichungsversion / Published Version	73.69999694824219	297.79296875	10.0	197.0399932861328	5
Zeitschriftenartikel / journal article	73.69999694824219	312.626953125	10.0	148.82998657226562	6
Zur Verfügung gestellt in Kooperation mit / provided in cooperation with:	73.69999694824219	338.5699768066406	10.0	345.13999938964844	7
Verlag Barbara Budrich	73.69999694824219	353.6339111328125	10.0	103.33000183105469	8
Empfohlene Zitierung / Suggested Citation:	59.527000427246094	396.7811584472656	9.0	184.78795623779297	9
Lutz, H., & Palenga-Möllenbeck, E. (2011). Das Care-Chain-Konzept auf dem Prüfstand: eine Fallstudie der	59.527000427246094	407.78814697265625	9.0	427.8959732055664	10
transnationalen Care-Arrangements polnischer und ukrainischer Migrantinnen. Gender : Zeitschrift für Geschlecht,	59.527000427246094	418.4106140136719	9.177520751953125	453.9419937133789	11
Kultur und Gesellschaft, 3(1), 9-27. http://nbn-resolving.de/urn:nbn:de:0168-ssoar-394542	59.527000427246094	429.21063232421875	9.177520751953125	356.9759292602539	12
Nutzungsbedingungen:	59.527000427246094	567.6153564453125	8.0	89.22400665283203	13
Dieser Text wird unter einer Deposit-Lizenz (Keine	59.527000427246094	577.2535400390625	8.0	228.18997955322266	13
Weiterverbreitung - keine Bearbeitung) zur Verfügung gestellt.	59.527000427246094	586.8535766601562	8.0	228.1879653930664	13
Gewährt wird ein nicht exklusives, nicht übertragbares,	59.527000427246094	596.4535522460938	8.0	228.19001007080078	13
persönliches und beschränktes Recht auf Nutzung dieses	59.527000427246094	606.0535888671875	8.0	228.19001007080078	13
Dokuments. Dieses Dokument ist ausschließlich für	59.527000427246094	615.653564453125	8.0	228.18903350830078	13
den persönlichen, nicht-kommerziellen Gebrauch bestimmt.	59.527000427246094	625.2535400390625	8.0	228.18799591064453	13
Auf sämtlichen Kopien dieses Dokuments müssen alle	59.527000427246094	634.8535766601562	8.0	228.1860122680664	13
Urheberrechtshinweise und sonstigen Hinweise auf gesetzlichen	59.527000427246094	644.4535522460938	8.0	228.19400787353516	13
Schutz beibehalten werden. Sie dürfen dieses Dokument	59.527000427246094	654.0535888671875	8.0	228.18399810791016	13
nicht in irgendeiner Weise abändern, noch dürfen Sie	59.527000427246094	663.653564453125	8.0	228.18897247314453	13
dieses Dokument für öffentliche oder kommerzielle Zwecke	59.527000427246094	673.2535400390625	8.0	228.1860122680664	13
vervielfältigen, öffentlich ausstellen, aufführen, vertreiben oder	59.527000427246094	682.8535766601562	8.0	228.18799591064453	13
anderweitig nutzen.	59.527000427246094	692.4535522460938	8.0	69.33599090576172	13
Mit der Verwendung dieses Dokuments erkennen Sie die	59.527000427246094	702.0535888671875	8.0	228.18500518798828	13
Nutzungsbedingungen an.	59.527000427246094	711.653564453125	8.0	93.36798858642578	13
Terms of use:	304.7229919433594	567.6153564453125	8.0	51.824005126953125	14
This document is made available under Deposit Licence (No	304.7229919433594	577.2535400390625	8.0	228.18399047851562	14
Redistribution - no modifications). We grant a non-exclusive, non-	304.7229919433594	586.8535766601562	8.0	228.19198608398438	14
transferable, individual and limited right to using this document.	304.7229919433594	596.4535522460938	8.0	228.18405151367188	14
This document is solely intended for your personal, non-	304.7229919433594	606.0535888671875	8.0	228.18399047851562	14
commercial use. All of the copies of this documents must retain	304.7229919433594	615.653564453125	8.0	228.18801879882812	14
all copyright information and other information regarding legal	304.7229919433594	625.2535400390625	8.0	228.18399047851562	14
protection. You are not allowed to alter this document in any	304.7229919433594	634.8535766601562	8.0	228.18997192382812	14
way, to copy it for public or commercial purposes, to exhibit the	304.7229919433594	644.4535522460938	8.0	228.18997192382812	14
document in public, to perform, distribute or otherwise use the	304.7229919433594	654.0535888671875	8.0	228.18301391601562	14
document in public.	304.7229919433594	663.653564453125	8.0	68.88800048828125	14
By using this particular document, you accept the above-stated	304.7229919433594	673.2535400390625	8.0	228.18399047851562	14
conditions of use.	304.7229919433594	682.8535766601562	8.0	62.21600341796875	14
Schwerpunkt	156.1020050048828	57.801513671875	16.0	99.5679931640625	15
Helma Lutz, Ewa Palenga-Möllenbeck	151.6540069580078	89.2978515625	10.0	175.59996032714844	16
Das Care-Chain-Konzept auf dem Prüfstand	151.6540069580078	118.20025634765625	14.0	283.9479522705078	17
Eine Fallstudie der transnationalen Care-Arrangements	151.6540069580078	135.74908447265625	12.0	307.4279327392578	18
polnischer und ukrainischer Migrantinnen	151.6540069580078	151.74908447265625	12.0	234.6959991455078	19
Zusammenfassung	157.322998046875	191.5184326171875	9.0	71.51399230957031	20
In einem 2000 erschienenen Artikel präg-	157.322998046875	211.51434326171875	7.999969482421875	153.07199096679688	21
te Arlie Hochschild den Begriff der „care	157.322998046875	221.11431884765625	8.0	153.07028198242188	21
chains“, um zu beschreiben, dass Migrantin-	157.322998046875	230.71432495117188	8.0	153.07205200195312	21
nen, die im Ausland die Care-Arbeit für Kin-	157.322998046875	240.3143310546875	8.0	153.0718994140625	21
der und alte Menschen übernehmen, daheim	157.322998046875	249.91433715820312	8.0	153.07598876953125	21
eine Versorgungslücke in ihrer eigenen Fami-	157.322998046875	259.51434326171875	8.0	153.07171630859375	21
lie hinterlassen. Diese Lücke, so Hochschild,	157.322998046875	269.1143493652344	8.0	153.07196044921875	21
werde entweder durch Mitglieder des Fami-	157.322998046875	278.71435546875	8.0	153.0721435546875	21
liennetzwerks gefüllt oder durch Migrantin-	157.322998046875	288.3143615722656	8.0	153.07376098632812	21
nen aus einem wirtschaftlich ärmeren Land.	157.322998046875	297.91436767578125	8.0	148.75299072265625	21
In diesem Artikel werden Daten aus einem	157.322998046875	307.5143737792969	8.0	153.07046508789062	21
Forschungsprojekt vorgestellt, das unter-	157.322998046875	317.1143798828125	8.0	153.07025146484375	21
sucht, wie in Deutschland arbeitende polni-	157.322998046875	326.7143859863281	8.0	153.07199096679688	21
sche Migrantinnen und in Polen arbeitende	157.322998046875	336.31439208984375	8.0	153.07196044921875	21
ukrainische Migrantinnen diese Versorgungs-	157.322998046875	345.9143981933594	8.0	153.07278442382812	21
lücke bewältigen.	157.322998046875	355.514404296875	8.0	60.00799560546875	21
Wie wird die Betreuung und Versorgung	157.322998046875	365.1144104003906	8.0	153.07180786132812	21
von Kindern und alten Eltern im Herkunfts-	157.322998046875	374.71441650390625	8.0	153.07192993164062	21
land organisiert? Was bedeutet transnationa-	157.322998046875	384.3144226074219	8.0	153.07345581054688	21
le Mutterschaft für die Familien der Migran-	157.322998046875	393.9144287109375	8.0	153.072021484375	21
tinnen in praktischer und emotionaler Hin-	157.322998046875	403.5144348144531	8.0	153.072021484375	21
sicht? Wie geht die Öffentlichkeit in den be-	157.322998046875	413.11444091796875	8.0	153.07180786132812	21
troffenen Ländern mit dem Thema Care-Ar-	157.322998046875	422.7144470214844	8.0	153.07183837890625	21
beit und Migration um?	157.322998046875	432.314453125	8.0	81.35198974609375	21
Schlüsselwörter:	157.322998046875	451.6700134277344	8.0	55.11199951171875	22
Transnationale Migration, Care-Arbeit, Haus-	157.322998046875	461.1144714355469	8.0	153.07211303710938	22
haltsarbeit, Gender, Polen, Ukraine	157.322998046875	470.7144775390625	8.0	118.39276123046875	22
Summary	341.57501220703125	191.51861572265625	9.0	35.990997314453125	23
The ‘care chain’ concept under scrutiny	341.57501220703125	211.5145263671875	7.999969482421875	133.64794921875	24
Female Ukrainian/Polish care migrants and	341.57501220703125	221.114501953125	8.0	153.07046508789062	24
their families left behind	341.57501220703125	230.71450805664062	8.0	82.66400146484375	24
In an article published in 2000, Arlie Hoch-	341.57501220703125	249.91452026367188	8.0	153.0679931640625	25
schild coined the term ‘care chains’, indica-	341.57501220703125	259.5145263671875	8.0	153.0721435546875	25
ting that while migrant women take care of	341.57501220703125	269.1145324707031	8.0	153.06967163085938	25
children and elderly people elsewhere, they	341.57501220703125	278.71453857421875	8.0	153.07113647460938	25
leave behind a gap with regard to their own	341.57501220703125	288.3145446777344	8.0	153.07183837890625	25
care responsibilities.	341.57501220703125	297.91455078125	8.0	67.7120361328125	25
This gap, writes Hochschild, is either ﬁlled up	341.57501220703125	307.5145568847656	8.0	153.0704345703125	25
by members of the extended family network	341.57501220703125	317.11456298828125	8.0	153.072021484375	25
or by hiring of migrant domestic workers	341.57501220703125	326.7145690917969	8.0	153.0704345703125	25
from an economically poorer country. The re-	341.57501220703125	336.3145751953125	8.0	153.07180786132812	25
sult of these processes is a continuous com-	341.57501220703125	345.9145812988281	8.0	153.06893920898438	25
modiﬁcation of care work on world scale.	341.57501220703125	355.51458740234375	8.0	141.65707397460938	25
In this article data will be presented from an	341.57501220703125	365.1145935058594	8.0	153.06698608398438	25
ongoing research project which focuses on	341.57501220703125	374.714599609375	8.0	153.0716552734375	25
the management of the care gap by Polish	341.57501220703125	384.3146057128906	8.0	153.07275390625	25
migrant women working in Germany and	341.57501220703125	393.91461181640625	8.0	153.07199096679688	25
Ukrainian migrants working in Poland. How	341.57501220703125	403.5146179199219	8.0	153.07199096679688	25
is care arranged for children and elderly fa-	341.57501220703125	413.1146240234375	8.0	153.07012939453125	25
mily members staying behind? What does	341.57501220703125	422.7146301269531	8.0	153.07199096679688	25
transnational mothering mean for those left	341.57501220703125	432.31463623046875	8.0	153.072021484375	25
behind in practical and in emotional terms?	341.57501220703125	441.9146423339844	8.0	153.07040405273438	25
How is the issue of care in the context of mi-	341.57501220703125	451.5146484375	8.0	153.07199096679688	25
gration perceived in terms of public opinion	341.57501220703125	461.1146545410156	8.0	153.0733642578125	25
in the respective countries?	341.57501220703125	470.71466064453125	8.0	92.743896484375	25
Keywords:	341.57501220703125	490.0701904296875	8.0	35.55999755859375	26
Transnational migration, care work, domestic	341.57501220703125	499.5146484375	8.0	153.07382202148438	26
work, gender, Poland, Ukraine	341.57501220703125	509.11468505859375	8.0	103.296630859375	26
Einleitung	151.6540069580078	553.7742919921875	12.0	57.34800720214844	27
Das Care-Chain-Konzept, ein Begriff der Soziologin Arlie Hochschild, beschreibt die	151.6540069580078	579.4149169921875	10.0	348.6931610107422	28
im globalen Ausmaß emergierten personalisierten Beziehungen zwischen Menschen,	151.6540069580078	591.4149169921875	10.0	348.7029571533203	28
die bezahlt oder unbezahlt Care-Arbeit verrichten (Hochschild 2000: 131). Gegenstand	151.6540069580078	603.4149169921875	10.0	348.6999969482422	28
der Analyse sind Versorgungsketten, die entstehen, wenn transnationale Migrantinnen	151.6540069580078	615.4149169921875	10.0	348.69407653808594	28
GENDER Heft 1 | 2011, S. 9–27	403.0480041503906	675.3638305664062	7.02276611328125	97.26776123046875	29
10	151.6540069580078	46.2078857421875	8.0	8.89599609375	30
Helma Lutz, Ewa Palenga-Möllenbeck	359.16900634765625	46.2078857421875	8.0	141.14718627929688	31
die Betreuung und Versorgung von Kindern und alten Menschen im Ausland überneh-	151.6540069580078	87.68353271484375	10.0	348.67726135253906	32
men, womit sie in ihrer Herkunftsfamilie eine Versorgungslücke hinterlassen. Gefüllt	151.6540069580078	99.68353271484375	10.0	348.7010040283203	32
werde diese Lücke, so Hochschild, entweder durch Mitglieder des Familiennetzwerks	151.6540069580078	111.68353271484375	10.0	348.69505310058594	32
oder mit einer ‚Kopie‘, der erneuten Weitergabe dieser Arbeit an Migrantinnen aus ei-	151.6540069580078	123.68353271484375	10.0	348.69886779785156	32
nem wirtschaftlich ärmeren Land. Im Zentrum dieser Prozesse steht die weltweit statt-	151.6540069580078	135.68353271484375	10.0	348.70204162597656	32
ﬁndende, kontinuierliche Kommodiﬁzierung von care work.	151.6540069580078	145.63201904296875	12.365234375	240.9766082763672	32
In unserem Forschungsprojekt „Landscapes of Care Drain. Care Provision and Care	168.66261291503906	159.68353271484375	10.0	331.68003845214844	32
Chains from the Ukraine to Poland and from Poland to Germany“1 haben wir danach	151.65481567382812	171.311279296875	10.37225341796875	348.6688232421875	32
gefragt, wie in Deutschland arbeitende polnische und in Polen arbeitende ukrainische	151.65362548828125	183.68316650390625	10.0	348.7000427246094	32
Migrantinnen dieses „Care-Deﬁzit“ bewältigen. Dabei geht es nicht nur um die Analyse	151.65362548828125	193.63165283203125	12.051513671875	348.6943054199219	32
auf der Mikroebene der persönlichen Beziehungen, sondern auch darum, wie Migrati-	151.6540985107422	207.68316650390625	10.0	348.69004821777344	32
ons-, Gender- und Care-Regime in den Entsende- und Aufnahmeländern zusammenwir-	151.6540985107422	219.68316650390625	10.0	348.6953887939453	32
ken und wie diese die Migrationsverläufe und Betreuungssituationen in den Herkunfts-	151.6540985107422	231.68316650390625	10.0	348.6899871826172	32
haushalten der Migrantinnen beeinﬂussen.	151.6540985107422	241.63165283203125	12.051513671875	169.40284729003906	32
Der erste Teil des Beitrags befasst sich mit der Debatte über globale care chains und	168.6619415283203	255.68316650390625	10.313720703125	331.6528778076172	32
transnationale Elternschaft, gefolgt von einer kurzen Beschreibung der aktuellen Er-	151.65383911132812	267.68316650390625	10.0	348.712158203125	32
werbsmigration aus der Ukraine und Polen. Im zweiten Teil wird gezeigt, wie Care und	151.65383911132812	279.68316650390625	10.0	348.7071838378906	32
Migration in öffentlichen Diskursen der jeweiligen Herkunftsländer verhandelt werden.	151.65383911132812	291.68316650390625	10.0	348.7071533203125	32
Im dritten Teil schließlich stellen wir einige Charakteristika von Kinderbetreuungsar-	151.65383911132812	303.68316650390625	10.0	348.7145690917969	32
rangements in der Ukraine und Polen in den von uns untersuchten Haushalten vor. Die	151.65383911132812	315.68316650390625	10.0	348.68426513671875	32
Analyse konzentriert sich dabei auf die Frage nach den care patterns und erörtert auch	151.65383911132812	327.68316650390625	10.313720703125	348.66998291015625	32
das transnationale Betreuungsmanagement durch die migrierende Mutter.	151.65383911132812	339.68316650390625	10.0	293.55914306640625	32
1	151.65383911132812	376.4425048828125	12.0	6.6719970703125	33
Globale Care Chains	174.33157348632812	374.2206115722656	14.221893310546875	112.691650390625	34
Die „global care chain“ gilt mittlerweile als das zentrale Konzept zur Erforschung	151.65383911132812	402.0831604003906	10.313720703125	348.6968994140625	35
der von – meist weiblichen – Migranten geleisteten Haushaltsarbeit (Yeates 2009:	151.65374755859375	414.0831604003906	10.0	348.6991271972656	35
40f.). Mit dem Begriff wird das Zusammenwirken unterschiedlicher Phänomene, wie	151.65374755859375	426.0831604003906	10.0	348.69580078125	35
Globalisierung, Feminisierung der Migration, Gender-Beziehungen, Care und emo-	151.65374755859375	438.0831604003906	10.0	348.69378662109375	35
tionale Arbeit in kapitalistischen Arbeitsverhältnissen beschrieben und verknüpft.	151.65374755859375	450.0831604003906	10.0	348.702880859375	35
Hochschild geht es dabei um die Kommerzialisierung von Care-Arbeit2 in der ‚Er-	151.65374755859375	461.7113037109375	10.371902465820312	348.66717529296875	35
sten Welt‘, in der Versorgungs- und Familienarbeit an Migrantinnen „weitergereicht“	151.65380859375	474.08319091796875	10.0	348.7070617675781	35
werden, die ihrerseits einen Teil ihres Einkommens für die Versorgung der eigenen	151.65380859375	486.08319091796875	10.0	348.7012634277344	35
Familie ausgeben (müssen). Dieses Tauschverhältnis verursacht einen Care-Gewinn	151.65380859375	498.08319091796875	10.313690185546875	348.66302490234375	35
im Aufnahmeland, einen Care-Abzug im Entsendeland und fördert die Fortschreibung	151.65359497070312	510.08319091796875	10.31365966796875	348.6808776855469	35
sozialer Ungleichheit im globalen Maßstab (Hochschild 2003: 186f.). Als Gewinner	151.65347290039062	522.0831909179688	10.0	348.6921081542969	35
dieser Situation betrachtet Hochschild die Familien am oberen Ende der globalen care	151.65347290039062	534.0831909179688	10.31365966796875	348.6629943847656	35
chain, die Care-Arbeit kaufen und zudem von einem „emotionalen Mehrwert“ proﬁ-	151.65347290039062	544.0316162109375	12.365234375	348.66241455078125	35
tieren können. Als Verlierer seien dagegen die Familienangehörigen am unteren Ende	151.65390014648438	558.0831909179688	10.0	348.7095031738281	35
der Versorgungskette zu betrachten, zurückgelassene Kinder und pﬂegebedürftige alte	151.65390014648438	568.0316162109375	12.05157470703125	348.6781311035156	35
1	151.6540069580078	597.7832641601562	8.0	4.447998046875	36
2	151.6540069580078	607.38330078125	8.0	4.447998046875	36
Das Projekt (Laufzeit 2007–2010) wurde von der Deutschen Forschungsgemeinschaft ﬁnanziert.	168.66184997558594	597.7832641601562	8.0	325.9976043701172	37
Der englische Begriff ist schwer ins Deutsche zu übersetzen, da in Deutschland Pﬂegearbeit primär	168.66184997558594	607.38330078125	8.0	331.65296936035156	37
mit alten Menschen in Verbindung gebracht wird und die Versorgung, Betreuung und Erziehung	168.6610107421875	616.9832763671875	8.0	331.65313720703125	37
von Kindern darin fehlt.	168.6610107421875	626.583251953125	8.0	81.0478515625	37
GENDER 1 | 2011	151.6540069580078	675.3643188476562	7.0228271484375	54.46693420410156	38
Das Care-Chain-Konzept auf dem Prüfstand	151.6540069580078	46.2078857421875	8.0	163.14561462402344	39
11	491.41900634765625	46.2078857421875	8.0	8.89599609375	40
Menschen in den Entsendeländern, die den sozialen und emotionalen Preis für das	151.6540069580078	87.68353271484375	10.0	348.6970672607422	41
Care-Deﬁzit bezahlen.	151.6540069580078	97.63201904296875	12.051513671875	91.96890258789062	41
Diese kritisch-feministische Betrachtungsweise weist einen von ÖkonomInnen	168.661865234375	111.68353271484375	10.0	331.6860046386719	41
vertretenen einﬂussreichen Standpunkt zurück, demzufolge globale Care-Migration	151.65406799316406	121.63201904296875	12.051513671875	348.69322204589844	41
die wirtschaftliche Aufwärtsmobilität der Migrantinnen und ihrer Angehörigen fördert;	151.65414428710938	135.68353271484375	10.0	348.7030029296875	41
hier wird eine Win-win-Situation identiﬁziert, die auf beiden Seiten Gewinner generiert	151.65414428710938	145.63201904296875	12.051513671875	348.688720703125	41
(Hochschild 2003: 195).	151.65399169921875	159.68353271484375	10.0	97.489990234375	41
Eine dritte, konservative Position zur care chain, die sowohl in den Entsende- und	168.6617889404297	171.68353271484375	10.313720703125	331.6584014892578	41
in den Aufnahmeländern zu ﬁnden ist, besteht in der Aufforderung an Frauen, über ihren	151.65420532226562	181.63201904296875	12.051513671875	348.6791076660156	41
beruﬂichen Ambitionen ihre traditionellen Aufgaben als Mütter und Ehefrauen nicht zu	151.65447998046875	193.63201904296875	12.051513671875	348.7068176269531	41
vernachlässigen.	151.6556396484375	207.68353271484375	10.0	66.3699951171875	41
Betrachtet man die aktuelle politische Debatte über „Migration und Entwicklung“,	168.66343688964844	219.68353271484375	10.0	331.7050323486328	41
die insbesondere von MakroökonomInnen mächtiger, globaler Institutionen wie der	151.6556396484375	231.68353271484375	10.0	348.6941833496094	41
Weltbank geführt wird, dann scheint momentan die zweite Position an Einﬂuss zu ge-	151.6556396484375	241.63201904296875	12.051513671875	348.6611022949219	41
winnen: Demnach sind die Remissionen der MigrantInnen in ihre Heimatländer als	151.6558837890625	255.68353271484375	10.0	348.6999816894531	41
wichtigster Motor für die Entwicklung ihrer Herkunftsregionen zu betrachten (vgl. z. B.	151.6558837890625	267.68353271484375	10.0	348.7070007324219	41
den OECD-Bericht von Dayton-Johnson et al. 2007). Nun ist dieser Standpunkt ange-	151.6558837890625	279.68353271484375	10.0	348.6739807128906	41
sichts der Tatsache, dass der Devisenimport durch Überweisungen für einige Volkswirt-	151.6558837890625	291.68353271484375	10.0	348.6909484863281	41
schaften die wichtigste Einnahmeressource ist, durchaus nachvollziehbar. Allerdings	151.6558837890625	303.68353271484375	10.0	348.701416015625	41
stellt sich die Frage, welche sozialen Kosten für die beteiligten Personen, die Migrantin-	151.6558837890625	315.68353271484375	10.0	348.7080078125	41
nen und ihre Familien, entstehen. Wie also wirkt sich das Care-Deﬁzit auf die nationalen	151.6558837890625	325.63201904296875	12.051513671875	348.68115234375	41
Sozialpolitiken der Entsendeländer aus? Wird das Thema der durch Migration verur-	151.6561279296875	339.68353271484375	10.0	348.70013427734375	41
sachten (zeitweisen) Abwesenheit der Eltern in der Öffentlichkeit dieser Länder ver-	151.6561279296875	351.68353271484375	10.0	348.6982421875	41
handelt? Wenn ja, wie? Wie sehen die Migrantinnen selbst ihre Rolle als transnationale	151.6561279296875	363.68353271484375	10.0	348.720947265625	41
Mütter und wie gehen die betroffenen Kinder, Ehepartner oder (Groß-)Eltern damit um?	151.6561279296875	375.68353271484375	10.0	348.70904541015625	41
Transnationale Elternschaft und zurückbleibende Kinder	151.6561279296875	399.88812255859375	10.0	262.659912109375	42
In neueren Studien zum Thema Elternschaft beziehungsweise Mutterschaft aus der Di-	151.6561279296875	423.68353271484375	10.0	348.6990051269531	43
stanz, die sich vor allem mit der Situation der zurückgelassenen Kinder beschäftigen,	151.6561279296875	435.68353271484375	10.0	348.70098876953125	43
lassen sich drei Argumentationsstränge unterscheiden:	151.6561279296875	447.68353271484375	10.0	217.00717163085938	43
1. Studien, die die positiven Effekte der Migration der Eltern in den Blick nehmen	151.6561279296875	471.68353271484375	10.0	348.7007141113281	44
und auf einen positiven Zusammenhang zwischen dem Schulerfolg nicht-migrierter	168.66392517089844	483.68353271484375	10.0	331.7019500732422	44
Kinder und deren ﬁnanzieller Unterstützung durch ihre Eltern verweisen (vgl. Ni-	168.66392517089844	493.63201904296875	12.051513671875	331.6868133544922	44
cholas 2008).	168.66357421875	507.68353271484375	10.0	53.8800048828125	44
2. Forschungen, die eher die negativen Effekte des care drain betonen, insbesondere	151.65577697753906	519.6835327148438	10.313720703125	348.6668243408203	44
die Konsequenzen der Abwesenheit von Müttern minderjähriger Kinder (vgl. Par-	168.66360473632812	531.6835327148438	10.0	331.6763916015625	44
reñas 2005; Gamburd 2000; Phoenix 2009).	168.66360473632812	543.6835327148438	10.0	175.54000854492188	44
3. Studien, die den Standpunkt vertreten, dass die Folgen transnationaler Mutterschaft/	151.6558074951172	555.6835327148438	10.0	348.70484924316406	44
Elternschaft sich weder als ausschließlich negativ noch als ausschließlich positiv	168.66360473632812	567.6835327148438	10.0	331.6950378417969	44
charakterisieren lassen.	168.66360473632812	579.6835327148438	10.0	93.30001831054688	44
Vielmehr, so die Soziologinnen Hondagneu-Sotelo/Avila (1997) sowie ansatzweise auch	151.6558074951172	603.6835327148438	10.0	348.69309997558594	45
Parreñas (2005), müsse jede seriöse Bewertung multiple Faktoren berücksichtigen; so etwa	151.6558074951172	615.6835327148438	10.0	348.69984436035156	45
GENDER 1 | 2011	445.84869384765625	675.3643188476562	7.0228271484375	54.466522216796875	46
12	151.6540069580078	46.2078857421875	8.0	8.89599609375	47
Helma Lutz, Ewa Palenga-Möllenbeck	359.16900634765625	46.2078857421875	8.0	141.14718627929688	48
den Zusammenhang zwischen den vor Ort organisierten Betreuungsarrangements und den	151.6540069580078	87.68353271484375	10.0	348.69688415527344	49
damit verbundenen Effekten für die Kinder transnationaler Familien, aber auch die Ge-	151.6540069580078	99.68353271484375	10.0	348.71070861816406	49
schlechterbeziehungen, die bei diesen Arrangements eine zentrale Rolle spielen, sowie	151.6540069580078	111.68353271484375	10.0	348.71678161621094	49
die Frage danach, wie die primäre Verantwortung für Care-Arbeit intra- und extrafamiliär	151.6540069580078	123.68353271484375	10.0	348.7130584716797	49
(um-)verteilt wird. Insgesamt deuten diese Studien darauf hin, dass Geschlechternormen	151.6540069580078	135.68353271484375	10.0	348.70286560058594	49
und -ideologien, die in direktem Zusammenhang mit vergeschlechtlichter Arbeitsvertei-	151.6540069580078	147.68353271484375	10.0	348.7178192138672	49
lung stehen, in den jeweiligen Entsendeländern für die Betreuungsarrangements in trans-	151.6540069580078	159.68353271484375	10.0	348.7097930908203	49
