in ihrer Nachbarschaft und ihrem Freundeskreis viele migrierende Frauen. Sie äußern	151.65524291992188	459.68353271484375	10.0	348.6999816894531	139
sich dazu nicht unbedingt begeistert, akzeptieren diese Tatsache jedoch dann, wenn sie	151.65524291992188	471.68353271484375	10.0	348.7091979980469	139
mit Freunden das gleiche Schicksal teilen, ohne mit ihnen jedoch über dieses Thema zu	151.65524291992188	483.68353271484375	10.0	348.7164001464844	139
sprechen oder vielleicht sprechen zu müssen. Auf einem Bild, das Dawid zur Illustration	151.65524291992188	495.68353271484375	10.0	348.7041931152344	139
seines „Alltagslebens mit und ohne Mama“ für uns gezeichnet hat, sind keine Menschen	151.65524291992188	507.68353271484375	10.0	348.7020568847656	139
zu sehen. Auf die Frage, warum dies so sei, antwortete er: „Es gibt keine Menschen,	151.65524291992188	519.6835327148438	10.0	348.6812438964844	139
weil Mama auf der Arbeit ist und Papa auch; normalerweise bin ich allein zuhause.“ Der	151.65524291992188	531.6835327148438	10.0	348.7110900878906	139
Junge hat ganz offenbar die transnationalen Arbeitsorte seiner Eltern hier ‚normalisiert‘,	151.65524291992188	543.6835327148438	10.0	348.70794677734375	139
als gleichwertig behandelt; wichtig für ihn ist vor allem der menschenleere Haushalt,	151.65524291992188	555.6835327148438	10.0	348.7070007324219	139
den er vorﬁndet, wenn er nach Hause kommt, und den identiﬁziert er als Folge der Ar-	151.65524291992188	565.6320190429688	12.051513671875	348.670654296875	139
beitssituation und nicht unbedingt der Migration.	151.65509033203125	579.6835327148438	10.0	196.1099853515625	139
GENDER 1 | 2011	445.84869384765625	675.3653564453125	7.0228271484375	54.466522216796875	140
24	151.6540069580078	46.20684814453125	8.0	8.89599609375	141
Schlussfolgerungen	151.6540069580078	88.44488525390625	12.0	110.66398620605469	142
Helma Lutz, Ewa Palenga-Möllenbeck	359.16900634765625	46.20684814453125	8.0	141.14718627929688	143
Im Gegensatz zu der eingangs beschriebenen Deﬁnition der global care-chains durch	151.6540069580078	112.03399658203125	12.051513671875	348.68211364746094	144
Arlie Hochschild, in der die Kommerzialisierung von Care-Arbeit eine Kettenreaktion	151.65426635742188	126.08551025390625	10.0	348.7010192871094	144
zwischen (relativ) reicheren und ärmeren Ländern darstellt, haben wir in unserer Studie	151.65426635742188	138.08551025390625	10.0	348.71197509765625	144
keinen einzigen Fall gefunden, in dem eine migrierende Mutter auf eine Mutterersatz-	151.65426635742188	150.08551025390625	10.0	348.7160339355469	144
Migrantin zurückgegriffen hat; stattdessen überwiegen ‚unbezahlte‘ Betreuungsarran-	151.65426635742188	162.08551025390625	10.0	348.6988220214844	144
gements, die von weiblichen Verwandten getragen werden, primär von Großmüttern.	151.65426635742188	174.08551025390625	10.0	348.6951904296875	144
Allerdings proﬁtieren diese Betreuungspersonen auch direkt oder indirekt von den	151.65426635742188	184.03399658203125	12.051513671875	348.69268798828125	144
Einkünften der Migrantinnen. Der Staat als Betreuungsleister (etwa der Kinderbetreu-	151.65420532226562	198.08551025390625	10.0	348.69696044921875	144
ung) taucht hier nicht auf – besser gesagt, er taucht ab. Wie bereits in früheren Studien	151.65420532226562	210.08551025390625	10.0	348.7001037597656	144
(Lutz 2007; Rerrich 2006) festgestellt, handelt es sich bei der Gruppe der Arbeitgebe-	151.65420532226562	222.08551025390625	10.0	348.692138671875	144
rInnen um ein Mittelschichtsphänomen der Aufnahmeländer, in unserem Fall sind die	151.65420532226562	234.08551025390625	10.0	348.6980285644531	144
polnischen ArbeitgeberInnen nicht identisch mit den Migrantinnen, die in Deutschland	151.65420532226562	246.08551025390625	10.0	348.70703125	144
arbeiten, sondern VertreterInnen der städtischen Mittelklasse. Auch die Mehrzahl der	151.65420532226562	258.08551025390625	10.0	348.7022399902344	144
Arbeitnehmerinnen – in unserem Fall der Polinnen und Ukrainerinnen, die Care-Arbeit	151.65420532226562	270.08551025390625	10.0	348.70001220703125	144
verrichten – unterscheidet sich in der Bildungslage wenig von der der ArbeitgeberInnen.	151.65420532226562	282.08551025390625	10.0	348.7038879394531	144
Aus unterschiedlichsten Gründen zählen sie allerdings zu den ökonomischen Verlie-	151.65420532226562	294.08551025390625	10.0	348.6980895996094	144
rerinnen der neoliberalen Transformationsregime und trachten mithilfe der Migration,	151.65420532226562	306.08551025390625	10.0	348.7109069824219	144
ihren Mittelschichtsstatus zu erhalten beziehungsweise zu verbessern.	151.65420532226562	318.08551025390625	10.0	279.1100158691406	144
Weiterhin zeigen die Ergebnisse unserer Forschung, wie komplex sich die Frage des	168.66200256347656	330.08551025390625	10.0	331.69020080566406	144
‚Care-Replacement‘ gestaltet und dass gerade hier eine genaue Betrachtung der Speziﬁ-	151.65420532226562	340.03399658203125	12.051513671875	348.66107177734375	144
ka transnationaler Betreuungsarrangements wichtig ist, um der mächtigen Diskursﬁgur	151.654296875	352.03399658203125	12.051513671875	348.6608581542969	144
‚Euro-Waisen‘ eine differenzierte Sichtweise gegenüberzustellen. Horrorszenarien, wie	151.6541748046875	366.08551025390625	10.0	348.7121276855469	144
sie in der Presse der Herkunftsländer gepﬂegt und mittlerweile auch von vielen NGOs	151.6541748046875	376.03399658203125	12.051513671875	348.681884765625	144
übernommen werden, sind wenig hilfreich für die Abbildung der realen Probleme in	151.6551971435547	390.08551025390625	10.0	348.68714904785156	144
den Haushalten vor Ort. Ganz im Gegenteil: Sie üben einen zusätzlichen Legitimati-	151.6551971435547	402.08551025390625	10.0	348.70896911621094	144
onsdruck auf die Mütter aus. Unsere Ergebnisse weisen darauf hin, dass ein gelungenes	151.6551971435547	414.08551025390625	10.0	348.68321228027344	144
Betreuungsverhältnis abhängt von der Qualität der Betreuung, etwa von der durch die	151.6551971435547	426.08551025390625	10.0	348.6940460205078	144
Betreuenden vor Ort geleisteten emotionalen Arbeit, und der Organisation des transna-	151.6551971435547	438.08551025390625	10.0	348.6968536376953	144
tionalen Kontakts mit der Mutter.	151.6551971435547	450.08551025390625	10.0	133.60780334472656	144
Wir sehen auch, dass die Familien der Migrantinnen sowohl in den Entsende- als	168.66339111328125	462.08551025390625	10.000015258789062	331.6878662109375	144
auch in den Aufnahmeländern unter fehlender Unterstützung leiden. Entsendeländer be-	151.6551971435547	474.08551025390625	10.0	348.7081756591797	144
trachten ihre Migranten als „Investoren“ ihrer Volkswirtschaften, wobei die sozialen	151.6551971435547	486.08551025390625	10.0	348.7050323486328	144
Kosten den Individuen überlassen bleiben. Dasselbe gilt für die Aufnahmeländer, in	151.6551971435547	498.08551025390625	10.0	348.6891326904297	144
denen Migrantinnen als unmittelbar ökonomisch nützliche, temporäre Arbeitskräfte be-	151.6551971435547	510.08551025390625	10.0	348.7162322998047	144
handelt werden, vergleichbar mit dem früheren GastarbeiterInnensystem, bei dem die	151.6551971435547	522.0855102539062	10.0	348.7069549560547	144
Verantwortung, in kulturelles Kapital zu investieren und soziale Risiken einzugehen,	151.6551971435547	534.0855102539062	10.0	348.7051544189453	144
auf die Entsendeländer und die Individuen verschoben wurde. Die Diskussion über Mi-	151.6551971435547	546.0855102539062	10.0	348.6870574951172	144
gration und Care ist auch deshalb problematisch, weil sie von normativen Vorstellungen	151.6551971435547	558.0855102539062	10.0	348.7069854736328	144
wie etwa geschlechtsspeziﬁschen Normen über Care-Arbeit geprägt ist, in die die Ver-	151.6551971435547	568.0339965820312	12.051513671875	348.6804962158203	144
änderungen und Verschiebungen von Erwerbsarbeit (noch) keinen Eingang gefunden	151.65545654296875	582.0855102539062	10.0	348.6922607421875	144
haben. Die Debatte über transnationale Mutterschaft hat gerade erst begonnen; sie muss	151.65545654296875	594.0855102539062	10.0	348.7090759277344	144
fortgeführt werden durch Längsschnittstudien zur Beschreibung langfristiger und kurz-	151.65545654296875	606.0855102539062	10.0	348.6919250488281	144
fristiger Effekte von care drain für die betroffenen Angehörigen und Kinder.	151.65545654296875	618.0855102539062	10.313720703125	306.13092041015625	144
GENDER 1 | 2011	151.6540069580078	675.36328125	7.0228271484375	54.46693420410156	145
Das Care-Chain-Konzept auf dem Prüfstand	151.6540069580078	46.20684814453125	8.0	163.14561462402344	146
25	491.41900634765625	46.20684814453125	8.0	8.89599609375	147
Literaturverzeichnis	151.6540069580078	88.44488525390625	12.0	111.36000061035156	148
Abadan-Unat, Nermin. (Hrsg.). (1985). Frauen in der türkischen Gesellschaft. Frankfurt a. M.:	151.6540069580078	113.68035888671875	9.2823486328125	348.6652069091797	149
Dagyeli Verlag	168.6619873046875	124.4803466796875	9.0	54.073028564453125	149
Badinter, Elisabeth. (2010). Der Konﬂikt. Die Frau und die Mutter. München: C. H. Beck Verlag	151.65379333496094	135.28033447265625	9.2823486328125	347.6671905517578	149
Bereswill, Mechthild; Scheiwe, Kirsten & Wolde, Anja (Hrsg.). (2006). Vaterschaft im Wandel.	151.6540069580078	146.080322265625	9.2823486328125	348.6696014404297	149
Multidisziplinäre Analysen und Perspektiven aus geschlechtertheoretischer Sicht. Weinheim	168.6620330810547	156.88031005859375	9.2823486328125	331.6620330810547	149
und München: Juventa Verlag	168.66204833984375	167.6802978515625	9.0	107.56988525390625	149
Children’s Ombudsman Institution of the Republic of Lithuania. (2007). The research concerning	151.6538543701172	178.48028564453125	9.2823486328125	348.6661834716797	149
the security and implementation of the rights of children deprived of parental care due to the	168.66188049316406	189.562255859375	9.0	331.7024383544922	149
departure of their parents to the foreign countries. Report (unveröffentlicht)	168.66188049316406	200.07989501953125	9.2823486328125	273.79627990722656	149
Danilewicz, Wioletta. (2006). Sytuacja życiowa dzieci w rodzinach migracyjnych. Białystok:	151.65386962890625	210.8798828125	9.2823486328125	348.6631164550781	149
Trans Humana	168.6619873046875	221.67987060546875	9.0	52.91802978515625	149
Dayton-Johnson, Jeff; T. Katseli, Louka & Xenogiani, Anna di Mattia. (2007). Policy Coherence	151.65379333496094	232.4798583984375	9.2823486328125	348.6730499267578	149
for Development: Migration and Developing Countries. Paris: Technical report, Organisation	168.66183471679688	243.27984619140625	9.2823486328125	331.67138671875	149
for Economic Co-Operation and Development	168.66184997558594	254.079833984375	9.0	166.96803283691406	149
Doucet, Andrea. (2006). Do men mother? Fathering, care and domestic responsibility. Toronto:	151.65365600585938	264.87982177734375	9.2823486328125	348.6665344238281	149
Toronto University Press	168.66156005859375	275.6798095703125	9.0	89.86669921875	149
Doucet, Andrea. (2010). Dad and Baby in the First Year: Gendered Responsibilities and	151.6533660888672	286.47979736328125	9.0	348.68556213378906	149
Embodiment. The ANNALS of the American Academy of Political and Social Science, 624,	168.66156005859375	297.2793884277344	9.2823486328125	331.6521911621094	149
78–98	168.66156005859375	308.0793762207031	9.0	22.5	149
Duncan, Simon & Edwards, Rosalind. (1999). Lone Mothers, paid work and gendered moral	151.6533660888672	318.8793640136719	9.2823486328125	348.6638946533203	149
rationalities. London: Palgrave Macmillan	168.66036987304688	329.6793518066406	9.2823486328125	153.99099731445312	149
Edwards, Rosalind; Doucet, Andrea & Furstenberg, F. Frank. (Hrsg.). (2009). Fathering across	151.65216064453125	340.4793395996094	9.0	348.6697692871094	149
Diversity and Adversity: International Perspectives and Policy Interventions. The ANNALS	168.6603546142578	351.2793273925781	9.2823486328125	331.6559295654297	149
of the American Academy of Political and Social Science, (624)	168.66036987304688	362.0793151855469	9.2823486328125	229.10403442382812	149
Gamburd, Michele Ruth (2000). The kitchen spoon’s handle. Transnationalism and Sri Lanka’s	151.6523895263672	372.8793029785156	9.2823486328125	348.6658477783203	149
migrant housemaids. Ithaka, London: Cornell University Press	168.660400390625	383.6792907714844	9.2823486328125	225.99099731445312	149
Golinowska, Stanisława; Bednarski, Marek; Broda-Wysocki, Piotr; Domaradzka, Ewa;	151.65219116210938	394.4792785644531	9.252716064453125	348.6808776855469	149
Korczyńska, Joanna; Marek, Edward; Morecka, Zoﬁa & Rajkiewicz, Antoni. (2004). Popyt	168.65960693359375	403.4328918457031	11.12872314453125	331.6578369140625	149
na pracę cudzoziemców. Polska i sąsiedzi. Warszawa: IPiSS	168.659423828125	416.0792541503906	9.2823486328125	216.16921997070312	149
Grunow, Daniela. (2007). Wandel der Geschlechterrollen und Väterhandeln im Alltag. In Tanja	151.6515350341797	426.8792419433594	9.0	348.70497131347656	149
Mühling & Harald Rost (Hrsg.), Väter im Blickpunkt. Perspektiven der Familienforschung	168.65972900390625	437.6792297363281	9.2823486328125	331.6775207519531	149
(S. 49–76). Opladen, Farmington Hills: Verlag Barbara Budrich	168.65972900390625	448.4792175292969	9.0	229.31185913085938	149
Hays, Sharon. (1996). The cultural contradictions of motherhood. New Haven, London: Yale	151.6515350341797	459.2792053222656	9.2823486328125	348.6696319580078	149
University Press	168.6597442626953	470.0792236328125	9.000015258789062	59.24700927734375	149
Hochschild, Arlie R. (2000). Global Care Chains and Emotional Surplus Value. In Anthony	151.65155029296875	480.87921142578125	9.0	348.6781311035156	149
Giddens & Will Hutton (Hrsg.), On the Edge. Living with Global Capitalism (S. 130–146).	168.6597442626953	491.67919921875	9.2823486328125	331.65220642089844	149
London: Jonathan Cape	168.65975952148438	502.4792175292969	9.0	85.49099731445312	149
Hochschild, Arlie R. & Ehrenreich, Barbara. (2002). Global Woman: Nannies, Maids and Sex	151.6515655517578	513.2792358398438	9.28228759765625	348.66297912597656	149
Workers in the New Economy. New York: Metropolitan Press	168.65858459472656	524.0792236328125	9.2823486328125	220.1503143310547	149
Hochschild, Arlie R. (2003). The Commercialization of Intimate Life: Notes from Home and Work.	151.65060424804688	534.8792114257812	9.2823486328125	348.6609802246094	149
Berkeley: University of California Press	168.6575927734375	545.67919921875	9.0	144.98101806640625	149
Hondagneu-Sotelo, Pierrette & Avila, Ernestine. (1997). “I’m Here, but I’m There”: The Meanings	151.64939880371094	554.6328735351562	10.84637451171875	348.67250061035156	149
of Latina Transnational Motherhood. Gender & Society, 11 (5), 548–571	168.6561737060547	567.2792358398438	9.2823486328125	261.6191864013672	149
IOM. (2008). Zugriff am 12. November 2010 unter www.iom.org.ua/index.php?page=news&id=	151.64735412597656	578.0792236328125	9.0	348.68040466308594	149
187&type=news	168.65554809570312	588.8792724609375	9.0	59.57099914550781	149
Jurczyk, Karin; Schier, Michaela; Szymenderski, Peggy; Lange, Andreas & Voß, G. Günter.	151.64735412597656	599.6792602539062	9.0	348.6847686767578	149
(2009). Entgrenzte Arbeit – entgrenzte Familie. Grenzmanagement im Alltag als neue	168.65554809570312	610.479248046875	9.28314208984375	331.686279296875	149
Herausforderung. Forschung aus der Hans-Böckler-Stiftung, Bd. 100. Berlin: Sigma	168.6610565185547	621.280029296875	9.2823486328125	304.47080993652344	149
GENDER 1 | 2011	445.84869384765625	675.36328125	7.0228271484375	54.466522216796875	150
26	151.6540069580078	46.2078857421875	8.0	8.89599609375	151
Helma Lutz, Ewa Palenga-Möllenbeck	359.16900634765625	46.2078857421875	8.0	141.14718627929688	152
Kałwa, Dobrochna. (2007). „So wie zu Hause“. Die private Sphäre als Arbeitsplatz. In Magdalena	151.6540069580078	87.785400390625	9.252685546875	348.69313049316406	153
Nowicka (Hrsg.), Von Polen nach Deutschland und zurück. Die Arbeitsmigration und ihre	168.661376953125	98.58538818359375	9.2823486328125	331.6687927246094	153
Herausforderungen für Europa (S. 205–225). Bielefeld: transcript	168.661376953125	109.3853759765625	9.2823486328125	237.81503295898438	153
Kępińska, Ewa. (2007). Recent Trends in International Migration. The 2007 SOPEMI Report for	151.65338134765625	120.18536376953125	9.2823486328125	348.6783752441406	153
Poland. CMR Working Papers, Nr. 29 (87). Warszawa. Zugriff am 12. November 2010 unter	168.6600341796875	130.9849853515625	9.2823486328125	331.663818359375	153
www.migracje.uw.edu.pl/publ/558/	168.6600341796875	141.78497314453125	9.0	126.82086181640625	153
Kicinger, Anna. (2005). Between polish interests and the EU inﬂuence – polish migration policy	151.65184020996094	152.5849609375	9.2823486328125	348.67320251464844	153
development 1989–2004. CEFMR Working Paper 9. Warszawa. Zugriff am 15. März 2007	168.65963745117188	163.38494873046875	9.2823486328125	331.6641540527344	153
unter www.cefmr.pan.pl/docs/cefmr_wp_2005-09.pdf	168.6596221923828	174.1849365234375	9.0	193.62510681152344	153
Klaveren van, Maarten; Tijdens, Kea; Hughie-Williams, Melanie & Ramos Martin, Nuria. (2010).	151.65142822265625	184.98492431640625	9.0	348.70416259765625	153
Ukraine - An Overview of Women’s Work, Minimum Wages and Employment. Decisions for	168.6596221923828	195.784912109375	9.2823486328125	331.6533966064453	153
Life MDG3 Project Country Report No. 8. Zugriff am 12. November 2010 unter www.	168.65960693359375	206.58489990234375	9.0	331.66583251953125	153
uva-aias.net/uploaded_ﬁles/publications/WP94-Klaveren,Tijdens,Hughie-Williams,Ramos-	168.65960693359375	215.53851318359375	10.84637451171875	331.6754150390625	153
Ukraine.pdf	168.6592254638672	228.18487548828125	9.0	43.235992431640625	153
Kotowska, Irena; Sztanderska, Urszula & Wóycicka, Irena. (2007). Aktywność zawodowa	151.65103149414062	238.98486328125	9.2823486328125	348.660888671875	153
i edukacyjna a obowiązki rodzinne w Polsce: w świetle badań empirycznych. Warszawa:	168.658935546875	249.78485107421875	9.2823486328125	331.65863037109375	153
Wydawnictwo Naukowe Scholar	168.6590576171875	260.5844421386719	9.0	118.43008422851562	153
Ludwig, Isolde; Schlevogt, Vanessa; Klammer, Ute & Gerhard, Ute. (2002). Managerinnen des	151.65086364746094	271.3844299316406	9.2823486328125	348.66343688964844	153
Alltags. Strategien erwerbstätiger Mütter in Ost- und Westdeutschland. Berlin: edition sigma	168.65890502929688	282.1844177246094	9.2823486328125	331.6702880859375	153
Lutz, Helma. (2007). Vom Weltmarkt in den Privathaushalt. Die neuen Dienstmädchen im	151.65188598632812	292.9844055175781	9.2823486328125	348.6789855957031	153
Zeitalter der Globalisierung. Opladen: Verlag Barbara Budrich	168.6600799560547	303.7843933105469	9.2823486328125	227.05299377441406	153
Malynovska, Olena A. (2006). Trans-border Migration of Population of the Ukrainian Western	151.65206909179688	314.5843811035156	9.0	348.6822509765625	153
Frontier Areas in the Context EU Enlargement (based on survey’s results in Volyn, Zakarpattya	168.66026306152344	325.3843688964844	9.0	331.6876983642578	153
and Lviv oblasts). In Krystyna Iglicka (Hrsg.), Transnational Migration – Dillemas (S. 81–	168.66026306152344	336.1843566894531	9.2823486328125	331.65037536621094	153
87). Warszawa: Fundacja Centrum Stosunków Międzynarodowych	168.66021728515625	346.9843444824219	9.2823486328125	241.06002807617188	153
Marody, Mirosława & Giza-Poleszczuk, Anna. (2000). Być kobietą, być mężczyzną – czyli o	151.65223693847656	357.7843322753906	9.252716064453125	348.6635284423828	153
przemianach tożsamości związanej z płcią we współczesnej Polsce. In Mirosława, Marody	168.65667724609375	368.5843200683594	9.252716064453125	331.6529235839844	153
(Hrsg.), Między rynkiem a etatem. Społeczne negocjowanie polskiej rzeczywistości (S. 44–	168.65469360351562	379.3843078613281	9.2823486328125	331.65277099609375	153
74). Warszawa: Scholar	168.6556396484375	390.1842956542969	9.0	85.33641052246094	153
Matzner, Michael. (2007). Alleinerziehende Väter – eine schnell wachsende Familienform. In Tanja	151.64744567871094	400.9842834472656	9.0	348.7111053466797	153
Mühling & Harald Rost (Hrsg.), Väter im Blickpunkt. Perspektiven der Familienforschung	168.6556396484375	411.7842712402344	9.2823486328125	331.67852783203125	153
(S. 225–242). Opladen, Farmington Hills: Verlag Barbara Budrich	168.66064453125	422.5842590332031	9.0	238.31185913085938	153
Metz-Göckel, Sigrid; Münst, A. Senganata & Kałwa, Dobrochna. (2010). Migration als Ressource.	151.65245056152344	433.3842468261719	9.2823486328125	348.6656036376953	153
Zur Pendelmigration polnischer Frauen in Privathaushalte der Bundesrepublik. Opladen,	168.66046142578125	444.1842346191406	9.2823486328125	331.655517578125	153
Farmington Hills: Verlag Barbara Budrich	168.66046142578125	454.9842224121094	9.0	151.82281494140625	153
Mikuła, Joanna. (Hrsg.). (2008). Eurosieroctwo 2008. Warszawa: Studium Prawa Europejskiego:	151.6522674560547	465.78424072265625	9.282318115234375	348.67640686035156	153
Instytut Europejski	168.6604461669922	476.584228515625	9.0	68.75099182128906	153
Mühling, Tanja & Rost, Harald. (Hrsg.). (2007). Väter im Blickpunkt. Perspektiven der	151.65225219726562	487.38421630859375	9.2823486328125	348.681396484375	153
Familienforschung. Opladen, Farmington Hills: Verlag Barbara Budrich	168.66024780273438	498.1842346191406	9.282318115234375	259.8076171875	153
Nicholas, Tekla. (2008). Remittances, Education, and Family Reuniﬁcation: Transnational Strategies	151.65286254882812	508.9842529296875	9.2823486328125	348.7204895019531	153
of Haitian Immigrant Families in South Florida. Paper read at the Workshop “Transnational	168.6604461669922	519.7842407226562	9.2823486328125	331.67396545410156	153
Parenthood and children-left-behind”, Oslo, 20–21.11.2008, 149–174 (in Vorbereitung)	168.66046142578125	530.584228515625	9.0	306.8265686035156	153
OSCE. (2009). Guide on Gender-sensitive labour migration policies. Zugriff am 18. Mai 2009	151.6522674560547	541.38427734375	9.28228759765625	348.66664123535156	153
unter www.osce.org/publications/eea/2009/05/37689_1289_en.pdf	168.66026306152344	552.1842651367188	9.0	239.7240753173828	153
Parreñas, Rhacel S. (2005). Children of Global Migration. Transnational Families and Gendered	151.65206909179688	562.9842529296875	9.2823486328125	348.6776123046875	153
Woes. California: Stanford	168.65948486328125	573.7842407226562	9.2823486328125	95.41098022460938	153
Phoenix, Ann. (2009). Idealisierung emotionaler Bindung oder materielle Versorgung?	151.65127563476562	584.584228515625	9.0	348.6916809082031	153
Transnationale Mutterschaft und Kettenmigration. In Helma Lutz (Hrsg.), Gender-Mobil?	168.6594696044922	595.38427734375	9.282356262207031	331.6569366455078	153
Geschlecht und Migration in transnationalen Räumen (S. 86–101). Münster: Westfälisches	168.65945434570312	606.1842651367188	9.2823486328125	331.6589050292969	153
Dampfboot	168.65943908691406	616.9842529296875	9.0	40.9949951171875	153
GENDER 1 | 2011	151.6540069580078	675.3653564453125	7.0228271484375	54.46693420410156	154
Das Care-Chain-Konzept auf dem Prüfstand	151.6540069580078	46.2078857421875	8.0	163.14561462402344	155
27	491.41900634765625	46.2078857421875	8.0	8.89599609375	156
Plomien, Ania. (2009). Welfare state, gender, and reconciliation of work and family in Poland:	151.6540069580078	87.785400390625	9.0	348.7107696533203	157
Policy developments and practice in a new EU member. Social Policy & Administration, 43	168.66220092773438	98.58538818359375	9.2823486328125	331.6533203125	157
(2), 136–151	168.66220092773438	109.3853759765625	9.0	46.49400329589844	157
Rerrich, Maria. (2006). Die ganze Welt zu Hause. Cosmobile Putzfrauen in privaten Haushalten.	151.6540069580078	120.18536376953125	9.2823486328125	348.6608123779297	157
Hamburg: Hamburger Edition	168.66082763671875	130.9849853515625	9.0	108.16009521484375	157
Suárez-Orozco, Carola; Todorova, Irina & Louie, Josephine. (2002). Making Up For Lost	151.6526336669922	141.78497314453125	9.0	348.68800354003906	157
Time: The Experience of Separation and Reuniﬁcation Among Immigrant Families. Family	168.66082763671875	150.73858642578125	11.12872314453125	331.6587219238281	157
Processes, 41 (4), 625–643	168.66152954101562	163.38494873046875	9.2823486328125	97.90060424804688	157
Stiehler, Sabine. (2000). Alleinerziehende Väter. Sozialisation und Lebensführung. Weinheim:	151.65333557128906	174.1849365234375	9.2823486328125	348.67088317871094	157
Juventa Verlag	168.66082763671875	184.98492431640625	9.0	53.073822021484375	157
Szelewa, Dorota & Polakowski, Michał P. (2008). Who cares? Changing patterns of childcare in	151.6526336669922	195.784912109375	9.252685546875	348.68190002441406	157
Central and Eastern Europe. Journal of European Social Policy, 18 (2), 115–31	168.66004943847656	206.58489990234375	9.2823486328125	285.7633819580078	157
Urbańska, Sylwia. (2009). Matka na emigracji. Perspektywa transnarodowości w badaniu	151.65234375	217.3848876953125	9.252716064453125	348.6649169921875	157
przemian ról rodzicielskich. Studia Migracyjne - Przegląd Polonijny, 1, 61–84	168.6590576171875	228.18487548828125	9.2823486328125	282.436279296875	157
Walczak, Bartłomiej. (2008). Społeczne, edukacyjne i wychowawcze konsekwencje migracji	151.65032958984375	238.98486328125	9.2823486328125	348.6862487792969	157
rodziców i opiekunów prawnych uczniów szkół podstawowych, gimnazjalnych i ponadgimna-	168.65802001953125	250.01071166992188	9.056488037109375	331.6615905761719	157
zjalnych. Pedagogikum. Wyższa szkoła pedagogiki resocjalizacyjnej w Warszawie. Zugriff	168.65841674804688	260.5844421386719	9.2823486328125	331.68145751953125	157
